company_name,country,job_description,job_field,job_title,job_type,non_remote_location,post_date,rating,salary
Link Group,AUSTRALIA,  Lead and facilitate control and data integrity business forums to engage and collaborate with business leaders on outcomes of strengthening our control…,data analyst,Business Control Framework Analyst,,Melbourne VIC,2022-07-17,2.7,
Robert Walters,AUSTRALIA,"  Good understanding of data repository systems (business intelligence infrastructures). Assist in the identification and capture of relevant enterprise data, in…",data analyst,Data Analyst,,Sydney NSW,2022-07-26,3.6,
ING,AUSTRALIA,  Liaising with external data providers/stakeholders. Advanced skills in Excel and PowerPoint and the ability to effectively communicate a story through data …,data analyst,Customer Insights Analyst - 3 months fixed term contract,full-time,Sydney NSW,2022-07-17,3.9,
Axsys,AUSTRALIA,"  Experience with analysing multi-channel data. Ability in producing data visualization, analysis and dashboards. 4+ years' experience in this or equivalent role.",data analyst,Sales Operations Analyst,,Melbourne VIC,2022-08-05,,
Victoria Police,AUSTRALIA,"  Analyse financial data and create financial models for decision support. The Senior Business Analysts will provide specialist advice, financial modelling and…",data analyst,Senior Business Analyst,full-time,Melbourne City Centre VIC+1 location,2022-08-12,3.5,
Minutes To Seconds,AUSTRALIA,  Be responsible primarily for ensuring data quality and accuracy with integration solutions. Proactively monitor APIs deployed in our production environments and…,data analyst,Senior Business Analyst (Melbourne),full-time,Melbourne VIC,2022-07-17,,
Commonwealth Bank,AUSTRALIA,"  Undertake processes for investigating and analysing data with respect to incidents (reportable and non-reportable), and linkage to issue management.",data analyst,"Senior Analyst, Risk",full-time,Sydney Central Business District NSW,2022-08-11,4.0,
Save the Children Australia,AUSTRALIA,"  …You take a user-centric approach to delivery, informed by insights, data, research and analysis. In this full-time, 12-month fixed term position, based in our…",data analyst,Senior Business Analyst,full-time,Temporarily Remote in Carlton VIC,2022-08-13,4.1,
Experis,AUSTRALIA,  Knowledge of both quantitative and qualitative data analyses. Provide data analytic assistance and training to other Agency staff.,data analyst,Data Analyst /Statistician,contract,Sydney NSW,2022-08-05,3.5,
Talent,AUSTRALIA,"  Experience delivering data projects (data lakes, migrations to cloud etc.). Your new role will see you play a key role in the design and delivery of a new data…",data analyst,Senior Business Analyst - Data,contract,Remote in Melbourne VIC,2022-08-07,,
Visa,AUSTRALIA,"  Explore our clients’ data infrastructure and systems, extract necessary data, perform data analysis, visualise findings to understand key marketing patterns and…",data analyst,Campaign &amp; Insights Analyst,full-time,Temporarily Remote in Sydney NSW,2022-07-17,3.9,
Deloitte,AUSTRALIA,"  Solid quantitative, analytical, and data modelling skills; Deloitte Consulting is looking for a technical owner to evaluate, design, develop, and maintain a set…",data analyst,Technical Business Analyst - Commercial Strategy,,Melbourne VIC 3000,2022-07-17,3.9,
RACV,AUSTRALIA,  Establish and maintain operational processes to ensure the ongoing maintenance of financial data and reporting solutions. Permanent Full Time | Hybrid working.,data analyst,Group Reporting Analyst,permanent,Hybrid remote in Melbourne VIC,2022-07-17,3.4,
"Department of Industry, Science, Energy &amp;...",AUSTRALIA,  These analyses may often require working with unit record data. Undertake data analysis using existing databases to support the team’s work.,data analyst,"Economic Analysis and Data Officer, APS Level 5, Analysis an...",internship,Canberra ACT,2022-07-20,,
NSW Government -Customer Strategy &amp; Technology,AUSTRALIA,"  We implement new technologies, leverage data and insights, drive innovation and build partnerships to develop and deliver customer-centred products and…",data analyst,Senior Business Analyst,undefined,Hybrid remote in Sydney NSW,2022-08-04,,138670-155309
PPG Industries,AUSTRALIA,"  Strong SAP and data analytics experience (eWM, WM, SD, MM modules). This fixed term role, running through until the end of 2023, will have you responsible for…",data analyst,Logistics Analyst,,Clayton VIC,2022-07-20,3.4,
Optus,AUSTRALIA,"  In this fast-paced role, you will coordinate the governance of the enterprise-wide Supplier Risk Management program, and hold internal customers accountable to…",data analyst,Supplier Risk Analyst,,Sydney NSW,2022-07-17,3.7,
Link Group,AUSTRALIA,  This will be the customer facing first point of connection with Link Group IT and perform first level technical support to Link Group core business applications…,data analyst,IT Support Analyst,,Parramatta NSW 2150,2022-07-17,2.7,
Macquarie Group Limited,AUSTRALIA,"  Experience as a senior investment analyst, equity strategy, portfolio manager and have been deemed a high performer. Work type: Permanent - Full time.",data analyst,Senior Equity Research Analyst,permanent,Sydney NSW,2022-08-11,3.8,
SOS Recruitment Australia,AUSTRALIA,"  Be proficient with using Excel to store and analyse data, including formulas and data manipulation. Relevant qualifications and demonstrated experience in…",data analyst,Data Analyst,contract,Canberra ACT,2022-07-29,,
NSW Government -NSW Education Standards Authority,AUSTRALIA,"  Demonstrated experience with drawing inferences and telling stories from data, such in designing and conducting research with data, data visualization and…",data analyst,"Head, Insights, Analysis and Research",undefined,Sydney NSW,2022-08-06,,167079
Unisys,AUSTRALIA,"  Work with the QA team to prepare test scenarios and data. The business analyst is most knowledgeable about use cases; therefore, they continually verify the…",data analyst,Associate Business Analyst,full-time,Rhodes NSW+1 location,2022-07-17,3.6,
Woodside Energy Ltd,AUSTRALIA,  The key purpose of this role is to provide independent oversight of portfolio trading and marketing activities through quantifying and reporting commodity…,data analyst,Senior Market Risk Analyst,part-time,Australia,2022-07-17,4.0,
Aurecon Group,AUSTRALIA,"  Our flexible way of working includes our flexible start and finish times, working from home, part time and job share options.",data analyst,Senior IT Risk and Assurance Analyst,part-time,Melbourne VIC,2022-07-17,3.9,
Precision Sourcing,AUSTRALIA,"  Defining data flows from various data sources, possess good understanding of database design. (Please note that this role is focused on Business Analysis as…",data analyst,Business Analyst- Data,full-time,Remote in Melbourne VIC,2022-07-21,4.9,
Macquarie Group Limited,AUSTRALIA,"  These will be across a range of product areas including project finance, corporate lending, derivatives and equity investment. Work type: Permanent - Full time.",data analyst,Credit Risk Associate/Analyst - Energy &amp; Natural Resources,permanent,Sydney NSW,2022-07-29,3.8,
integratedliving,AUSTRALIA,"  In Delivery, undertake business and data analysis requirements for delivery of the project; map business process changes working closely with the project…",data analyst,Business Analyst,full-time,Temporarily Remote in New South Wales,2022-07-27,3.0,
ofi,AUSTRALIA,"  Proven capability in fault finding and ensuring data integrity. A passion for numbers, details and analysis of data. A background in the manufacturing industry.",data analyst,Inventory Analyst / Pallet Controller,full-time,Mildura VIC,2022-08-03,,
ING,AUSTRALIA,"  You’ll be part of a number of new and exciting projects within the Facilities Security and Risk space, working closely with the second line Risk Management Team…",data analyst,Facilities Security Risk Analyst,full-time,Sydney NSW,2022-07-17,3.9,
Cubic Corporation,AUSTRALIA,"  Experience with data analysis, collecting and interpreting data. Attention to detail and with high data integrity. High level attention to detail.",data analyst,Asset &amp; Configuration Analyst,full-time,Silverwater NSW,2022-07-23,3.7,
Ventia Pty Limited,AUSTRALIA,  Provide data analysis SME input to current and future IT projects. Assist in the daily management of data related storge across various platforms.,data analyst,Business Analyst,full-time,Melbourne VIC 3000+1 location,2022-07-27,2.5,
AWS Australia Pty Ltd,AUSTRALIA,"  5+ years of experience as an analyst or engineer in the data/BI space. Demonstrated experience with data visualization using Tableau, Quicksight, or similar…",data analyst,Business Intelligence Engineer,full-time,Sydney NSW,2022-07-17,3.5,
Macquarie Group Limited,AUSTRALIA,"  You will work closely with stakeholders globally across the Business, Compliance, Risk, Operations, vendors and technology to ensure small to large change…",data analyst,Senior Business Analyst,permanent,Sydney NSW,2022-08-09,3.8,
Macquarie Group Limited,AUSTRALIA,  Working across all of Macquarie’s operating groups you will provide functional support to operational teams in their day to day use of the system as well as…,data analyst,Commodities and Global Markets | Junior Business Analyst,permanent,Sydney NSW,2022-07-17,3.8,
Terra Firma,AUSTRALIA,"  Analysing commercial data such as budgets, sales results, and forecasts. You will work on short- or long-term projects where your business analysis and process…",data analyst,Business Consultant (Business Analyst),,Sydney NSW,2022-07-17,,
Woodside Energy Ltd,AUSTRALIA,  The role includes direct oversight of junior analyst(s) as well as coaching and mentoring to other analysts across the marketing team on quantitative methods.,data analyst,Senior Quantitative Analyst,part-time,Australia,2022-08-11,4.0,
CoreLogic,AUSTRALIA,"Hands on experience in data analysis, data wrangling, report development and insights communication. Background in a data driven role in Banking and/or…",data analyst,Industry Data Consultant/Senior Analyst,full-time,Sydney NSW,2022-07-17,3.3,
Oracle,AUSTRALIA,"For data analysis, creating PowerPoint presentations and writing documents. EA and Project Support Analyst -22000CO5. Experience in B2B / Enterprise markets.",data analyst,EA and Project Support Analyst,,Australia,2022-08-11,3.8,
Commonwealth Bank,AUSTRALIA,Validate accuracy of source data to deliver sound business insights derived from analytical review of complex data.,data analyst,Finance Analyst - Decision Support,full-time,Sydney Central Business District NSW,2022-07-28,4.0,
ANZ Banking Group,AUSTRALIA,"Role Type: 12 month Fixed Term, Full-time. As a Senior Business Analyst you will be responsible for leading workstreams within the Third-Party Risk Management …",data analyst,"Senior Business Analyst, Third-Party Risk Management",undefined,Melbourne VIC,2022-07-17,4.1,500
Quay Consulting Pty Ltd,AUSTRALIA,Building relationships with the project technical team to ensure historical data is accurately collected and migrated into the newly configured system prior to…,data analyst,Technical Business Analyst - (AWS),undefined,Remote in Sydney NSW,2022-08-11,,1000
Optus,AUSTRALIA,Advanced Excel data lookup/matching and/or database manipulation skills. Support leadership team with timely and accurate data to analyse and represent the…,data analyst,Business Intelligence Analyst,permanent,Sydney NSW,2022-07-17,3.7,
IAG New Zealand,AUSTRALIA,"Familiarity with common GIS software, data formats and workflows. Experience in analysis, data management or automation using Python, SQL, R or similar.",data analyst,"Analyst, Flood Risk",permanent,Sydney NSW 2000,2022-08-13,3.7,
Alinta Energy,AUSTRALIA,"Considerable experience in the technical business analyst domain. Reporting to the Release Train Engineer, you will work on building out the new, Azure-hosted…",data analyst,Senior Technical Business Analyst,permanent,Temporarily Remote in Sydney NSW,2022-08-09,3.8,
APRA,AUSTRALIA,"Support the development of APRA’s data collections and taxonomy design to facilitate report building and data querying. Lead, coach and develop peers.",data analyst,Principal Analyst | Data Processes,,Sydney NSW 2000,2022-08-13,4.0,
Caterpillar,AUSTRALIA,"Gain a thorough understanding of Minestar and the capability/feature set(s) applicable and be able to gather, refine and articulate the needs of the project,…",data analyst,Senior Business Analyst,full-time,Brisbane QLD,2022-08-05,3.8,
ING,AUSTRALIA,Utilising data visualisation techniques to powerfully convey insights and facilitate data discovery. Experience with Tableau for effective data visualisation.,data analyst,Customer Insights Analyst - Collections and Hardship,full-time,Sydney NSW,2022-07-17,3.9,
Capgemini Australia,AUSTRALIA,"Understanding of data integration through extracting, transforming, and loading (ETL) data from various source systems.",data analyst,Data Analyst/Engineer,,Melbourne VIC,2022-07-19,3.8,
Amplifon,AUSTRALIA,"Perform regular audits for the integrity and accuracy of data on HCM and Payroll System. Ability to compile MIS report on Annual leave, Reward and Remuneration,…",data analyst,HR Analyst &amp; Workforce Planning Specialist,internship,Mulgrave VIC,2022-07-17,3.1,
Class Super,AUSTRALIA,"Undertaking regular reviews of investment option data including classification and pricing data. Regularly verifying Managed Portfolio data across Agreements,…",data analyst,Investment Analyst - Mandate Compliance,full-time,Sydney NSW,2022-07-17,,
Macquarie Group Limited,AUSTRALIA,"Experience in data migration activities, including reconciliation &amp; data mapping exercises. Experience in performing detailed data analysis to drive quality…",data analyst,Business Analyst - Wealth,permanent,Sydney NSW,2022-07-17,3.8,
Tasmanian Government,AUSTRALIA,"  Strong analytical skills, including data analysis capabilities; Intergovernment and Financial Policy Branch. Applications must be submitted by Sunday 21 August,…",data analyst,Principal Policy Analyst,undefined,Hobart TAS,2022-08-12,,98358-111379
Macquarie Group Limited,AUSTRALIA,"  Partner closely with senior stakeholders across the business (including Reward, HR, and business leaders) to support the delivery of strategic priorities…",data analyst,Reward Analyst,permanent,Sydney NSW,2022-07-17,3.8,
Coles Supermarkets,AUSTRALIA,  With proven ability to interrogate data and financial systems to extract and manipulate data. Advanced Excel and PowerPoint skills to analyse and summarise high…,data analyst,Finance Business Analyst,full-time,Temporarily Remote in Hawthorn East VIC 3123,2022-07-17,3.8,
Herbert Smith Freehills,AUSTRALIA,"  We have developed a wealth of experience across legal project management, pricing, data analytics, strategic research, process design, innovation and automation…",data analyst,LEGAL TRANSFORMATION ANALYST (LEGAL TECH),permanent,Melbourne VIC,2022-07-17,4.1,
Resourceful Recruitment,AUSTRALIA,"  Background in data analysis/information management. The Contract Analyst will be working across all contract partners and categories, and will be the exclusive…",data analyst,Contract Analyst,undefined,Queensland,2022-08-16,,135000
NSW Department of Communities and Justice,AUSTRALIA,  You will be responsible for translating data into information by improving and developing reports and dashboards that will enable decision making across the…,data analyst,Senior Business Analyst,undefined,Parramatta NSW 2150,2022-08-03,3.8,113343-124901
CoreLogic,AUSTRALIA,"  Experience in enterprise data governance. You have a passion around the data economy, contemporary data and analytical techniques and solving large problems…",data analyst,"Sr Leader, Data &amp; Analytics",full-time,Sydney NSW,2022-07-17,3.3,
ING,AUSTRALIA,"  Experience scoping and delivering statistical analysis e.g. regression modelling such as linear, logistic, and time series data.",data analyst,Senior Marketing Analyst,full-time,Sydney NSW,2022-08-12,3.9,
DWS,AUSTRALIA,"  Exciting projects with some of Australia's best Tier 1 enterprise businesses. Applicants must hold Australian Citizenship, Permanent Residency (PR), or other…",data analyst,Senior IT Business Analyst,undefined,Melbourne VIC,2022-08-05,3.7,150000
Wesley Mission Queensland,AUSTRALIA,"  Participate in ensuring compliance and governance during data use. Knowledge of agile methodologies, web technologies, data analysis/mapping, data importing,…",data analyst,Digital Delivery Analyst (EX),full-time,Hybrid remote in Queensland,2022-08-10,3.4,
IQVIA,AUSTRALIA,  Manage data warehouse load activities as per client subscriptions ensuring data quality through data verification and integrity checks.,data analyst,Technical Support Analyst,full-time,St Leonards NSW,2022-07-17,3.8,
PwC,AUSTRALIA,"  Exceptional knowledge of the data analytics process, from data understanding, cleansing, transformation, interpretation and presentation.",data analyst,Data Analytics Manager,undefined,Melbourne VIC,2022-07-17,4.0,118000
Chandler Macleod,AUSTRALIA,"  Identifying new data sources, collecting data, sourcing missing data. Support data governance and data integration processes while maintaining data quality as…",data analyst,APS6 Data Analyst,contract,Perth Central Business District WA,2022-08-09,3.7,
Bloomberg,AUSTRALIA,"  A natural aptitude for data visualization and writing clearly and concisely. Produce industry research, both quantitative and qualitative, by building a network…",data analyst,Sustainable Agriculture Analyst - Sydney (12 Month Contract),contract,Sydney NSW,2022-07-17,,
Deloitte,AUSTRALIA,"  Exceptional executive presence, written and oral communication, story telling and data visualisation skills. You are the type of person that doesn’t settle for…",data analyst,Guidewire - Functional Business Analyst (Melbourne / Brisban...,,Melbourne VIC 3000,2022-07-17,3.9,
Macquarie Group Limited,AUSTRALIA,"  You will bring with you relevant experience as a Business Analyst, Change Manager or Project Manager and a deep interest or curiosity in:",data analyst,Business Analyst/Project Manager - Risk Transformation proje...,permanent,Sydney NSW,2022-07-17,3.8,
Aurec Human Capital Group,AUSTRALIA,"  You are able to extract 'the story' within data, report writing. $58.70 - $66.93 + Super per hour. Corporate Strategy - Data - Reporting - Analyst.",data analyst,Corporate Strategy Analyst - Reporting Analyst,undefined,Sydney NSW,2022-07-23,,58.70-66.93
Hudson Australia,AUSTRALIA,  Establish and run working groups to produce detailed process designs and data flow diagrams for future state processes. Assist with production of test scripts.,data analyst,Senior Business Analyst | 6+6 month contract,undefined,Hybrid remote in Brisbane QLD,2022-07-17,,900
Robert Half,AUSTRALIA,  The IT Business Analyst will work closely with a range of stakeholders across the shared services (HR/Finance/Legal/Risk/ICT) and internal users.,data analyst,IT Business Analyst | Community Health,undefined,Melbourne VIC,2022-08-13,3.9,165000
Six Degrees Executive,AUSTRALIA,  Analyse business process data needs / outputs against system capabilities to map data flows across systems. Analyse data to define metric baselines.,data analyst,Senior Business Analyst (Data),contract,Melbourne City Centre VIC,2022-08-09,,
Lightsource BP,AUSTRALIA,  Actively communicate and promote the purpose and benefits of information and data management and data analytics.,data analyst,Senior GIS Analyst - APAC,full-time,Sydney NSW,2022-07-21,,
CBP Lawyers,AUSTRALIA,  Experience in developing and supporting data warehouses. Analyse and assist in the delivery of business process improvements to improve data quality and…,data analyst,Data and Analytics Lead,permanent,Sydney NSW,2022-07-27,,
Michael Page,AUSTRALIA,  Providing thought leadership in both using data to solve business problems and in arriving at innovative statistical solutions.,data analyst,Senior Data Analyst,full-time,Perth WA,2022-07-17,3.5,
CoreLogic,AUSTRALIA,  A detailed understanding of data and data structures (Essential). Knowledge of ETL and data analysis with focus on data integrity (Desirable).,data analyst,Business Intelligence (BI) Analyst,full-time,Sydney NSW+1 location,2022-07-17,3.3,
Robert Walters,AUSTRALIA,  Align regulatory data feeds to the organisations data warehouse. Experience with data quality technology. Investigate data quality issues and drive improvements…,data analyst,Data Management Analyst,,Remote in Sydney Central Business District NSW,2022-08-02,3.6,
TNT Express,AUSTRALIA,"  Source data &amp; information from internal or. Completing detailed analysis of complex data, systems, or ideas and providing. Proficiency in MS Office suite.",data analyst,Marketing Analyst,permanent,Mascot NSW,2022-07-20,3.8,
Zip Co,AUSTRALIA,"  Proven skills with master data maintenance, reconciliation &amp; reporting. Prepare documentation such as process maps, data flow diagrams, requirements documents…",data analyst,"Senior Financial Business Analyst, ANZ (12 Months Contract)",contract,Sydney NSW,2022-08-10,,
Talent International,AUSTRALIA,  Our client is a well recognised retail brand currently seeking a Business Analyst to support the scope and delivery of a new data platform.,data analyst,Business Analyst,contract,Remote in Melbourne VIC+1 location,2022-08-09,4.4,
British American Tobacco,AUSTRALIA,"  At least 1-3 years’ experience in a Trade Analyst, Business Analyst or Data analyst role. The purpose of this role is to assist the team in the analysis and…",data analyst,Commercial Operations Analyst,undefined,Sydney NSW,2022-07-17,4.4,70000-80000
Officeworks,AUSTRALIA,  Hands-on knowledge of data ETL from various sources along with BW Reporting Suite. Data Operations team in OW is responsible for SAP BW along with ODAP …,data analyst,Business Intelligence Analyst,,Hybrid remote in Bentleigh East VIC,2022-08-09,3.7,
Reserve Bank of Australia,AUSTRALIA,"  Information Department is responsible for the Bank's records management system, information governance, the archives and facilitating public access to Bank…",data analyst,Trainer - Information Analyst,full-time,Sydney NSW,2022-08-11,4.0,
Michael Page,AUSTRALIA,"  Experience in spatial data collection, translation, integration, maintenance and visualisation. Present findings that drive real change.",data analyst,Data and Visualisation Applications Analyst,,Penrith NSW,2022-07-17,3.5,
DXC Technology,AUSTRALIA,"  To support Australian businesses evolve and grow, we are looking for experienced Business Analysts who can be an agile modeler, able to deliver incremental…",data analyst,Senior Business Analyst,full-time,Remote in Sydney NSW+1 location,2022-07-28,3.2,
Commonwealth Bank,AUSTRALIA,"  Facilitate provision of data to the new entity(s) of authorised businesses and safe treatment of entity data. Experience working in Digital, API integration and…",data analyst,Senior Business Analyst,full-time,Sydney Central Business District NSW,2022-07-29,4.0,
Talent International,AUSTRALIA,"  In depth knowledge and assessment of systems, and related data and repository systems, to ensure data related issues are captured.",data analyst,Technical Business Analyst,undefined,Melbourne VIC,2022-08-09,4.4,800-850
Macquarie Group Limited,AUSTRALIA,"  You will help drive development, identify areas for improvement through data analysis, and promote continuous improvement to enable us to achieve our strategic…",data analyst,Senior Agile Business Analyst,contract,Sydney NSW,2022-07-17,3.8,
Zurich Gruppe Deutschland,AUSTRALIA,"  As the Risk &amp; Controls Analyst, you will work across the business to provide an independent and objective assessment of the design and operating effectiveness…",data analyst,Risk and Control Analyst,,North Sydney NSW,2022-07-20,3.7,
Macquarie Group Limited,AUSTRALIA,  An affinity for data modelling and developing business intelligence insights. An understanding of end-to-end delivery of data products and applications.,data analyst,BI Analyst/Developer,permanent,Sydney NSW,2022-07-17,3.8,
Macquarie Group Limited,AUSTRALIA,"  Be responsible for other business analysts’ deliveries to ensure their artefacts are on time and to standard, leaning in to assist where required.",data analyst,Senior Business Analyst - Capital Liquidity Project,permanent,Sydney NSW,2022-07-22,3.8,
Deloitte,AUSTRALIA,  You will also support and advise corporate clients with tax and policy issues arising from their global mobility programs.,data analyst,Global Mobility Tax Senior Analyst - Sydney,,Sydney NSW 2000,2022-08-04,3.9,
EY,AUSTRALIA,  Experience in data and integration projects within the financial services operations or banking and insurance technology.,data analyst,Technical Business Analyst - Digital &amp; Emerging Tech,undefined,Sydney NSW 2000,2022-08-05,4.0,80000
Deloitte,AUSTRALIA,"  Learning on the job through hands on coaching, feedback and development opportunities, you will get exposure to solving technical accounting matters, using data…",data analyst,Experienced Analyst | External Audit - ASX Listed | Sydney,,Hybrid remote in Sydney NSW 2000+1 location,2022-07-17,3.9,
Great Southern Bank,AUSTRALIA,"  Experience of testing APIs, ETL and data validation. Experience of testing within data related implementation projects with a regulatory component.",data analyst,Senior Test Analyst,contract,Brisbane QLD,2022-08-06,3.5,
