company_name,country,job_description,job_field,job_title,job_type,non_remote_location,post_date,rating,salary
KPMG,United Kingdom,  KPMG’s Insurance Technology Enablement practice helps Insurance clients transform the way their technology enables their business strategy and long-term…,data analyst,Technology Consultant - Analyst,permanent,Edinburgh,2022-07-17,3.9,
Jaguar Land Rover,United Kingdom,"  Product owner for CSQ data science and analytics, leading scrums as required. This role will lead a team of data science, analytics and engineering specialists…",data analyst,Data Science and Analytics Manager,,Hybrid remote in Whitley Bay,2022-08-02,3.7,
NatWest Group,United Kingdom,  Specialist knowledge in data management to support analytics. Challenging senior stakeholders to make sure data and analytics is embedded in everyday decision…,data analyst,Data &amp; Analytics Manager,permanent,Manchester+2 locations,2022-08-02,3.7,
Metrica Recruitment,United Kingdom,"  An aspect of quality assurance to ensure the accuracy of data before it is published or sent to clients. As a Data Visualisation Analyst, you will bring the…",data analyst,Data Visualisation Analyst,undefined,Hybrid remote in London,2022-07-26,,38000-42000
Synapri,United Kingdom,"  The individual hired will interact with all areas of the business from Tech, Data, Lab to Scientists, this role offers a huge variety of work.",data analyst,Reporting Analyst,undefined,Hybrid remote in Cambridgeshire,2022-07-17,,35000-44000
Deutsche Bank,United Kingdom,"  Promote the adoption and integration of data science whilst applying highest quality standards. Driving innovation across Group Audit, leveraging the experience…",data analyst,Group Audit - Regional Data Analyst,,London,2022-07-17,3.8,
Xylem,United Kingdom,  Partners with the IT community and vendor customer service as necessary to resolve system and/or data issues. Some travel will be required.,data analyst,Continuous Improvement Analyst (Remote),,Remote in Nottingham NG4+1 location,2022-08-10,3.4,
Gowling WLG (UK) LLP,United Kingdom,"  In addition, you will have consulting skills to analyse data requirements and produce tailored solutions. You will have experience of creating data &amp; reporting…",data analyst,HR Reporting and Data Analyst,full-time,Hybrid remote in Birmingham,2022-08-11,3.7,
News UK,United Kingdom,"  You have experience or are able to adapt to a fast and agile environment, deliver insights or provide the stakeholder with timely assistance and support in data…",data analyst,Junior Analyst,internship,London,2022-07-27,4.1,
BlackRock,United Kingdom,"  Identify data cleansing opportunities across our contractual documents, and suggest ways to improve data accuracy and/or collection of new data points.",data analyst,Data and Document Governance Analyst,,Edinburgh EH3,2022-07-28,,
Morgan McKinley,United Kingdom,  Ability to notice trends/patterns of data. Relay data findings back to vendors and internal team alike. Ability to check for gaps and ensure completeness of…,data analyst,Data Analyst - URGENT ROLE,undefined,Hybrid remote in Belfast,2022-07-17,3.7,150-175
Barclays,United Kingdom,"  You will be responsible for providing a detailed data analysis. As a Barclays Business Analyst, you will be joining Collateral Management and Client Valuations…",data analyst,Business Analyst,permanent,Hybrid remote in London E14+3 locations,2022-08-06,3.9,
Shell,United Kingdom,  Collaborate with the fundamental analysis and data science teams on data analysis and forecasting methods. Strong coding skills in Python with proficiency in…,data analyst,Energy Quantitative Analyst,full-time,London,2022-08-12,3.9,
Morgan McKinley,United Kingdom,"  The successful candidate will have at least 12 months experience as a Data Analyst. Strong Excel - VLOOKUP, Pivot tables etc. VBA experience would be a bonus.",data analyst,Data Analyst - Excel - Remote Working,undefined,Remote in Horsham,2022-07-17,3.7,25000-30000
Mitie,United Kingdom,  Validating consumption data in the aM&amp;T system against billing and/or other data sources where available. Liaising with data providers and suppliers.,data analyst,Data Analyst,permanent,Northampton NN4,2022-07-17,2.9,
Wework,United Kingdom,"  Spot trends and data connections. Build dashboards to transform raw data into actionable business insights. Be resourceful, analytical, motivated, eager to dive…",data analyst,Junior FP&amp;A Analyst,,London,2022-07-17,3.4,
Deutsche Bank,United Kingdom,"  Experience in data governance, data quality or data remediation initiatives; or project and change management support roles (advantage if this includes…",data analyst,Data Frameworks Project / Change Analyst,,Birmingham,2022-07-21,3.8,
Bluetree Recruits,United Kingdom,"Job Title: Assistant Data Analyst Location: Wimbledon, London / WFH Employment: Full-Time Salary: £20,000 - £25,000 DOE plus…",data analyst,Assistant Data Analyst,undefined,Remote in Wimbledon,2022-07-17,,20000-25000
PwC,United Kingdom,  Contribute to the documentation of data standards including data definitions and data quality rules. Contributing to a reusable catalogue of data quality rules…,data analyst,"Data Analyst - Senior Associate, TC",full-time,London,2022-08-11,4.0,
Ovo Energy Limited,United Kingdom,"  Key parts of the role include: Designing products and services, and partnering with third parties to achieve compliance and standard process; Crafting and…",data analyst,Data Protection Analyst,,Bristol,2022-08-12,3.5,
Concept Personnel,United Kingdom,"  Experience of modelling large volumes of complex data from different sources, including multivariate testing and integrating quantitative &amp; qualitative data.",data analyst,Data Analyst,undefined,Remote in Middlesex,2022-07-17,,35000-55000
PowerAdvocate,United Kingdom,"  Pioneer new ways to analyze and visualize data. Cleanse and enrich data to make it more powerful. Enjoys organizing large data sets, identifying discrepancies,…",data analyst,Data Analyst,full-time,London,2022-07-17,,
Great Lakes Insurance SE,United Kingdom,"  Support business with their data analysis and reporting requirements. Basic background in relational database design, SQL and data visualisation.",data analyst,Data Analyst,full-time,Hybrid remote in London,2022-08-09,,
Direct Line Group,United Kingdom,"  Your typical day could be focused on building an ETL process from an upstream data source, designing a data warehouse/data mart model, or creating a dashboard.",data analyst,Data Visualisation Analyst,full-time,Bromley,2022-07-17,3.3,
Dorling Kindersley Limited,United Kingdom,"  Communicating actionable insight through data. Data integration: ETL processes, and building data pipelines. Market and sales analysis / reporting.",data analyst,Data Analyst,,Hybrid remote in London SW11,2022-07-17,4.1,
RSM UK,United Kingdom,  Work with the digital team to analyse online customer behaviours and journeys. Uncover and interpret trends in the marketplace and create data models to provide…,data analyst,Data Analyst,permanent,Preston,2022-07-28,3.6,
Deliveroo,United Kingdom,"  Experience in the Total Rewards space, preferably in in-house compensation or consulting, in a fast-paced environment with a strong track record of execution…",data analyst,Compensation Analyst,,London,2022-08-11,3.3,
Barclays,United Kingdom,"  As a Barclays Quantitative Analyst, you will support the development, calibrations, monitoring of models for capital (Basel), impairment (IFRS9), and stress…",data analyst,Quantitative Analyst,permanent,Hybrid remote in London E14+1 location,2022-08-11,3.9,
MWH Treatment,United Kingdom,  MWH Treatment is looking to strengthen their Procurement team with a procurement data analyst for our central Framework.,data analyst,Procurement Data Analyst - Salford,permanent,Salford M5,2022-07-17,3.4,
LV= General Insurance,United Kingdom,  Ability to present accurate data professionally. As BCN Data Analyst you will be reviewing all data/MI streams into our Building Contractor Network team as well…,data analyst,BCN Data Analyst,,Remote,2022-07-21,3.2,
Veeva Systems,United Kingdom,"  Support data insights reports based on the data and customers’ needs. As a Research Analyst, you’ll use your scientific knowledge and research skills you will…",data analyst,Research Analyst,,Remote in Oxford,2022-07-17,,
TikTok,United Kingdom,  Respond to risk-related escalations and customer requests/inquiries and maintain accurate and thorough records in internal systems.,data analyst,Risk Operation Analyst (Customer Escalation),,London,2022-07-26,3.3,
Schroders,United Kingdom,"  Writing, updating and maintaining product language and data in the RFP database. Attention to detail – demonstrate a thorough process of checking and…",data analyst,Investment Product Analyst,,London,2022-08-16,3.9,
Volvo Cars,United Kingdom,  Use of market and consumer data and the ability to spot trends and recommend a course of action is key part of the role and experience of data analysis tools is…,data analyst,Senior Analyst - Volvo Car UK,undefined,Hybrid remote in Maidenhead,2022-08-11,3.8,48000-52000
"JPMorgan Chase Bank, N.A.",United Kingdom,  A passion for data analysis. Ability to manage large sets of data. The Finance and Business Management (F&amp;BM) team partners with GTI Leadership and their teams…,data analyst,Finance Analyst Supporting Global Technology Infrastructure,permanent,Bournemouth,2022-08-15,3.8,
Galytix,United Kingdom,"  Acquiring data from internal as well as secondary data sources. Cleaning and filtering data, assessing data quality and create concise end product.",data analyst,DATA ANALYST,,London,2022-07-17,,
American Express Global Business Travel,United Kingdom,"  Identify problem statements which can be solved using data science, machine learning and the automation of process.",data analyst,"Data Scientist III, Analytics",full-time,Remote in London,2022-07-17,3.7,
Centrica,United Kingdom,"  Highly proficient at Excel, with a proven track record of designing, maintaining, and updating financial models. Financial Planning and Reporting Analyst.",data analyst,Financial Planning &amp; Reporting Analyst,undefined,Remote in Windsor SL4,2022-07-21,3.4,45000-50000
easyJet,United Kingdom,  Experience of data visualisation tools e.g. Tableau plus some knowledge of Python and/or SQL and data warehouse environments is an advantage.,data analyst,Schedule Analyst – Tools &amp; Data,full-time,Luton Airport,2022-08-06,4.0,
University of Oxford,United Kingdom,"  Examples of the type of work you might be expected to undertake include public-facing student and examination statistics, operational reporting on students…",data analyst,Reporting Analyst,contract,Oxford,2022-07-29,4.3,
MARS,United Kingdom,"  This role is responsible for evangelizing the adoption of data driven decisions across Mars by leading the development of advanced analytics methods, mining…",data analyst,ODDA Data Scientist Analyst,full-time,Slough SL1,2022-07-17,3.8,
Amey plc,United Kingdom,"  Trouble shooting any data or dashboard issues. Managing your own projects from data review to final sign off. Strong Microsoft, SQL, VBA and Power BI Skills.",data analyst,Data Analyst,permanent,Liverpool,2022-08-13,2.7,
Futures Housing Group,United Kingdom,"  You’ll lead in the development of our new data warehouse, ensuring that our new CRM platform, existing reporting structures and analysis are fit for the future.",data analyst,Database Analyst,undefined,Derby DE74,2022-08-06,3.8,38554
"JPMorgan Chase Bank, N.A.",United Kingdom,  Confidence to meet with clients &amp; internal parties to deliver feedback on data relating to the client interactions with the team.,data analyst,Business Process Analyst II,permanent,Bournemouth,2022-07-18,3.8,
Edwards Ltd,United Kingdom,"  Be an expert on data management processes and data quality standards. Lead on data collection, management of data dashboards, and ongoing reporting.",data analyst,Data Analyst,,Burgess Hill,2022-07-27,4.1,
Turner &amp; Townsend,United Kingdom,"  Experience in data sanitising, manipulation and understanding of data relationships is essential. Analysing trends and key metrics of internal performance data…",data analyst,Data Analyst- Telecoms,undefined,London,2022-07-17,3.7,365
Legal &amp; General Investment Management,United Kingdom,"  Provide data analytics and modelling with Python / R / Azure Machine Learning. Deliver data analytics solutions to end users, e.g. BI reporting, dashboard…",data analyst,Data Analytics Analyst,permanent,Hove,2022-07-17,,
UK Health Security Agency,United Kingdom,"  Excellent numerical, data analysis and interpretation skills,. This includes multi-dimensional reporting (including activity data and reporting on other areas…",data analyst,Financial Analyst,undefined,London SW1P,2022-08-04,,36329-45998
Sage,United Kingdom,  Experience in data viz best-practice. A data enthusiast who follows the industry closely. The Data Analyst will also provide frequent analysis and partner with…,data analyst,Data Analyst,,Hybrid remote in Manchester,2022-07-23,3.5,
Reckitt,United Kingdom,"  We’re looking for a well-organised, data-oriented sustainability professional, experienced in leading the performance and analysis function, with an…",data analyst,Global Sustainability Data Analyst,,Slough SL1,2022-07-17,3.7,
Propel Together,United Kingdom,"  ? Demonstrable knowledge of, and interest in, data privacy laws and regulations. Experience with data, marketing or advertising initiatives in a media or…",data analyst,Data Protection Analyst,contract,Hybrid remote in Newport,2022-08-02,,
Turner &amp; Townsend,United Kingdom,  Managing data capture and validation. The successful candidate will provide data analysis and technical support for our commissions.,data analyst,Data Analyst,full-time,Bristol,2022-07-17,3.7,
Volvo Group,United Kingdom,"  Financially numerate with a proven track record in data analysis. Salary up to £35,000 + Company bonus of up to 10% of salary, &amp; excellent benefits.",data analyst,Pricing Analyst,undefined,Hybrid remote in Warwick,2022-08-10,4.2,35000
Harrogate and District NHS Foundation Trust,United Kingdom,  An understanding of NHS data and experience of extracting data from patient systems for analysis and reporting would also be beneficial.,data analyst,Information Analyst,undefined,Harrogate,2022-07-29,3.7,25655-31534
"JPMorgan Chase Bank, N.A.",United Kingdom,  Understanding of data lineage and ability to translate business data definitions to the respective Controlled Vocabularies describing the data.,data analyst,Data Management Controls Analyst,permanent,London,2022-07-26,3.8,
TikTok,United Kingdom,"  Developing potential conclusions from data with limited complexity. Foundational knowledge of data analytics and visualization tools (Splunk, Tableau, etc.).",data analyst,Vulnerability Management Analyst (Global) - London,,London,2022-07-17,3.3,
V.Ships,United Kingdom,"  You will have a deep understanding of data technologies, and your core responsibility will be to engage with business and technology stakeholders to document…",data analyst,Data Business Analyst (Contract),undefined,Glasgow G3,2022-07-17,4.1,400
HSBC,United Kingdom,"  Proven track record as an outstanding analyst, consultant and/or project manager. As an HSBC employee Channel Islands and Isle of Man (CIIOM) you will have…",data analyst,Business Analyst,permanent,Jersey,2022-07-17,4.0,
Sanderson Recruitment Plc,United Kingdom,  Proven experience in a data role with. Umbrella engagement- £400- 450 per day. Leading business is looking to recruit a Data Analyst with extensive experience…,data analyst,Data Analyst,undefined,Hampshire,2022-07-26,4.3,400-450
South Yorkshire Police,United Kingdom,"  Use relevant data to assist in the production of shift patterns and recommendations. This will include applying thinking, gathering and analysing data from a…",data analyst,SYP - Business Analyst - August 2022,undefined,Sheffield,2022-08-06,3.8,31425-36231
UBS,United Kingdom,"  The Data Lineage team is responsible for working directly with divisional subject matter experts, in both the business and IT, to map data flows in the…",data analyst,Data Management Analyst,full-time,London,2022-07-17,3.8,
CAPCO,United Kingdom,  Have a real passion for data and a commitment to shift the industry towards forward thinking data analytics. Programme Execution and Change management – proven…,data analyst,Data Analyst,,London,2022-07-17,3.3,
Serco Plc,United Kingdom,"  We are a data focused business, and the role will be responsible for providing management reporting based upon the operational and scheme usage, with a focus on…",data analyst,Data Analyst,permanent,London N1,2022-07-17,3.4,
IQVIA,United Kingdom,  O Carry out data analyses as input to new data or enhancing existing data. O Participate in specific data quality activities to ensure accurate and relevant…,data analyst,Global Pharma Data Analyst,full-time,London,2022-07-17,3.8,
Chase and Holland,United Kingdom,  Enjoys problem solving and interpreting data. Extract and configure data from MySQL databases. You will work closely with the finance team to deliver timely and…,data analyst,Data Analyst,undefined,Barton-upon-Humber,2022-07-17,5.0,25000-30000
Parexel,United Kingdom,  Lead/Responsible for data cleaning and data review activities e.g. query management. Support data entry where required. Perform medical coding on small studies.,data analyst,Senior Clinical Data Analyst,,Remote,2022-08-12,3.6,
National Grid,United Kingdom,"  To both succeed in, and importantly enjoy this role you will be a proficient data analyst with a willingness to learn, who has proven LMS experience and who is…",data analyst,Lead Learning Analyst,undefined,Hybrid remote in Newark-on-Trent NG22,2022-08-10,3.7,49000-70000
Trafford Council,United Kingdom,"  Job Type – Policy, Business Analysis, Change &amp; Transformation. We have various Project Manager and Business Analyst roles available.",data analyst,Business Analyst and Project Managers,undefined,Manchester M32,2022-08-12,3.9,37568-40578
McKinsey &amp; Company,United Kingdom,"  You'll be part of a global data engineering and analytics community and work in cross-functional, agile project teams alongside project managers, data engineers…",data analyst,"Solution Delivery Data Analyst - Social, Healthcare &amp; Public...",,London,2022-07-17,4.3,
Ashdown Group,United Kingdom,"  Working with Excel and SQL to manipulate, extract and analyse claims data. Partnering with stakeholders to document data and reporting requirements and looking…",data analyst,Data &amp; Reporting Analyst (Junior/Graduate),undefined,Hybrid remote in London,2022-07-17,4.6,35000
Adria Solutions,United Kingdom,  Provide clear and concise feedback to Clients on data cleanliness/data issues prior to importing into the company product.,data analyst,Data Analyst,undefined,Hybrid remote in Manchester,2022-07-17,,30000
NORTH YORKSHIRE COUNTY COUNCIL,United Kingdom,  Contract Type* – Fixed Term/Temporary Full/Part Time Immediate start. Location*: Hybrid/Office Based (Weekly meetings will be held in person at Northallerton…,data analyst,Business change Analyst,undefined,Hybrid remote in Northallerton,2022-08-11,,30451-43857
Amazon EU SARL (UK Branch),United Kingdom,"  Experience using databases with a large-scale data set. Working with large volumes and big data, in a highly complex business. Experience with SQL or ETL.",data analyst,Business Analyst Intern,full-time,London,2022-07-17,3.5,
accuRx,United Kingdom,  You have knowledge of data governance and data quality management concepts and you have previously contributed in a data governance project.,data analyst,Senior Data Analyst,full-time,Hybrid remote in London,2022-07-30,,
Harnham,United Kingdom,  This fast-growing B2B marketing agency are highly data driven and their next Data Analyst / Scientist will have an exciting opportunity to help accelerate…,data analyst,Data Analyst / Scientist,undefined,London,2022-08-04,4.6,30000-35000
Morgan Sindall Plc,United Kingdom,"  Collation of data in accordance with stakeholder scope. Highlight gaps, discrepancies and inaccuracies within data presented. Company car or cash allowance.",data analyst,Baseline Data Analyst,permanent,London,2022-07-17,3.8,
Meggitt,United Kingdom,  Drive efficiencies in data collection and continuous improvement of data quality. Research and analyze data effectively.,data analyst,Group Data Analyst - Management Information,,Coventry CV7,2022-08-11,3.2,
MasterCard,United Kingdom,  This role will be responsible for providing management of process improvement &amp; optimization of all the operational processes undertaken by the MPMS Client…,data analyst,Business Process Improvement Analyst,full-time,Hybrid remote in Peterborough,2022-08-03,4.0,
Digital Waffle,United Kingdom,"  Background in data selection and campaign management. Turn large data into actionable insight and knowledge. Proficient in data visualisation tool Power BI, but…",data analyst,Data Insight Analyst,undefined,Hybrid remote in London,2022-07-27,,50000
Dufrain,United Kingdom,"  We are looking for dynamic individuals, with proven experience and strong technical skills to join our teams in Edinburgh, Manchester or London.",data analyst,Data Analyst,,London EC2M,2022-07-22,3.0,
Computacenter,United Kingdom,"  Good administrative experience, process driven, attention to detail, ensures accuracy of data, provides data for reporting and processing of information.",data analyst,Software Data Analyst,,Remote in Hatfield AL10,2022-07-17,3.4,
Contract Scotland,United Kingdom,"  Investigating data and creating reports based on your findings. Analysing data throughout the day and identifying any discrepancies, offering solutions where…",data analyst,DATA ANALYST,undefined,Falkirk,2022-07-17,3.0,22000
Barclays,United Kingdom,"  Serving as a functioning business analyst in collecting and analyzing data. As a Barclays Know Your Customer (KYC) QA Analyst, you are primarily responsible for…",data analyst,KYC (QA) Analyst Corporate Banking,permanent,Hybrid remote in Glasgow,2022-08-14,3.9,
KPMG,United Kingdom,"  Experience of complex data projects covering the full creation to consumption data lifecycle (data sourcing, management, quality, reporting &amp; analytics).",data analyst,Assistant Manager Data and Analytics,permanent,Birmingham,2022-07-17,3.9,
Close Brothers Group,United Kingdom,"  In this existing role, the incumbent will enjoy a broad remit, having the opportunity to significantly contribute to existing initiatives as well as support on…",data analyst,Junior Operational Risk Analyst,,London,2022-08-03,3.1,
Enginuity Group,United Kingdom,"  Excellent data analysis and modelling. A comprehensive discounts and benefits scheme, with discounts at many high street and online retailers.",data analyst,Business Analyst,undefined,Remote,2022-08-09,,40000
AstraZeneca,United Kingdom,  Knowledge of data processing techniques including advanced excel and database principles. This role uses strong analytical capability to review data and…,data analyst,Logistics Analyst,full-time,Macclesfield SK10,2022-07-17,4.1,
Harrods,United Kingdom,  The role will get involved in all aspects of developing and maintaining a modern and flexible data visualisation layer and reporting solutions.,data analyst,Business Intelligence Analyst,permanent,Hammersmith,2022-07-29,4.1,
Electronic Arts,United Kingdom,"  Experience with SQL: including experience querying complex data sets. Experience with data visualization software packages, e.g., Looker, Power BI, Tableau.",data analyst,Data Analyst,full-time,Hybrid remote in Guildford GU1,2022-07-28,3.8,
EY,United Kingdom,"  Experience of working with data hierarchies, for example, being able to query and map data both up and down hierarchical data.",data analyst,Senior Consultant - Data Integration Analyst,,London E14,2022-07-17,4.0,
Keylime Consultants,United Kingdom,"  Ownership of HR data across function. This client offer an excellent salary + package, remote working and the chance to really take ownership of how they…",data analyst,HR Systems &amp; Data Analyst,undefined,Remote in Liverpool,2022-07-17,,55000
DPD Group UK,United Kingdom,  Enjoys working with data and engages with the content of their work. Working with management to highlight and implement areas for improvement and develop new…,data analyst,Linehaul Graduate - Data Analyst,full-time,Hinckley,2022-07-30,2.7,
University of the West of England,United Kingdom,"  Communicating technical data to non-technical audiences. Have experience using a data visualisation platform (such as Power BI, Tableau or Business Objects).",data analyst,Business Intelligence Analyst,permanent,Hybrid remote in Bristol,2022-07-30,4.3,
Interface Recruitment,United Kingdom,"  We need a presentable and highly organised individual, with excellent attention to detail and a methodical approach to their work including a logical approach…",data analyst,357 - Data Analyst job opportunity,,Leeds,2022-07-17,,
Lloyds Banking Group,United Kingdom,"  Excel, Power BI, data manipulation experience. You’ll have strong excel or Power BI skills, capable of analysing sales, marketing and finance data to gain…",data analyst,Home Insurance Business Analyst,undefined,Remote in Leeds,2022-07-17,3.8,23184-25760
Aviva,United Kingdom,"  We are looking for a Transaction Reporting Junior Analyst who is logical, has a structured thought process and good problem-solving skills.",data analyst,Transaction Reporting Junior Analyst,,London,2022-08-09,3.8,
