company_name,country,job_description,job_field,job_title,job_type,non_remote_location,post_date,rating,salary
ALDI,AUSTRALIA,"  Utilise data visualisation tools to communicate complex insights. Perform fact based, data driven analysis and modelling on significant amounts of data for the…",data analyst,Commercial Analyst,undefined,Temporarily Remote in New South Wales,2022-07-17,3.3,124900-142500
Macquarie Group Limited,AUSTRALIA,  Join Macquarie’s Commodities &amp; Global Markets Central Risk division in a 6 month contract as a market data analyst that will see you work with a wide range of…,data analyst,Market Data Analyst/Tech Business Analyst,permanent,Sydney NSW,2022-07-17,3.8,
Rootz,AUSTRALIA,  Together you will explore terabytes of customer behaviour data and lead data driven decision making culture throughout the company.,data analyst,Business Insight Analyst,,Remote in Tasmania,2022-07-17,,
Alinta Energy,AUSTRALIA,"  Supporting the Credit and Collections team members with delivery of requested data. Implementation from a data perspective, initiatives identified from your…",data analyst,Credit/Collections Analyst,permanent,Hybrid remote in Sydney NSW,2022-07-17,3.8,
Museums Victoria,AUSTRALIA,  The successful applicant will have demonstrated experience in delivering data analysis and reporting services involving complex datasets in a similar-sized…,data analyst,Senior Data &amp; Reporting Analyst,undefined,Melbourne City Centre VIC,2022-08-06,4.0,103920
NSW Government -Engineering &amp; Maintenance,AUSTRALIA,  Deriving insights from data to clearly define problem statements. The Engineering &amp; Maintenance Branch manages a $1.5 billion annual maintenance program on…,data analyst,Business Analyst,,Sydney NSW,2022-08-10,,
NRMA Motoring &amp; Services,AUSTRALIA,  Drive data innovation through identifying and integrating new data sources and re-leveraging existing data for enhanced capabilities.,data analyst,Digital Business Analyst,contract,Hybrid remote in Coolangatta QLD,2022-07-21,3.6,
Clayton Utz,AUSTRALIA,"  Extract, validate, transform and load data from multiple data sources. Consult with multiple stakeholders and develop bespoke data analytics procedures and…",data analyst,Consultant - Data Analytics,full-time,Sydney NSW,2022-07-17,4.4,
NAB - National Australia Bank,AUSTRALIA,"  Work type: Permanent Full time. Newly created role within Data Analytics &amp; Strategy Execution, Corporate &amp; Institutional Bank.",data analyst,Senior Analyst,permanent,Hybrid remote in Melbourne VIC,2022-08-16,3.6,
KPMG,AUSTRALIA,"  Use of data analytics tools for audit engagements, such as SQL and Alteryx. Growing our portfolio of services by developing innovative solutions, tools or…",data analyst,Automation Business Analyst - Azure data factory,permanent,Sydney NSW,2022-07-17,3.9,
Charterhouse,AUSTRALIA,  Experience as a data analyst with special focus on data cleansing and data migration. This position is also responsible for data cleansing and data migration as…,data analyst,Data Analyst,undefined,Melbourne VIC+1 location,2022-07-17,,800
Ramco Systems,AUSTRALIA,  Closely engage with client teams/stakeholders for requirement gathering and coordination required for data verification and extraction.,data analyst,Business Analyst,,Melbourne VIC,2022-07-27,,
Allianz Australia,AUSTRALIA,"  Proven analytical and critical thinking capability to interpret a range of data, identify patterns, trends and links that inform judgements and solutions.",data analyst,Reporting Analyst,permanent,Temporarily Remote in Sydney NSW 2000,2022-08-06,3.9,
ING,AUSTRALIA,"  Strong data interrogation, numerical and report writing skills. Collaborating as a subject matter expert on risk data and analytics with stakeholders across the…",data analyst,Credit Risk Analyst - Retail Credit,full-time,Sydney NSW,2022-07-29,3.9,
NSW Department of Communities and Justice,AUSTRALIA,"  With the support of Senior Corrections Research, Evaluation and Statistics staff, you will have a central role in generating and communicating advanced data…",data analyst,"Research Analyst, Corrections Research, Evaluation and Stati...",undefined,Sydney NSW 2000,2022-08-13,3.8,99431-110064
EY,AUSTRALIA,"  We go beyond strategy and provide end to end implementation of real-life data environments and have some of the best architects, project managers, business…",data analyst,Solution Architect - Data and Analytics,undefined,Sydney NSW 2000+1 location,2022-08-06,4.0,70000
Ignite Specialist Recruitment Services,AUSTRALIA,"  You will be responsible for applying data analytical techniques with the aim of enhancing the ingestion, storage, quality and identity match outcomes of third…",data analyst,Data Analyst,contract,Sydney NSW+1 location,2022-07-31,3.3,
Deloitte,AUSTRALIA,"  Learning on the job through hands on coaching, feedback and development opportunities, you will get exposure to solving technical accounting matters, using data…",data analyst,Analyst | External Audit - ASX Listed | Melbourne,,Hybrid remote in Melbourne VIC 3000,2022-08-10,3.9,
Redbubble,AUSTRALIA,  Ability to support data driven insights through qualitative data and desktop research. Build and maintain dashboards and other data tools that the Strategy and…,data analyst,Senior Data Analyst,,Melbourne VIC,2022-08-08,4.2,
Atlas Technology Solutions,AUSTRALIA,"  Understanding disparate data sources and Ecommerce, Operational Performance, Social Commerce, Social Media toolsets for collating data through their interface…",data analyst,Market Performance Analyst,,Sydney NSW,2022-07-30,,
Computershare,AUSTRALIA,"  Analysing documents to determine testing requirements, testing scope and test data. Designing, developing, and documenting comprehensive testing plans, test…",data analyst,Test Analyst,,Temporarily Remote in Melbourne VIC,2022-07-17,3.4,
Australian Pharmaceutical Industries,AUSTRALIA,"  Proven ability to accurately diagnose business problems/opportunities based on process and data analysis. Reporting to the Process Optimisation Manager, will…",data analyst,Process Optimisation Analyst,,Camberwell VIC,2022-07-27,3.7,
EY,AUSTRALIA,"  Extract, validate, transform and load data from multiple data sources for deeper analysis. This is achieved by combining forensic investigation skills with…",data analyst,Senior Consultant- Forensics Data Analytics | Forensic &amp; Int...,undefined,Brisbane QLD 4000,2022-07-17,4.0,78000
Pinnacle,AUSTRALIA,"  The purpose of endeavourX is to bring the best of data, design and tech to make drinks experiences easy &amp; inspiring for everyone.endeavourX operates as cross…",data analyst,Business Analyst - Hotels Gamification,full-time,Darlinghurst NSW 2010,2022-08-06,,
EML,AUSTRALIA,"  Produce detailed business requirements, process maps and data analysis for complex applications and systems. Identify and recommend opportunities to improve the…",data analyst,Business Analyst,permanent,Remote in Sydney Central Business District NSW,2022-07-27,3.4,
Robert Half,AUSTRALIA,  Support management team with data and analysis. Support the management team in data and analysis. Coordinate data collection process for ad hoc requests.,data analyst,Business Analyst,undefined,Remote in Sydney NSW+2 locations,2022-08-10,3.9,50
Residential Tenancies Authority,AUSTRALIA,"  2+ years' experience in a similar role. Strong analytical, problem-solving and decision-making skills. Experience querying databases and using technologies in…",data analyst,Business Intelligence Developer,,Brisbane QLD,2022-07-30,3.3,
Talent International,AUSTRALIA,"  Provide input into data cleansing and data remediation activities. Experience eliciting and documenting business rules, data rules, and data requirements.",data analyst,Data Analyst - Data Migration &amp; Cleansing,undefined,Melbourne VIC,2022-08-09,4.4,700-800
EY,AUSTRALIA,"  Experienced in delivering modern data platform solutions, data governance, architecture frameworks and processes. Ideally, you’ll also have.",data analyst,"Senior Consultant, Data &amp; Analytics, Technology Consulting",undefined,Sydney NSW 2000,2022-07-17,4.0,90000
Aviva,AUSTRALIA,"  Our actions enable informed decision-making by providing credible, robust MI using the latest in business intelligence software. 21 volunteering hours per year.",data analyst,Commercial BI Analyst,,Perth WA,2022-07-29,3.8,
Melbourne Water,AUSTRALIA,"  In this role, you will be responsible for running reports, preparing data sets and visually representing people data in periodic (monthly, quarterly and yearly)…",data analyst,HR Systems &amp; Reporting Analyst,permanent,Melbourne VIC,2022-08-12,3.9,
Amzn Commercial Srvcs Pty Ltd,AUSTRALIA,"  You are degree qualified, with strong communication and analytical data skills. Prior experience in Retail, Consulting or Finance, managing multiple…",data analyst,2022/23 Brand Analyst,permanent,Sydney NSW,2022-07-17,3.5,
Macquarie Group Limited,AUSTRALIA,"  An understanding of data modelling, data governance and data architecture. Communicating data and technical requirements to relevant data specialists (such as…",data analyst,Business Analyst,permanent,Sydney NSW,2022-07-17,3.8,
Six Degrees Executive,AUSTRALIA,"  In this role, you will work with multiple data sources to understand brand and category performance, adding relevant context to develop strong consumer and…",data analyst,Insights Analyst,permanent,Melbourne VIC,2022-07-26,,
Susquehanna International Group,AUSTRALIA,  We teach our Graduate Quantitative Researchers to use their problem-solving skills and mathematical creativity to find solutions in competitive and constantly…,data analyst,Graduate Quantitative Researcher/Analyst (PHD) - Start Dec 2...,graduate,Sydney NSW,2022-07-17,,
Vanguard,AUSTRALIA,"  Demonstrated experience in requirements gathering, data analysis and delivering insights that influence decision making.",data analyst,"Product Management Analyst, Superannuation",,Remote in Melbourne VIC,2022-07-17,,
Red Bull,AUSTRALIA,"  You will support the Sales Systems &amp; Insights Analyst on the end-to-end Business Intelligence process of data model creation, data analysis and reporting using…",data analyst,Business Intelligence Manager (m/w/d),permanent,Sydney NSW,2022-07-17,4.0,
MasterCard,AUSTRALIA,  Extensive experience in designing and building data structures / models for analytics solutions. Knowledge of Mastercard acquiring / merchant data products e.g.…,data analyst,"Consultant, Program Management (Data Analytics) – Deploy",full-time,St Leonards NSW,2022-08-03,4.0,
Accenture,AUSTRALIA,"  Demonstrated experience preparing data and building pipelines using streams of IoT data. Understanding of large-scale data sets, including both structured and…",data analyst,Tech Business Analyst,full-time,Sydney NSW,2022-07-17,4.0,
Mercer,AUSTRALIA,"  Understand, explore and document data controls, data sourcing and explore critical gaps analysis including understanding/defining data flows and sources.",data analyst,Business Data Analyst,full-time,Hybrid remote in Sydney NSW 2000,2022-07-17,,
Redbubble,AUSTRALIA,  Analytics practice: continuous improvement of our data capability. Ability to handle large and complex data sets using different applications as appropriate.,data analyst,Senior Product Data Analyst,,Melbourne VIC,2022-08-04,4.2,
AustralianSuper,AUSTRALIA,"  The areas of focus include investments, finance and operations and data. Technical business analyst experience, working on successful delivery of significant…",data analyst,Technical Business Analyst,full-time,Melbourne VIC,2022-08-06,3.0,
Adasa Sistemas,AUSTRALIA,"  The Business Analyst is a key liaison between our development team and our clients’ business and IT staff. The Business Analyst deals with the more tactical,…",data analyst,IT Business Analyst,undefined,Sydney NSW,2022-08-15,,130000-140000
Deloitte,AUSTRALIA,"  In this entry level role, you will assist in the preparation of a wide array of visas relating to Australian migration, with a focus oan business migration.",data analyst,Immigration Analyst,,Sydney NSW 2000,2022-08-02,3.9,
Hudson Australia,AUSTRALIA,"  5+ years' experience as a business analyst, preferable in a complex project or program environment. The Functional Business Analyst candidate will have a high…",data analyst,Functional Business Analyst - 100% Remote Role,contract,Remote in Brisbane QLD,2022-07-17,,
Aon Corporation,AUSTRALIA,  Advanced experience with SQL Server data manipulation and analysis. Analyzing client data to assess the exposure of a company to natural hazards.,data analyst,Catastrophe Research Analyst,,Hybrid remote in Sydney NSW 2000,2022-07-26,3.7,
Worley,AUSTRALIA,"  Flexible work arrangements including work from home, compressed work weeks, flexible hours etc. Employee benefits including salary continuance insurance,…",data analyst,Senior Cost Analyst,part-time,Geelong VIC,2022-07-17,3.9,
Accenture,AUSTRALIA,  Business and Technology Delivery Consultants and Managers. Implementation of the Core and Digital Banking System.,data analyst,Business Analyst / Business and Tech Delivery Consultant,full-time,Sydney NSW,2022-07-17,4.0,
ANZ Banking Group,AUSTRALIA,"  Focused on digital banking, the core of your work will be understanding our core banking systems and how they can service our customers’ digital banking needs.",data analyst,Technical Business Analyst,,Melbourne VIC,2022-08-10,4.1,
Bankwest,AUSTRALIA,  Deep dive into data and perform analysis that can be articulated through data outputs and visualisations. The Decision Support team are focused on deepening our…,data analyst,Senior Analyst (12 months ),full-time,Perth WA,2022-08-04,3.5,
Accenture,AUSTRALIA,"  As a Tech Business Analyst you will consult on client projects, providing functional oversight, coupled with strategic support and advise to ensure the…",data analyst,Technical Business Analyst,full-time,Brisbane QLD+5 locations,2022-07-17,4.0,
Great Southern Bank,AUSTRALIA,  Strong experience with SQL to solve analytical business problems or to build data products and ensure efficiency.,data analyst,Lead Technical Data Analyst,,Brisbane QLD,2022-08-13,3.5,
Morgan McKinley,AUSTRALIA,"  Further, you will play an important part in developing remediation data analytics capabilities and partner with stakeholders to evaluate risk, analyse data and…",data analyst,Data Analyst Lead,undefined,Remote in Sydney Central Business District NSW,2022-08-12,,800-1000
EY,AUSTRALIA,"  Worked in a similar Business Analyst position for at least 3-5 years with experience in data management, data governance and data strategy.",data analyst,Technical Business Analyst | Life Insurance | Data &amp; Analyti...,,Sydney NSW 2000,2022-07-17,4.0,
Westpac Group,AUSTRALIA,  Coach and support junior data products business analysts to help them develop their business analysts competencies.,data analyst,Data Product Business Analyst,full-time,Remote in Sydney NSW,2022-07-17,3.9,
Commonwealth Bank,AUSTRALIA,"  Perform current stage analysis, and document detailed data mapping, data definitions and transformation rules to help create technical requirements for data…",data analyst,Senior Technical Business Analyst - Data Transformation,full-time,Hybrid remote in Sydney Central Business District NSW,2022-08-02,4.0,
Macquarie Group Limited,AUSTRALIA,"  Experience in data mapping and data migration. Reporting through to a global team in the US, the role will be critical in ensuring a co-ordinated approach to…",data analyst,Technical Business Analyst - Sydney,permanent,Sydney NSW,2022-07-17,3.8,
AnglicareSA,AUSTRALIA,"  You will work across integration, data warehousing and troubleshooting. Ensure suitable reporting across a range of applications (including data warehouse and…",data analyst,Analyst Programmer,permanent,Remote in Hindmarsh SA,2022-08-16,3.6,
Westpac Group,AUSTRALIA,  Extracting and analysing data using data warehouse and database management software to conduct complex database queries and setting up automated processes for…,data analyst,SQL Analyst- Consumer Banking,permanent,Remote in Australia,2022-07-17,3.9,
Auto &amp; General Insurance,AUSTRALIA,"  Monitoring, interpreting and analysing trends in Travel insurance portfolio, policy and claims data. Excellent numerical and analytical skills to monitor and…",data analyst,Travel Underwriting Analyst,full-time,Toowong QLD,2022-07-17,3.8,
IDEXX,AUSTRALIA,  You will have outstanding analytical skills and a strong aptitude to take data from multiple sources and manipulate it to provide key insights which will drive…,data analyst,Financial Analyst Sr I - Ref Labs,full-time,East Brisbane QLD 4169,2022-07-17,3.4,
Commonwealth Bank,AUSTRALIA,"  Experience with relevant tools such as SAS, R and Python, conducting modelling, data manipulation and data visualization; On a day to day basis you will be:",data analyst,Credit Risk Analyst,full-time,Temporarily Remote in Sydney Central Business District NSW,2022-07-17,4.0,
ASG Group,AUSTRALIA,"  Analyse the problem statements, processes, systems and data, to build use cases and requirement documents to guide solution design, discover new solution…",data analyst,ACT - BUSINESS ANALYST (TIER L1-2),permanent,Remote in Canberra ACT,2022-07-26,2.3,
Hitachi,AUSTRALIA,  Hitachi Solutions has been recognized as the winner for the 2021 Microsoft Dynamics 365 Field Service Partner of the Year Award and also named a finalist for…,data analyst,Jr. Business Analyst: Dynamics 365 Finance,permanent,Temporarily Remote in Sydney NSW,2022-08-11,3.8,
Australian Competition &amp; Consumer Commission...,AUSTRALIA,"  The Regulatory branch is responsible for regulatory guidance, accreditation of data recipients, promoting compliance, enforcement &amp; exemptions.",data analyst,"Incident &amp; Problem Analyst, APS6, Consumer Data Right Divisi...",undefined,Adelaide Region SA,2022-08-12,,89541-100359
Advance Delivery Consulting (ADC),AUSTRALIA,  Interpreting the functional aspect of data &amp; reporting aspects of data. Present the data to business and the consumers of the data which qualifies the scope and…,data analyst,Data Analyst,,Victoria+1 location,2022-07-17,,
Carma,AUSTRALIA,  Work in close partnership with the service design and product design teams to embed data into the ideation process.,data analyst,Product Analyst,full-time,Sydney NSW,2022-07-17,,
CSR Group,AUSTRALIA,"  Analyse customer data and processes to identify improvement opportunities; Provide the Customer Service Manager with accurate, relevant and timely information…",data analyst,Business Analyst - Scoresby,permanent,Melbourne VIC,2022-07-26,3.4,
Linfox,AUSTRALIA,"  Experience using data to develop and implement continuous improvement opportunities. Proactively support the growth and development of the NDC operation, by…",data analyst,Business Analyst,full-time,Laverton North VIC,2022-08-06,3.7,
PwC,AUSTRALIA,"  Delivering crucial business insights to clients through data analytics and data visualisation. You are a confident data analyst with working knowledge of ETL,…",data analyst,Data Management and Analytics | Experienced Manager | Canber...,full-time,Canberra ACT,2022-07-17,4.0,
IT Alliance Australia,AUSTRALIA,"  Experience using and working with Microsoft Excel to analyse data and collate findings, including formulas, pivot tables and PowerQuery / PowerPivot.",data analyst,Data Analyst,,Canberra ACT,2022-07-26,,
Zurich Gruppe Deutschland,AUSTRALIA,"  As a vital member of the team, you also be involved in everything from User Acceptance testing, data analysis, planning and forecasting through to system…",data analyst,Business Analyst,,North Sydney NSW,2022-07-17,3.7,
Robert Half,AUSTRALIA,  Definitions of elements such as data dictionaries (update and development). Over 5 years' experience at a Business Analyst working on technology projects with…,data analyst,Business Analyst | Data Management | Financial Services,undefined,Melbourne VIC,2022-08-02,3.9,700
HiTech Personnel,AUSTRALIA,"  Experience in developing data governance frameworks. Developing the departments data strategy, governance framework and management policies.",data analyst,Business Analyst - Data,contract,Canberra ACT,2022-08-13,,
Coles Supermarkets,AUSTRALIA,"  Commercial experience in a senior project analyst, business partner, PMO or equivalent role in the field of Information Technology.",data analyst,Senior Portfolio Analyst,permanent,Temporarily Remote in Hawthorn East VIC 3123,2022-08-12,3.8,
Dan Murphy's,AUSTRALIA,  Strong data analysis and modelling skills to analyse and summarise high volumes of data from a variety of sources. A minimum of 5 years of relevant experience.,data analyst,Finance Analyst - Store Operations,full-time,Fairfield VIC 3078,2022-07-17,3.4,
Link Group,AUSTRALIA,  Peer review of data entry and allocated tasks. To provide investment operations support to Link Fund Solution’s boutique fund managers covering a range of…,data analyst,Senior Portfolio Analyst,,Parramatta NSW 2150,2022-07-30,2.7,
Thermo Fisher Scientific,AUSTRALIA,  Document and standardise data entry processes for all systems to ensure data integrity for accurate reporting.,data analyst,Business Analyst - Service Operations,full-time,Scoresby VIC,2022-07-23,3.5,
Link Group,AUSTRALIA,"  Strong data analysis and data interpretation skills with experience extracting and working with raw data. Expertise in analytics, data mining and creating data…",data analyst,Reporting and Insights Analyst,,Melbourne VIC,2022-07-20,2.7,
Xero,AUSTRALIA,"  Strong data literacy skills earned through a mixture of experience with data. Demonstrated MData Analyst experience, ideally working with customer &amp; digital…",data analyst,Senior Customer Insights Analyst,,Melbourne VIC,2022-07-22,4.4,
Commonwealth Bank,AUSTRALIA,"  Sound knowledge of data-warehouse technologies, especially with regards to financial data and common layers. Contribute to consultation/data extract requests as…",data analyst,Technical Business Analyst,full-time,Sydney Central Business District NSW,2022-08-03,4.0,
EY,AUSTRALIA,"  Lead and Collaborate with client stakeholders to design the data migration solution components covering the data mapping, transformation rules, data load, data…",data analyst,Data Preparation Lead | Data and Analytics,,Melbourne VIC 3000,2022-08-05,4.0,
DTEX Systems,AUSTRALIA,"  Analyze customer activity data to identify current or potential threat-related events, behaviors, and patterns.",data analyst,Insider Threat Analyst,full-time,Adelaide CBD SA 5000,2022-07-17,,
RPS Group,AUSTRALIA,"  Notifying stakeholders about any issues or business impacts connected to the data. Continuously evaluating opportunities and risks, providing analysis of data…",data analyst,Technical Business Analyst,part-time,Remote in Fortitude Valley QLD,2022-07-17,3.2,
Virtusa,AUSTRALIA,  7.Support in deploying Cloudera Enterprise to create central data hubs combining large volumes of diverse and detailed data.,data analyst,Lead Business Analyst,full-time,Sydney NSW,2022-07-22,3.7,
Royal Women's Hospital,AUSTRALIA,  Clinical Costing is the process of matching the financial information held in the General Ledger to the clinical activity of the health service.,data analyst,Business &amp; Costing Analyst,,Melbourne VIC+1 location,2022-08-13,4.4,
Citadel Securities,AUSTRALIA,  Use unconventional data sources to drive innovation. Background working in a data driven research environment.,data analyst,Quantitative Research – Full Time,full-time,Sydney NSW,2022-07-17,,
Hatch,AUSTRALIA,"  Strong data analytics skills, including experience with business requirements gathering, analysis and ability to translate business requirements into technical…",data analyst,Business Analyst,,Brisbane QLD,2022-07-21,3.9,
Rizing,AUSTRALIA,"  Identifies and analyzes problems, making solution design recommendations with supporting rationale and comprehensive data analysis.",data analyst,Functional Analyst- Consulting,,Remote in Queensland,2022-08-01,,
BNP Paribas,AUSTRALIA,"  Ensure database performance, replication and data backups are operating efficiently. Analysis of data related issues to determine how best to resolve…",data analyst,Application Support Analyst (Permanent),contract,Sydney NSW,2022-08-05,3.9,
International SOS,AUSTRALIA,"  Servicing corporate, governmental, and non-governmental clients globally, International SOS, a pioneer &amp; leader in International Health &amp; Security Risk provides…",data analyst,"Security Specialist, Information &amp; Analysis",,Australia,2022-07-30,3.4,
Omnirecruitment,AUSTRALIA,"  Provide ideal solutions and products to customers in a diverse set of. Customers achieve their vision through superior products, prices, and.",data analyst,Jr. Business Analyst,permanent,Temporarily Remote in Sydney NSW,2022-08-11,,
Hudson Australia,AUSTRALIA,  Analysis of key HR data and indicators that affect the workforce. Your reporting will drive continuous improvements and enable the business to take data driven…,data analyst,Business Analyst - Payroll,undefined,Remote in Adelaide Region SA,2022-07-17,,100000-120000
Startek,AUSTRALIA,  Facilitate workshops and/or use data driven insights to support project design and inform decision making processes. Permanent contract with Startek Australia.,data analyst,Associate Business Analyst (IT),permanent,Melbourne VIC,2022-08-13,3.0,
Australian Prudential Regulation Authority (APRA),AUSTRALIA,"  An exciting opportunity has become available for a Senior Analyst in the Credit Risk team, where you will contribute to retail and non retail credit risk…",data analyst,"Senior Analyst, Credit Risk",,Sydney NSW,2022-07-17,4.5,
