company_name,country,job_description,job_field,job_title,job_type,non_remote_location,post_date,rating,salary
Suicide Prevention Australia,AUSTRALIA,"  Supporting others to build data capability. Implement best practice data research, evaluation and impact measurement.",data analyst,Data &amp; Impact Analyst/Advisor,full-time,Hybrid remote in Sydney NSW,2022-07-17,,
Atos,AUSTRALIA,  The Senior Data Analyst role involves working alongside other members of our Atos Team to migrate data and set to work the latest generation of AMPS (Asset…,data analyst,DATA ANALYST,,Sydney NSW,2022-08-13,3.5,
Linfox,AUSTRALIA,"  Experience in developing data visualisations and paginated reporting solutions within Power BI. Manage the data analysis to evaluate, prepare and present…",data analyst,Reporting Analyst,full-time,Essendon Fields VIC,2022-07-29,3.7,
UniSuper,AUSTRALIA,"  Initial data ingestion to supporting end-user data analysis. Good knowledge of object-oriented principles, data structure and algorithms; understanding data…",data analyst,Investments Data Analyst,full-time,Melbourne VIC,2022-07-17,4.0,
NSW Government -Customer Strategy &amp; Technology,AUSTRALIA,  Intelligent Transport Systems (ITS) is a part of the Customer Strategy and Technology division of Transport for NSW.,data analyst,Program Business Analyst,undefined,Remote in Sydney NSW,2022-08-16,,120423-134872
Aginic,AUSTRALIA,"  Experience across a range of different data technologies, such as: 3+ years experience in a data analytics role, BI or related role.",data analyst,Experienced Data Analyst,full-time,Remote in Brisbane QLD+2 locations,2022-07-17,,
DHL,AUSTRALIA,  Manage solution design data requirements and address gaps to complete effective design of supply chain solutions. Support the design of supply chain projects.,data analyst,Horsley Park | Solutions Design Analyst,contract,New South Wales,2022-07-27,3.7,
Ethos BeathChapman,AUSTRALIA,"  Experience in data quality, data transformation, data loading, and data reconciliation activities. Perform data profiling, produce data quality assessment…",data analyst,Data Migration Analyst,undefined,Australia,2022-08-09,,145000-165000
Queensland Treasury,AUSTRALIA,  Actively promote statistical standards and review statistical data in consultation with relevant government agencies.,data analyst,Senior Data Analyst,,Brisbane QLD,2022-08-16,4.0,
NAB - National Australia Bank,AUSTRALIA,"  Develop process models, data models, business rules, target operating models, workflows, reporting and other required outputs. Work type: Permanent Full time.",data analyst,Senior Data Analyst,permanent,Melbourne VIC,2022-08-13,3.6,
EY,AUSTRALIA,  Extensive experience in dealing with data challenges – data quality and performance – throughout complex technology landscapes.,data analyst,Data Engineers - Technology Consulting - Data &amp; Analytics,undefined,Melbourne VIC 3000+1 location,2022-07-17,4.0,90000
Telethon Institute for Child Health Research,AUSTRALIA,"  Experience with analysis of family connections data,. Experience with data linkage of large population health datasets,.",data analyst,Senior Data Analyst - The ORIGINS Project,undefined,Australia,2022-08-10,3.6,15899
AWS Australia Pty Ltd,AUSTRALIA,"  Demonstrated industry efficiency in the fields of database, data warehousing or data sciences. As a Data &amp; Analytics Architect, you will develop, deliver and…",data analyst,Data &amp; Analytics Architect,full-time,Canberra ACT,2022-08-09,3.5,
Macquarie Group Limited,AUSTRALIA,  Translate requirements to data engineers to source data and collate for analysis. Document and explain to non-data experts how to use and interpret data.,data analyst,Power BI Analyst,permanent,Sydney NSW,2022-07-17,3.8,
Dyson,AUSTRALIA,"  Strong data analysis skills using Excel, Google Sheets and SQL (Excel required, SQL a plus). Reporting to the Marketplaces Account Manager you will manage all…",data analyst,eCommerce Analyst,,Sydney NSW,2022-07-17,3.5,
Gippsland Southern Health Service,AUSTRALIA,  Prepare financial models by evaluating financial data. Analyse past and current financial data of the company. Ensure internal control systems are in place.,data analyst,Financial Business Analyst,undefined,Leongatha VIC,2022-08-16,5.0,80000-90000
Capgemini,AUSTRALIA,  Excellent communicator with the ability to translate data into actionable insights. Experience with data visualisation with Power bi/Tableau.,data analyst,Business Analyst,,Adelaide Region SA,2022-08-05,3.8,
Aututech,AUSTRALIA,"  Minimum of 3 years’ experience of working on data analysis and complex data management projects, particularly in the area of master data management.",data analyst,Data Analyst,,Melbourne VIC,2022-07-17,,
Macquarie Group Limited,AUSTRALIA,  Strong analytical skills with experience using Python to analyse structured and unstructured data to generate insights and/or improve business processes.,data analyst,Senior Data Analyst/Engineer,permanent,Sydney NSW,2022-07-17,3.8,
SA Government -SOUTH AUSTRALIA POLICE,AUSTRALIA,"  Although not essential an appropriate tertiary qualification in intelligence, research, data and/or statistical analysis will be considered favourably.",data analyst,INTELLIGENCE ANALYST,undefined,Adelaide CBD SA 5000,2022-08-09,,77901
Commonwealth Bank,AUSTRALIA,  Identify data quality issues and support enhancement of data quality. Gather data from various platforms and sources and maintain a clean data structure in MS…,data analyst,Data Insights &amp; Analytics Senior Analyst,full-time,Hybrid remote in Sydney Central Business District NSW,2022-07-22,4.0,
Macquarie Group Limited,AUSTRALIA,  Performing data remediation investigations and produce high quality data insights. Knowledge of data governance processes and tools and data risk management.,data analyst,Macquarie Capital | Data Analyst,permanent,Sydney NSW,2022-08-04,3.8,
Flight Centre Travel Group,AUSTRALIA,  Uses measurement tools for routine analysis of data. Identifies and implements improvements to data collection methods. Supports adoption of agreed approaches.,data analyst,Product Analyst - Reporting &amp; Analytics,full-time,Queensland,2022-07-17,3.5,
EY,AUSTRALIA,"  Passionate about solving big complex problems using data and technology. Designing, building and implementing some of the largest data and cloud solutions in…",data analyst,Data &amp; Analytics - Financial Services,undefined,Sydney NSW 2000,2022-07-17,4.0,73500
Commonwealth Bank,AUSTRALIA,"  Data Analysis Skills – Review large datasets to analyse, map, and assess impact due to data flow changes. Hands-on experiences in data and reporting technology…",data analyst,Senior Technical Business Analyst - Data,full-time,Sydney Central Business District NSW,2022-08-16,4.0,
Indicore ICT,AUSTRALIA,"  Conduct detailed data analysis on data used across business units to evaluate business processes, discrepant data scenarios and improve on/create new feature.",data analyst,Senior Data Analyst,contract,Canberra ACT,2022-07-17,,
Techtronic Industries (TTI),AUSTRALIA,"  Monitor data integrity of reporting and data management systems. Gather data from various source systems and databases, cleanse, transform and prepare data for…",data analyst,BI Analyst,,Hybrid remote in Bayswater WA,2022-08-16,3.5,
FinXL,AUSTRALIA,"  You will have a background in data stewardship, data governance or data quality. Support the data owners/stewards to set common data standards, definitions and…",data analyst,Data Steward / Data Governance / Data Quality Analyst,contract,Sydney NSW,2022-08-10,,
Westpac Group,AUSTRALIA,"  This role is responsible for overseeing design, delivery and ongoing maintenance of a suite of data visualisation and analytical insights engines.",data analyst,Senior Analyst-Data Visualisation,permanent,Remote in Australia,2022-08-03,3.9,
Omtek,AUSTRALIA,"  9am to 6pm; Monday through Friday JOB DUTIES : Design, develop, implement, test advanced software modules in complex IT environments; provide high level…",data analyst,BUSINESS INTELLIGENCE ANALYST,full-time,South Australia,2022-07-17,,
EY,AUSTRALIA,  Experience within a role in the data &amp; analytics field. When you join us you will support our clients in defining and implementing a data journey aligned with…,data analyst,Expressions of Interest - Work in Data &amp; Analytics,undefined,Melbourne VIC 3000,2022-07-18,4.0,90000
Forever New,AUSTRALIA,  Excellent application of data analytics and insights into strategy. Work type: FTP - Full-time Permanent. The successful applicant will have previous experience…,data analyst,eCommerce Operations Analyst,permanent,Richmond VIC,2022-07-17,3.6,
Bupa,AUSTRALIA,"  Ability to work with large sets of data from various data sources, conducting deep dives to identify trends and provide insights using your expertise in data…",data analyst,IT Audit Analyst,full-time,Remote in Victoria,2022-07-17,3.3,
University of New South Wales,AUSTRALIA,  The Senior Systems and Data Analyst is responsible for the maintenance &amp; improvement of research systems and data solutions related to research administration …,data analyst,Senior Systems &amp; Data Analyst – Research Systems,undefined,Sydney NSW,2022-08-10,4.2,112154-126366
Equifax,AUSTRALIA,"This also includes the reparation of data for analytical use by building data pipeline to gather data from multiple sources and systems, integrating,…",data analyst,Senior Data Analyst,full-time,Docklands VIC 3008,2022-07-23,3.5,
Insurance Australia Group,AUSTRALIA,"Experience in working with big and complex data. Tertiary qualification/s majoring in meteorology, atmospheric science, natural hazards, applied mathematics,…",data analyst,Weather Analyst,permanent,Sydney NSW 2000,2022-08-12,3.7,
icare NSW,AUSTRALIA,Experience with usage of research data analysis packages. Strong experience in compiling and analyzing customer data and communicating to stakeholders.,data analyst,Customer Insights Analyst,undefined,Hybrid remote in Sydney Central Business District NSW,2022-08-12,2.3,113000
University of New South Wales,AUSTRALIA,The Senior Systems and Data Analyst is responsible for the maintenance &amp; improvement of research systems and data solutions related to research administration …,data analyst,Senior Systems &amp; Data Analyst – Research Systems,undefined,Sydney NSW,2022-08-10,4.2,112154-126366
Tritium,AUSTRALIA,Guide how existing data can be refined and augmented with additional data sources to improve analysis effectiveness. Mentor and coach team members.,data analyst,Data Analyst,full-time,Brisbane QLD,2022-07-21,3.6,
HiTech Personnel,AUSTRALIA,Providing documented data modelling solutions. You will be responsible for assisting with the management of the organisations data assets in order to improve…,data analyst,Data Analyst,contract,Canberra ACT,2022-08-13,,
UGL Limited,AUSTRALIA,"Where required, this role will also provide associated training to stakeholders and associated documentation to ensure the business is utilising common data…",data analyst,Data &amp; Reporting Analyst,full-time,Blue Mountains NSW,2022-07-17,3.6,
Supply Chain,AUSTRALIA,"Insightful analysis of the financial performance of all Distribution centres across Victoria and Tasmania outlining key drivers, impacts thereof and recommend…",data analyst,Primary Connect - Business Analyst,full-time,Melbourne VIC 3000,2022-08-09,,
PwC,AUSTRALIA,"Undertaking data maturity assessments, current-state architecture and data platform assessments and developing data inventories.",data analyst,Manager | Data &amp; Business Analyst,full-time,Canberra ACT,2022-07-17,4.0,
NSW Government -Department of Customer Service,AUSTRALIA,"Desirable qualifications and/or experience in data mining or data visualisation. If you have been looking for roles such as performance analyst, data analyst,…",data analyst,"Business Analyst, Planning",undefined,Sydney NSW,2022-08-09,,99431
Capgemini,AUSTRALIA,Excellent communicator with the ability to translate data into actionable insights. Experience with data visualisation with Power bi/Tableau.,data analyst,Business Analyst,,Adelaide Region SA,2022-08-05,3.8,
Queensland Treasury Corporation,AUSTRALIA,"Experience with Power BI, databases and data warehouse structures would be highly regarded. It is an important role for the Risk Division, as the key enabler…",data analyst,"Analyst, Risk",full-time,Brisbane QLD,2022-08-04,4.0,
JB Hi-Fi,AUSTRALIA,"Lead continuous improvement activities, especially in relation to the data lifecycle, data visualization and reporting principles.",data analyst,Senior Data Analyst,permanent,Remote in Victoria,2022-07-17,4.0,
EY,AUSTRALIA,Extensive experience in dealing with data challenges – data quality and performance – throughout complex technology landscapes.,data analyst,Data Engineers - Technology Consulting - Data &amp; Analytics,undefined,Melbourne VIC 3000+1 location,2022-07-17,4.0,90000
Sydney Water,AUSTRALIA,"Deliver on the data migration strategy and data synchronisation processes. Champions Master Data Management (MDM) and data capability, particularly with…",data analyst,Business Analyst ( Data Migration),permanent,Parramatta NSW,2022-07-17,3.8,
Coles Group,AUSTRALIA,"  As a Business Analyst - Product, you will be responsible for gathering requirements for various initiatives, supporting the growth of our Coles Plus member…",data analyst,Business Analyst,full-time,Temporarily Remote in Hawthorn East VIC 3123,2022-07-17,3.9,
Macquarie Group Limited,AUSTRALIA,  Develop insightful metrics and create dashboards to visualize financial crime data and trends. Owning and delivering analytics projects and automated data…,data analyst,Insights Analyst - Data Analytics,permanent,Sydney NSW,2022-07-17,3.8,
Auto &amp; General Insurance,AUSTRALIA,"  Strong business modelling, process mapping and data models experience. Great benefits; bonus scheme, discounted products &amp; paid volunteer day.",data analyst,Business Analyst,full-time,Sunshine Coast QLD+2 locations,2022-08-12,3.8,
Toll Group,AUSTRALIA,"  Assist in the timely compilation of data for business performance reports and dashboards. Strong numerical and analytical skills, with the ability to dive into…",data analyst,Junior Continuous Improvement Analyst,full-time,Melbourne VIC,2022-07-17,3.6,
ALDI,AUSTRALIA,"  Work across multiple business functions to provide strategic, data-based decision-making support, by partnering with project teams and facilitating the use of…",data analyst,APT Analyst,undefined,Remote in New South Wales,2022-07-17,3.3,124900-142500
NSW Government -Public Service Commission,AUSTRALIA,"  Apply data governance principles to manage and resolve data quality issues. Compile, organise and analyse large data sets using various analytical, statistical…",data analyst,"Analyst, Analytics &amp; Insights",,Sydney NSW,2022-08-06,,
Amzn Commercial Srvcs Pty Ltd,AUSTRALIA,"  Strong analytical and data skills are essential to succeed in this role. Prior experience working in data &amp; analytics (Excel, SQL, Tableau).",data analyst,"Brand Analyst, Amazon Vendor Services",full-time,Sydney NSW,2022-07-17,3.5,
ANZ Banking Group,AUSTRALIA,"  Role Type: 12 month Fixed Term contract, Full-time. Under the Third Party Risk Management (TPRM) program, this role is responsible for defining business…",data analyst,"Business Analyst, Know-Your-Supplier",undefined,Melbourne VIC,2022-07-17,4.1,500
Commonwealth Bank,AUSTRALIA,"  Data Analysis Skills – Review large datasets to analyse, map, and assess impact due to data flow changes. Hands-on experiences in data and reporting technology…",data analyst,Senior Technical Business Analyst - Data,full-time,Sydney Central Business District NSW,2022-08-16,4.0,
Canva,AUSTRALIA,  Experience in a data scripting language (Python or R) and analysing marketing data using frameworks such as Causal Impact or GeoXExperience working with ad…,data analyst,Senior Marketing Data Analyst (Open for Remote across ANZ),full-time,Remote in Sydney NSW,2022-07-29,3.8,
Australian Prudential Regulation Authority (APRA),AUSTRALIA,  Consider how changes to data items impact the broader data collection and interact with AASB or international regulatory data items.,data analyst,Senior Analyst - Data Collection Design,,Sydney NSW,2022-07-17,4.5,
ENGIE ANZ,AUSTRALIA,"  Analyse equipment/asset/building performance data. The ideal incumbent will have experience with using data extraction and data manipulation tools such as SQL,…",data analyst,Data Analyst,permanent,Melbourne VIC,2022-07-17,,
Monadelphous,AUSTRALIA,  Extensive experience working with people data analysis at a large organisation. Improve and embed strong governance principles in data analysis and reporting.,data analyst,Business Analyst – HR,,Perth WA,2022-08-16,4.1,
Pernod Ricard,AUSTRALIA,  Previous experience as a data analyst or digital marketing coordinator either in a digital agency or Omni channel environment.,data analyst,Marketing Data Analyst.,full-time,Sydney NSW,2022-08-02,4.3,
FinXL,AUSTRALIA,"  You will have a background in data stewardship, data governance or data quality. Support the data owners/stewards to set common data standards, definitions and…",data analyst,Data Steward / Data Governance / Data Quality Analyst,contract,Sydney NSW,2022-08-10,,
"JPMorgan Chase Bank, N.A.",AUSTRALIA,"  Morgan is one of the few full-service and fully-integrated financial institutions, providing products and services from J.P.",data analyst,CIB - Credit Risk Analyst - Australia,full-time,Sydney NSW,2022-07-27,3.8,
DWS,AUSTRALIA,"  Exciting projects with some of Australia's best Tier 1 enterprise businesses. Applicants must hold Australian Citizenship, Permanent Residency (PR) – DWS are…",data analyst,Senior Business Analyst,undefined,Brisbane QLD+2 locations,2022-07-26,3.7,150000
EY,AUSTRALIA,"  Worked in a similar Business/Data Analyst position for at least 3-5 years with experience in data management, data governance and data strategy.",data analyst,Technical Business Analyst | Data &amp; Analytics,,Perth WA 6000+1 location,2022-08-05,4.0,
Sportsbet,AUSTRALIA,"  2+ years in an analytics manager, business analyst or data analyst role. Analyse data to clarify and validate requirements Analysis.",data analyst,Data Science Business Analyst / Enablement Manager,full-time,Melbourne VIC,2022-08-04,2.8,
Reserve Bank of Australia,AUSTRALIA,"  Experience in defining data reconciliation rules and building data reconciliation frameworks. A very good knowledge on test automation frameworks, particularly…",data analyst,Senior Test Analyst (ETL/Data-warehousing),contract,Sydney NSW,2022-08-03,4.0,
Manpower,AUSTRALIA,  Knowledge of both quantitative and qualitative data analyses. Provide data analytic assistance and training to other Agency staff.,data analyst,Data Analyst / Statistician,,Brisbane Central Business District QLD,2022-08-05,3.8,
Zip Co,AUSTRALIA,"  Good SQL Server skills for performing complex queries and data manipulation. We are looking for a Data Analyst to join our Analytics team, supporting the…",data analyst,"Data Analyst, Customer Solutions",full-time,Sydney NSW,2022-07-28,,
EY,AUSTRALIA,"  Passionate about solving big complex problems using data and technology. Designing, building and implementing some of the largest data and cloud solutions in…",data analyst,Data &amp; Analytics - Financial Services,undefined,Sydney NSW 2000,2022-07-17,4.0,73500
ING,AUSTRALIA,"  We’re looking for a Campaign Data Analyst in KYC for a 12 months fixed term contract to sit within our targeted marketing team to support the retail bank, in…",data analyst,Campaign Data Analyst (KYC) - 12 months Fixed Term Contract,full-time,Sydney NSW,2022-07-29,3.9,
DHL,AUSTRALIA,  Manage solution design data requirements and address gaps to complete effective design of supply chain solutions. Support the design of supply chain projects.,data analyst,Horsley Park | Solutions Design Analyst,contract,New South Wales,2022-07-27,3.7,
Suncorp Group,AUSTRALIA,"  Effective coordination of all data inputs to audit reporting and information repositories, ensuring data accuracy and security in line with information…",data analyst,Operations Analyst - Internal Audit,permanent,Australia,2022-08-06,3.5,
Link Group,AUSTRALIA,"  The process analyst will be responsible for identifying the business processes, analyse and determine the process changes due to transition, document the As-Is…",data analyst,Process Analyst,,Melbourne VIC,2022-08-10,2.7,
RAA,AUSTRALIA,"  As the Data Governance Analyst on the program, you'll assist in the development of the data governance framework to the project to the program to ensure best…",data analyst,Data Governance Analyst,full-time,Mile End SA,2022-07-17,3.1,
Australian Federal Police (AFP),AUSTRALIA,"  Demonstrated experience with modern data analytics, data engineering and/or platforms. The roles are jointly responsible for developing and supporting new…",data analyst,"Data Analysts, Data Engineers and Platform Administrators",undefined,Canberra ACT,2022-08-11,3.8,99929-110255
Bank of Queensland,AUSTRALIA,"  Further to optimising performance of the data analytics solutions and monitoring data usage, you will be key in deriving insights from business processes across…",data analyst,Senior Azure Enterprise Data Analyst,full-time,Brisbane QLD,2022-08-12,3.5,
NSW Government -Department of Education,AUSTRALIA,"  Experience with data analytics and data visualisation tools, such as Power BI. Work effectively to deliver solutions suitable for stakeholders with varying…",data analyst,Senior Data Analyst,full-time,Hybrid remote in Parramatta NSW,2022-08-02,3.9,
NAB - National Australia Bank,AUSTRALIA,  Work type: Permanent Full time. Showcase your exceptional experience in Big Data and Data Engineering. This team leads the TDM design as well as oversees the…,data analyst,Senior Analyst Data Engineer,permanent,Melbourne VIC,2022-07-17,3.6,
Optus,AUSTRALIA,"  Outstanding financial modelling, data analysis and pricing skills; In this hands-on role within evaluating new B2B business opportunities by developing business…",data analyst,Commercial Analyst - Fixed Term Contact,,Sydney NSW,2022-08-01,3.7,
Macquarie Group Limited,AUSTRALIA,"  A solid business analyst background preferably in the banking and financial services or data space. Experience with big data and/or a data lake, and the…",data analyst,Data Transformation Business Analyst,,Sydney NSW,2022-08-04,3.8,
CGI Inc,AUSTRALIA,"  In your role as a business analyst you will join the newly created Space, Defence and Intelligence sector in Australia. Experience in any sector is welcome.",data analyst,Business Analyst,full-time,Sydney NSW,2022-07-29,3.6,
Anglicare,AUSTRALIA,"  This role will be responsible for working across the current scope of projects, defining requirements, scoping the range of solutions and determining which fits…",data analyst,IT Business Analyst,full-time,Hills District NSW,2022-08-10,3.2,
Optus,AUSTRALIA,"  Performing data, statistical and commercial analysis to understand how customer behaviour, product changes and market dynamics impact the consumer business.",data analyst,Senior Data Analyst,,Hybrid remote in Sydney NSW,2022-08-05,3.7,
Link Group,AUSTRALIA,"  Gathers, analyses and documents data specifications to support the data migration requirements and communicates these in technical terms to analyst programmers,…",data analyst,Data Migration Analyst,,Parramatta NSW 2150,2022-07-17,2.7,
JLL,AUSTRALIA,"  You may be a fresh graduate from University, or have knowledge of data visualization and analytical techniques. Complete the technical development of B.",data analyst,Business Intelligence Analyst,,Melbourne VIC,2022-07-22,3.7,
Transurban,AUSTRALIA,"  You'll work on the uplift of the reporting, data analysis and data visualisation capability within the team. Well developed skills in SQL and data visualisation…",data analyst,Senior Finance Analyst - Data Analytics,permanent,Docklands VIC,2022-08-06,3.9,
Zurich Insurance,AUSTRALIA,  You will also champion a data driven culture within the organisation and drive analytic thought leadership through the boarder business.,data analyst,Business Insights Data Analyst,,North Sydney NSW,2022-07-17,3.7,
Supply Chain,AUSTRALIA,  Investigate and fix the data integration issues with internal and external systems. Assist in the ongoing development and maintenance of our SQL database/data…,data analyst,Technical Business Analyst,permanent,Bella Vista NSW 2153,2022-08-11,,
EY,AUSTRALIA,  Experience within a role in the data &amp; analytics field. When you join us you will support our clients in defining and implementing a data journey aligned with…,data analyst,Expressions of Interest - Work in Data &amp; Analytics,undefined,Melbourne VIC 3000,2022-07-18,4.0,90000
Macquarie Group Limited,AUSTRALIA,"  An understanding of data modelling and data warehouse concepts, data architecture principles and the ability to extract and transform data from multiple sources…",data analyst,Data Analytics and Insights Analyst,permanent,Sydney NSW,2022-07-17,3.8,
Qantas Airways Limited,AUSTRALIA,"  Experience with data visualisation and dashboard building, with Tableau experience desired. Experience in turning raw data into actionable, value-adding…",data analyst,Insights Analyst,permanent,Sydney NSW,2022-07-17,4.1,
DHL,AUSTRALIA,  Numerical analysis of raw data into accurate reports. Detailed data analysis on SKU behaviour to optimise productivity in an automated picking system.,data analyst,Altona | Business Analyst,contract,Victoria,2022-07-17,3.7,
