company_name,country,job_description,job_field,job_title,job_type,non_remote_location,post_date,rating,salary
L&amp;Q,United Kingdom,"  Experience in data administration, management and change control processes. Highly analytical and able to use and build multiple, complex data sources inc. SQL,…",data analyst,Data Analyst,permanent,Remote in Kent,2022-08-13,3.5,
Dartmouth Partners,United Kingdom,"  The role will be responsible for extracting and analysing all people data, from employee engagement surveys to gender pay gap reporting.",data analyst,HR Data Analyst,undefined,Hybrid remote in London,2022-08-13,,45000-55000
Live Nation,United Kingdom,"  Business analyst, data analyst, Excel specialist, data &amp; reporting, insight analyst, reporting executive, management information analyst, ticketing analyst.",data analyst,Reporting Analyst,full-time,Hybrid remote in London,2022-08-04,4.1,
APPRENTIFY,United Kingdom,"  Apprenticeship standard Data analyst (Level 4). Identify data sources to meet the organisation's requirement, using evidence-based decision making to establish…",data analyst,Data Analyst Apprentice,undefined,Coventry CV1,2022-08-13,,16500
The Team @ Satis Education,United Kingdom,  Manage all data required by the Academy for external and internal use. Provide strategic guidance to the Academy to ensure the efficiency of the administration…,data analyst,Strategic Data Analyst,undefined,Birmingham B4,2022-07-29,,40578-45648
Euro Car Parts,United Kingdom,  The ability to network outside of the business and seek innovative technology solutions that will support the provision of data requirements in an expanding…,data analyst,Data Analyst,full-time,Remote in Tamworth B78,2022-07-30,2.7,
Kärcher UK Ltd,United Kingdom,"  Ensuring data quality by conducting regular data audits and data cleansing. Analysing data across B2B &amp; B2C databases, extracting valuable insights and…",data analyst,Data Analyst,,Banbury OX16,2022-07-17,4.0,
Bank of America,United Kingdom,"  As part of model risk management activities, the team is working closely with model stakeholders for its covered models, including Front Line Units, model…",data analyst,Quantitative Finance Analyst,full-time,Bromley+1 location,2022-07-17,3.8,
Finning (UK) Ltd,United Kingdom,  Interpret laboratory test data and generate concise written reports for each and every sample submitted by the assigned customer base.,data analyst,Laboratory Data Analyst,permanent,Leeds,2022-07-26,3.9,
Guy's and St Thomas' NHS Foundation Trust,United Kingdom,"  We are looking for someone with data analyst experience and a keen interest in equality, diversity and inclusion to support our ambition in achieving equity and…",data analyst,Senior Data Analyst,undefined,London SE1,2022-08-03,3.7,38768-46124
Barclays,United Kingdom,  Working with data source owners to understand the structures and make-up of relevant data sources for the purpose of extracting this data.,data analyst,Senior Data Analyst,permanent,Hybrid remote in Knutsford WA16+1 location,2022-08-14,3.9,
Johnson &amp; Johnson,United Kingdom,  Experience of data modelling and data management using tools such as Qlik and Excel. Proven experience of working in data quality.,data analyst,CRM and Data Quality Analyst,,Hybrid remote in High Wycombe,2022-08-10,4.2,
TikTok,United Kingdom,"  Responsible for data analysis of TikTok e-commerce's global logistics operations; Follow-up data analysis of local operation teams in several overseas markets,…",data analyst,"TikTok eCommerce-Senior Data Analyst, Logistics",,London,2022-08-04,3.3,
EposNow.com,United Kingdom,"  Acquire data from primary or secondary data sources and maintain databases/data systems. Develop and implement databases, data collection systems, data…",data analyst,Data Analyst,,Remote in Norwich,2022-07-17,,
Moneybox,United Kingdom,  This may include transfers to servers and databases outside the country where you provided us with your personal data. Great communication and listening skills.,data analyst,Junior Risk Analyst,full-time,London,2022-07-22,5.0,
Data Idols,United Kingdom,"  With a variety of products and services available on it’s platform, this organisation is putting data at the heart of driving business decisions.",data analyst,Reporting Analyst - Remote UK,undefined,Remote in London,2022-08-12,,35000-45000
The Coca-Cola Company,United Kingdom,"  Ideally has worked in an organisation managing varied sources of data and compiling insights based reports. In addition, the Data Analyst (s) is responsible for…",data analyst,Data Analyst (Global Marketing Procurement),full-time,London W1G,2022-08-12,3.9,
Mercer,United Kingdom,"  Undertake all aspects of the data cleanse process including data analysis, data cleanse, data reconciliation and issue resolution as well as the co-ordination…",data analyst,Data Analyst,full-time,Glasgow G2,2022-07-17,,
Isle of Wight NHS Trust,United Kingdom,"  Transfer data provided to the NHS Electronic Staff Record (ESR) and other secure, internal NHS Workforce systems in order to support and manage your recruitment…",data analyst,Data Management Senior Analyst,undefined,Remote in Newport,2022-08-02,3.8,32306-39027
Leidos,United Kingdom,"  Support achievement and improvement of KPIs, undertaking detailed data analysis, interpretation and validation of data.",data analyst,Data Analyst,full-time,Bicester OX25,2022-08-06,3.7,
Bupa Dental Care,United Kingdom,"  Identify and create test data needed for functional, non-functional testing. Remote Working - Occasional travel to Bristol. Brand new comfortable office space.",data analyst,QA Analyst,permanent,Remote in Bristol BS16,2022-08-10,3.3,
European Student Placement Agency (ESPA),United Kingdom,"  For all internships over 6 months, additional benefits will be paid.",data analyst,Data Analysis Internship,internship,Oxford,2022-07-17,,
Volkswagen Group,United Kingdom,  A few of the many key activities in this role include; Working to (and creating where needed) best practises on data quality and governance (including testing…,data analyst,Data Analytics Engineer,permanent,Hybrid remote in Milton Keynes,2022-07-17,4.1,
Barclays,United Kingdom,  Your role will provide data analytics program management expertise within Corporate Real Estate Solutions (CRES) and be responsible for all data outputs related…,data analyst,Environmental Data Analyst,permanent,Remote in Northampton NN4,2022-07-17,3.9,
South Yorkshire Police,United Kingdom,"  The post holder will work as part of a team with other analysts, using data from a variety of sources to drive the development of data analytics and business…",data analyst,SYP - Data Intelligence Analyst (Permanent Post) - August 20...,undefined,Sheffield,2022-08-06,3.8,31425-36231
Macquarie Group Limited,United Kingdom,"  Within the team, you will apply a range of techniques to capture business data requirements and use your excellent analysis skills to comprehend data flows,…",data analyst,Data Business Analyst,permanent,London,2022-07-28,3.8,
Digital Waffle,United Kingdom,"  Knowledge of the latest data models. Strong leadership, analytical and communication skills with a passion for data-driven decision making.",data analyst,Lead Data Analyst,undefined,Remote in London,2022-07-21,,80000-110000
Deutsche Bank,United Kingdom,"  Develop custom data models and algorithms to apply to data sets. Experience using statistical computer languages SQL (expert level), Python etc. to manipulate…",data analyst,Data Scientist / Data Analyst,,Birmingham,2022-07-17,3.8,
BDO,United Kingdom,"  Our team helps clients manage their business-critical threats, such as cyber events, and build resilient businesses capable of responding to internal and…",data analyst,Data Analyst - Digital Advisory,full-time,London,2022-07-17,3.6,
Amazon UK Services Ltd.,United Kingdom,"  Identify information and data gaps, create techniques and collation processes to close such gaps. Develop, maintain, and modify data collection strategy and…",data analyst,Risk Analyst,full-time,London,2022-07-17,3.5,
Nestle,United Kingdom,"  Salary ranging from £25,000 to £35,000 depending on experience level plus potential Bonus Excellent benefits inc pension/ 25 days holiday + additional 12 days…",data analyst,Finance Analyst - Planning &amp; Reporting,permanent,Hybrid remote in London / Gatwick Airport RH6,2022-08-10,4.2,
Public Health Wales NHS Trust,United Kingdom,"  The Analytical team is adopting data science approaches in order to improve the efficiency of its work, implementing reproducible analytical pipelines and…",data analyst,Public Health Intelligence Analyst,undefined,Carmarthen SA31,2022-08-10,3.7,25655-31534
"Department for Business, Energy &amp; Industrial...",United Kingdom,"  Modelling business and data views (existing, conceptual, proposed) to aid common understanding; Flexible working, Full-time, Job share, Part-time.",data analyst,Business Analyst,undefined,Temporarily Remote in Birmingham,2022-08-13,3.6,30360-32275
DHL,United Kingdom,  Manipulating data from the warehouse management systems. Contract Type: Permanent Full-Time). Producing reports requested by the management team.,data analyst,Ops Data Analyst,undefined,Liverpool,2022-07-17,3.7,21500-22500
Phoenix Group,United Kingdom,  Working with multiple stakeholders you will build strong data models and transform data into meaningful reports on which firm business decisions can be based.,data analyst,Data Analytics Analyst,contract,Telford,2022-08-06,4.1,
Universal Music Group,United Kingdom,  Develop relationships with other analysts and data teams within the business. Experience using SQL to analyse data. 25 paid days of annual leave.,data analyst,Junior Analyst - International,,Remote in London N1C,2022-07-19,4.1,
Oliver Wyman Group,United Kingdom,"  Be able to find innovative, practical and flexible solutions to business issues. This typically includes developing hypotheses; managing data collection, model…",data analyst,Oliver Wyman Digital: Data &amp; Analytics - Entry Level Analyst...,graduate,Newcastle upon Tyne NE1,2022-07-17,4.0,
Sainsburys,United Kingdom,  Evidence adherence with data governance policies re. data quality and usage re. Work in collaboration with Product management to deliver appropriate data and…,data analyst,Data Analyst,part-time,Hybrid remote in Edinburgh,2022-08-13,3.6,
Qiagen,United Kingdom,  Develop and maintain a subject matter expert status for data analytics within project teams. Develop and implement data analytics tools to support molecular…,data analyst,Data Analyst,,Manchester,2022-08-06,3.7,
Veolia,United Kingdom,"  Experience providing data analysis and reporting. Responding to incoming queries on reports and various data requests. Hours: * 40 hours per week, Mon to Fri.",data analyst,Energy Data Analyst,undefined,London N1,2022-07-17,3.5,30000-40000
OVO Energy,United Kingdom,"  Crafting and implementing suitable assurance and controls in order to identify, monitor, improve and manage our data risks;",data analyst,Data Protection Analyst,,Bristol,2022-08-12,3.5,
Cision,United Kingdom,"  The Research Analyst is further responsible for drawing insights, trends and conclusions from the data provided by the Data Analysts.",data analyst,Research Analyst - Open to UK remote workers -,undefined,Remote in London,2022-07-17,3.5,24000
First Central,United Kingdom,"  Experience of data gathering, analysis and excel skills. Analyse new data to determine and implement valuable analytical methods for ad hoc queries.",data analyst,Data Analyst,undefined,Haywards Heath,2022-07-17,4.5,25000-32000
Cadent Gas,United Kingdom,"  Experience of data extraction, reconciliation and an understanding of hierarchy structures within a system. Role Type: Permanent, Full Time.",data analyst,Junior MI &amp; Systems Analyst / Data Analyst,undefined,Remote in Coventry,2022-07-17,2.5,26802-31532
Rux Burton Associates,United Kingdom,Are you excited by working in a fast-moving commercial environment but for a company transforming educational opportunity for young people around the world?…,data analyst,Data Analyst,,Chipping Norton OX7,2022-07-17,4.2,
Ealing Council,United Kingdom,  We are looking for an experienced data analyst who will sit within the Schools Performance and Intelligence team within the new central service on a fixed term …,data analyst,Data Analyst (Virtual School),undefined,Remote in London,2022-07-27,4.0,37353-40566
BES - Melksham,United Kingdom,"  We are currently looking to recruit a Data Analyst to work on a permanent assignment for our fun, friendly &amp; welcoming Chippenham (Wiltshire, SN15) based client…",data analyst,Data Analyst,undefined,Chippenham SN15,2022-08-03,,21996
ADLIB,United Kingdom,"  You’d be developing tools and extracting data while working with different teams, people and various data sources. Maths Qualification or A-Level.",data analyst,Scientific Data Analyst,undefined,London,2022-08-16,,50000-65000
Hardlight,United Kingdom,"  Ability to work with a full data pipeline, from defining a schema in initial design through to querying, visualisation and modelling the gathered data.",data analyst,Data Analyst,,Hybrid remote in Leamington Spa CV32,2022-07-17,,
MS Amlin,United Kingdom,"  A data analyst also helps query, summarise, and process data. Simply put a data analyst job is to translate numbers into plain English so the business can gain…",data analyst,Data Analyst Apprentice,full-time,London,2022-07-17,3.0,
Man Group,United Kingdom,"  The group is made of four areas: data sourcing and strategy, data science analysts, data science engineering and data management.",data analyst,Data Science Analyst,full-time,London,2022-07-19,3.8,
Lorien,United Kingdom,"  Using your technical expertise, you will extrapolate data from the data monitoring tools and model them as directed by the analyst.",data analyst,Junior Analyst,undefined,London,2022-07-17,,32500-35000
Dyson,United Kingdom,"  Sourcing new data feeds and actively monitoring the performance of our data feeds and reporting platforms, fixing issues. 27 days’ holiday (plus bank holidays).",data analyst,Data Analyst - HR/People Analytics,,Malmesbury,2022-07-17,3.5,
East Suffolk and North Essex NHS Foundation Trust,United Kingdom,"  We are looking for an analyst with strong technical skills in managing data and working with data warehouse environments, developing business intelligence…",data analyst,Data Analyst,undefined,Colchester,2022-07-29,3.7,25655-31534
TikTok,United Kingdom,"  Responsible for data analysis of TikTok e-commerce's global logistics operations; Follow-up data analysis of local operation teams in several overseas markets,…",data analyst,"TikTok eCommerce-Senior Data Analyst, Logistics",,London,2022-08-04,3.3,
Oxford University Press,United Kingdom,  Granting access to people data and systems in accordance with the permissions matrix. An important part of this role is taking responsibility for improving data…,data analyst,Global People Data Analyst,full-time,Hybrid remote in Oxford,2022-07-17,3.9,
Universal Music Group,United Kingdom,  Develop relationships with other analysts and data teams within the business. Experience using SQL to analyse data. 25 paid days of annual leave.,data analyst,Junior Analyst - International,,Remote in London N1C,2022-07-19,4.1,
Gamingtec,United Kingdom,"  Data analysis or data modeling techniques to establish, modify or maintain complex data structures. Automation of reporting and other data processes;",data analyst,Data Analyst,,London,2022-07-17,,
Cision,United Kingdom,"  The Research Analyst is further responsible for drawing insights, trends and conclusions from the data provided by the Data Analysts.",data analyst,Research Analyst - Open to UK remote workers -,undefined,Remote in London,2022-07-17,3.5,24000
Auto Trader,United Kingdom,"  The second aspect of your role with be analysing our performance, trends, and data to shape our strategy by pulling various data sources together and…",data analyst,Digital Marketing Analyst,undefined,Hybrid remote in Manchester,2022-08-10,4.4,30000-38000
"JPMorgan Chase Bank, N.A.",United Kingdom,  Problem solving and data analysis. Partner with internal groups within Agency Collateral to provide a superb client experience that will assist in retaining…,data analyst,Collateral Management Operations - Analyst,permanent,Bournemouth,2022-08-11,3.8,
EDF Trading,United Kingdom,"  Present data, studies and analysis in a digestible format for traders and analysts. Experience in building analytics using historical and/or real time market…",data analyst,Quantitative Analyst / Data Scientist,full-time,London,2022-07-29,3.9,
Millennium Management LLC,United Kingdom,  Oversee completion of data quality control checks via system and business validations. Monitor corporate actions and market data events to proactively ensure…,data analyst,Reference Data Analyst,full-time,London,2022-07-17,,
Sirona care and health CIC,United Kingdom,  The Business Intelligence team ensures the efficient and effective gathering of robust performance management information across the company and assists…,data analyst,Information Analyst,undefined,Kingswood,2022-08-13,2.7,25655-31534
Johnson &amp; Johnson,United Kingdom,  Experience of data modelling and data management using tools such as Qlik and Excel. Proven experience of working in data quality.,data analyst,CRM and Data Quality Analyst,,Hybrid remote in High Wycombe,2022-08-10,4.2,
ManyPets (via Otta),United Kingdom,"  Experience of analysing business databases and turning data insights into actionable activities. Integrating Claims data with our other datasets, to provide…",data analyst,Data Analyst,,Remote in Birmingham+2 locations,2022-07-17,3.6,
University of Edinburgh,United Kingdom,  Experience of using data handling libraries such as pandas or R data. To assist the Senior Software Developer and the Database Engineer to develop and maintain…,data analyst,Data Support Analyst,full-time,Edinburgh EH4,2022-07-17,4.1,
Vauxhall Finance plc,United Kingdom,"  Analytical capabilities, data manipulation and interpretation. Preparing performance data and profitability analysis of each transaction.",data analyst,Junior ALM Analyst,undefined,Cardiff CF15,2022-07-26,,26000
Moneybox,United Kingdom,  This may include transfers to servers and databases outside the country where you provided us with your personal data. Great communication and listening skills.,data analyst,Junior Risk Analyst,full-time,London,2022-07-22,5.0,
Guy's and St Thomas' NHS Foundation Trust,United Kingdom,"  We are looking for someone with data analyst experience and a keen interest in equality, diversity and inclusion to support our ambition in achieving equity and…",data analyst,Senior Data Analyst,undefined,London SE1,2022-08-03,3.7,38768-46124
NHS Nottingham and Nottinghamshire Integrated Care...,United Kingdom,  The post holder will be responsible for the analysing data contained in the Changing Futures case management system (Salesforce InForm) and the ongoing…,data analyst,Advanced Data Analyst – PHM- (Changing Futures),undefined,Arnold,2022-08-09,,40057-45839
Oscar Technology,United Kingdom,  Building relationships within the data community. Embedding data analytics products in operational processes and decisions.,data analyst,Data Analyst,undefined,Hybrid remote in Manchester,2022-08-12,3.9,30000-40000
Thrive Tribe,United Kingdom,"  Supporting local Thrive Tribe service staff with ad-hoc data requests and insight queries, completing relevant data analysis tasks.",data analyst,Data &amp; Insight Analyst,undefined,London E20+1 location,2022-08-12,4.0,25000
Goldman Sachs,United Kingdom,"  You will be responsible for defining, developing software’s to analyze data, built metric calculators, automated tools to help business get insights into data,…",data analyst,Corporate Treasury Execution Strats - Quantitative Analyst/D...,full-time,London EC4A,2022-07-17,4.0,
Citi,United Kingdom,"  Working closely with data scientists, developers, data analysts, business analysts and architects to guide the implementation and validation of the solutions at…",data analyst,Data Science Data Analyst,full-time,Belfast,2022-07-17,3.9,
Dartmouth Partners,United Kingdom,  Candidates must hold a degree. Minimum 1 years’ experience within a financial Institution. Experience should ideally include Data Management.,data analyst,Data Management Analyst,undefined,London,2022-08-13,,40000-45000
Siemens Energy,United Kingdom,"  In this role you will act as an ambassador for data analytics topics, sharing best practice and delivering awareness and training in the use of data analytics…",data analyst,Data Analyst,,Manchester M20,2022-07-17,3.9,
EposNow.com,United Kingdom,"  Acquire data from primary or secondary data sources and maintain databases/data systems. Develop and implement databases, data collection systems, data…",data analyst,Data Analyst,,Remote in Norwich,2022-07-17,,
DK,United Kingdom,"  Communicating actionable insight through data. Data integration: ETL processes, and building data pipelines. Market and sales analysis / reporting.",data analyst,Data Analyst,,Hybrid remote in London SW11,2022-07-17,4.0,
DHL,United Kingdom,  Manipulating data from the warehouse management systems. Contract Type: Permanent Full-Time). Producing reports requested by the management team.,data analyst,Ops Data Analyst,undefined,Liverpool,2022-07-17,3.7,21500-22500
Catch22,United Kingdom,"  Ensure that all data and information is managed, stored and destroyed in line with agreed data management policies compliant with the Data Protection Act 1988…",data analyst,Admin and Data Analyst (ADA),undefined,London E16,2022-07-21,3.8,22000
Amazon UK Services Ltd.,United Kingdom,"  Identify information and data gaps, create techniques and collation processes to close such gaps. Develop, maintain, and modify data collection strategy and…",data analyst,Risk Analyst,full-time,London,2022-07-17,3.5,
BGC Partners,United Kingdom,"  Responsible for the data on-boarding process and cycle, including data requirements, data entry, input processes. Detail orientated and proficient in MS Excel.",data analyst,Graduate Market Data Analyst,,London,2022-07-17,3.5,
BSI,United Kingdom,  Provide insight and expertise in data modelling and SME support to the data cleansing and data enrichment teams to robustly deliver requirements.,data analyst,Data Analyst (Publishing),permanent,London,2022-07-17,3.6,
Deloitte,United Kingdom,"  Relevant work experience preferred but not required in performing testing, analyzing large data sets or performing risk assessments.",data analyst,"Analyst, Global Insider Threat, Global, Enabling Functions,...",permanent,Bristol,2022-07-17,3.9,
Euro Car Parts,United Kingdom,  The ability to network outside of the business and seek innovative technology solutions that will support the provision of data requirements in an expanding…,data analyst,Data Analyst,full-time,Remote in Tamworth B78,2022-07-30,2.7,
Santander,United Kingdom,"  You’ll solve complex business problems, using data analysis software to provide in-depth data analysis and reporting. It would also be nice for you to have.",data analyst,Data Analyst - Fraud | S2 | Fraud | Bootle/Home-based,permanent,Remote,2022-07-17,3.9,
Portsmouth City Council,United Kingdom,"  Business process modelling and data modelling techniques. A degree or an equivalent IT, data and or business analysis qualification.",data analyst,Senior Business/Data Analyst,undefined,Portsmouth PO1,2022-08-10,3.6,40578-44624
Bupa Dental Care,United Kingdom,"  Identify and create test data needed for functional, non-functional testing. Remote Working - Occasional travel to Bristol. Brand new comfortable office space.",data analyst,QA Analyst,permanent,Remote in Bristol BS16,2022-08-10,3.3,
UK Health Security Agency,United Kingdom,  Respond to routine data requests. Support audit through data extraction and basic analysis. Adapt queries and undertake basic analysis of data to support…,data analyst,Epidemiology and Information Analyst,undefined,Liverpool L3,2022-08-16,,23389-28195
NatWest Group,United Kingdom,"  You’ll need to hold an appropriate business analyst certification, such as BAX, CPRE and CBAP. From home working to job sharing, visit the remote and flexible…",data analyst,Business Analyst,undefined,Southend-on-Sea+3 locations,2022-07-17,3.7,48060
"JPMorgan Chase Bank, N.A.",United Kingdom,"  Familiarity with data concepts and logical data modelling. The organization's objectives are to deliver business impact through fit-for-purpose data, improve…",data analyst,Asset Reference Data Services - Business Analyst,permanent,Bournemouth,2022-08-02,3.8,
Barclays,United Kingdom,  Demonstrable data analytics skills gained in a substantive data analytics role. You will also support the evolution of the operating model of the Geopolitical…,data analyst,Geopolitical Intelligence Analyst,permanent,Hybrid remote in Knutsford WA16,2022-08-12,3.9,
Optos,United Kingdom,  Awareness of data protection laws preferred. Confident to defend difficult messages from data despite business pressure.,data analyst,Data Analyst,permanent,Dunfermline KY11,2022-07-19,,
BAE Systems,United Kingdom,"  Acting as a source of data management, visualisation and business analysis knowledge, embedding and promoting good data management practices.",data analyst,Business Management Data Analyst,undefined,Portsmouth,2022-08-12,3.8,38000-42000
