company_name,country,job_description,job_field,job_title,job_type,non_remote_location,post_date,rating,salary
Macquarie Group Limited,AUSTRALIA,"  If you’re a strategic communicator who can lead through influence, build solid relationships and roll up your sleeves to execute outstanding communications, we…",marketing specialist,Internal Communications and Engagement Business Partner,full-time,Sydney NSW,2022-07-17,3.8,
AllSquares,AUSTRALIA,"  AllSquares has partnered up with digital product and marketing agency, R/GA to find a strong SEO Content Strategist to join their team.",marketing specialist,SEO Content Specialist,,Melbourne VIC,2022-07-17,,
Microsoft,AUSTRALIA,"  Track record leading specialist teams, selling &amp; delivering complex professional services solutions to Enterprise customers.",marketing specialist,"Manager, Digital Specialist Support",full-time,Sydney NSW 2000,2022-07-17,4.2,
Apparent Communications,AUSTRALIA,"  Solid understanding of performance marketing, conversion, and online customer acquisition. You will work alongside media strategists, buyers, and ad operations…",marketing specialist,SEO + CRO Director,,Sydney NSW,2022-07-17,,
"Department of Families, Fairness and Housing",AUSTRALIA,  Job type: Full time / 31/5/2023. The branch takes an evidence-based approach to supporting change and positive culture and will deliver progressive and best…,marketing specialist,"Manager, Portfolio Coordination Homes Victoria (VPSG6)",undefined,Melbourne VIC,2022-08-16,2.3,127467-170579
Lavo,AUSTRALIA,"  Experience managing marketing and digital product inventory. At least 7-8 years of design, branding, digital marketing and advertising work experience.",marketing specialist,(Digital) Advertising Specialist / Creative Director,undefined,Australia+1 location,2022-08-12,,100000-120000
Precise Business Solutions,AUSTRALIA,"  Provide strategic direction to a team of specialists that executes multi faceted marketing campaigns including EDM campaigns, SEO and SEM.",marketing specialist,National Marketing Manager,,Australia,2022-07-17,,
Fivecast,AUSTRALIA,"  Assisting in developing marketing collateral, by providing an end-user perspective. Work cross-functionally with other internal teams such as sales, product,…",marketing specialist,Tradecraft Advisor (APAC),full-time,Canberra ACT+1 location,2022-07-29,,
The Estée Lauder Companies,AUSTRALIA,"  Participate in building the annual, bi-annual and monthly CRM campaign calendar with input from online and retail marketing teams to ensure the brand’s CRM…",marketing specialist,"Estée Lauder &amp; La Mer, Digital Content Executive",full-time,Australia,2022-07-30,4.0,
AIG,AUSTRALIA,"  Experience or good knowledge of CRM, marketing, and segmentation. Collaborate with marketing / broker engagement teams to plan and execute broker communications…",marketing specialist,"Senior CRM Specialist, Insurance",full-time,Melbourne VIC,2022-07-17,4.7,
James Richardson Group,AUSTRALIA,"  With Australia opening back up to the world and travel set to boom, now is the time to become part of the world’s most unique and exciting retail environments.",marketing specialist,Chinese Marketing &amp; Sales Manager,,Sydney NSW,2022-08-13,3.9,
Canva,AUSTRALIA,"  Build and scale our global social media strategy to drive awareness and affinity for the Canva brand. Understand and analyse community, cultural, entertainment…",marketing specialist,Global Head of Social,full-time,Remote in Sydney NSW,2022-07-17,3.8,
Wavemaker,AUSTRALIA,"  The role of Digital specialists is to work closely alongside other members of the client team to ensure campaigns are executed, amplified and optimised with an…",marketing specialist,Wavemaker | Digital Executive,full-time,Melbourne VIC 3000,2022-07-17,3.8,
MLC Life Insurance,AUSTRALIA,"  The role is responsible for providing written customer communications covering a variety of topics including, significant event notices, regulatory and…",marketing specialist,Copywriter,undefined,Hybrid remote in North Sydney NSW+1 location,2022-07-17,3.7,40
Fenton &amp; Fenton,AUSTRALIA,"  Assist with the execution of the Fenton &amp; Fenton Trade business plan, including marketing, events and customer relations.",marketing specialist,Trade Relationship Manager,full-time,Hybrid remote in Melbourne VIC,2022-07-17,,
Rivalry,AUSTRALIA,"  Working closely with: Marketing, Customer Support. Seeking a social media marketer to execute on strategies that will drive Rivalry’s presence and overall…",marketing specialist,"Social Media Specialist, Australia (Remote)",full-time,Remote in Sydney NSW,2022-07-17,,
Six Degrees Executive,AUSTRALIA,"  Job Type: Permanent / Full Time. Reporting into the Head of CRM, the Digital Marketing Analyst joining this growing CRM team will be accountable for owning and…",marketing specialist,Customer Insights Specialist,full-time,Melbourne VIC,2022-08-02,,
Gembridge,AUSTRALIA,"  Demonstrated ability to increase financial giving through innovative digital and direct marketing campaigns is essential,.",marketing specialist,Individual &amp; Community Giving Specialist,full-time,Melbourne VIC,2022-07-17,,
Havas Group,AUSTRALIA,  The Investment Specialist monitors the media buying process for key clients and supports the optimization of the agreements with our partners at local level.,marketing specialist,Senior Investment Executive,full-time,Sydney NSW,2022-07-17,,
Deloitte,AUSTRALIA,  You will assist with presentations to clients and support the marketing team with new initiatives. You will also conduct your managerial duties including…,marketing specialist,Senior Manager | External Audit | Brisbane,,Brisbane QLD 4000+3 locations,2022-07-17,3.9,
ERM Power Limited.,AUSTRALIA,"  Work as part of a team of data engineers, specialists and software engineers to streamline and automate the management &amp; control of data for analytical…",marketing specialist,Data Engineer,full-time,Melbourne VIC,2022-08-04,,
News Corp Australia,AUSTRALIA,"  Based in Sydney, Australia, you will be a vital member of the team responsible for the management of the ad technology ecosystem for News Corp Australia’s owned…",marketing specialist,Ad Tech Specialist,,Surry Hills NSW,2022-07-28,3.8,
Coles Supermarkets,AUSTRALIA,  We’re after a customer centric marketing professional with a strong understanding of audiences and creating targeted online campaigns.,marketing specialist,eCommerce Campaign Specialis,full-time,Hawthorn East VIC 3123,2022-07-17,3.8,
Spotlight,AUSTRALIA,  End to end marketing campaigns across a range of online and offline marketing channels to achieve business goals.,marketing specialist,Marketing Coordinator,full-time,Victoria,2022-08-09,3.5,
Salt Recruitment,AUSTRALIA,"  We’re looking for an action-taker, passionate about Sustainability and Waste Management to design and drive strategy.",marketing specialist,Sustainability Development Specialist,,Sydney NSW,2022-07-28,,
BD,AUSTRALIA,  Selling in to Gynaecology and Urology specialists. Manage product mix to achieve divisional sales and marketing objectives.,marketing specialist,Territory Manager Biosurgery &amp; Infection Prevention NSW Nort...,,Sydney NSW,2022-08-10,3.8,
Capgemini,AUSTRALIA,"  Has a (deep) understanding of the business and business processes. Undertakes analysis of user and business requirements, with regard to their impact on…",marketing specialist,AEM Lead,,Sydney NSW,2022-08-05,3.8,
sharonbennie,AUSTRALIA,"  Full training provided, with a focus on working with Job hunters (candidates). Screening resumes and undertaking proactive database searches.",marketing specialist,Junior Recruitment Consultant,undefined,Remote in Sydney NSW,2022-08-06,,55000-70000
Sarah Cockell Consulting,AUSTRALIA,"  Manage CRM and CX campaigns end-to-end. At least three years experience in CRM essential. One of the best CRM roles in the market today, working on an…",marketing specialist,CRM Specialist,full-time,Hybrid remote in Melbourne VIC,2022-08-03,,
Rio Tinto,AUSTRALIA,"  Our premium product suite, including our flagship Pilbara blend, drives strong customer relationships and is supported by technical and commercial marketing…",marketing specialist,Superintendent Contract Management,part-time,Perth WA,2022-08-06,3.9,
Crypto Recruit,AUSTRALIA,"  We recruit positions from CEO,CTO, Project Manager, Solidity developer, frontend and Backend Blockchain developers to marketing/sales and customer service roles…",marketing specialist,Discord Community Moderator in a Metaverse project,full-time,Sydney NSW,2022-07-17,,
Rooms with Style,AUSTRALIA,  Managing and marketing Women’s Health Physiotherapist’s bookings and sessions. Providing an outstanding level of customer service and strong skill level on all…,marketing specialist,856 - Practice Manager,full-time,Armadale WA,2022-07-17,,
CGL - Retail Services,AUSTRALIA,  Full training is provided so we are looking for energetic and confident individuals who are happy to learn! Point of Sale displays &amp; promotions.,marketing specialist,Merchandiser - VIC,,Melbourne VIC,2022-07-17,,
Austcorp Executive,AUSTRALIA,"  You will be actively getting involved in assisting sales and marketing team, attending open days and promotional events with the purpose of ensuring the end…",marketing specialist,Clinical Educational Specialist | VIC | Medical Devices/ Aes...,undefined,Melbourne VIC 3000,2022-08-04,,100000-130000
Cosmetic Boutique Australia,AUSTRALIA,  Job Location (Area or Region).,marketing specialist,Cosmetic Doctor,,Brunswick VIC 3056,2022-07-17,5.0,
Six Degrees Executive,AUSTRALIA,"  Work on key projects within the marketing and labour spaces, such as agency consolidation, reviewing panels and driving continuous improvement.",marketing specialist,Sourcing Specialist - 12 month contract,full-time,Melbourne City Centre VIC,2022-08-04,,
Kingkong,AUSTRALIA,"  Well rounded knowledge and passion of digital marketing, including SEO, PPC (Google AdWords, Facebook), Conversion Rate Optimisation and Growth Hacking.",marketing specialist,Digital Growth Strategist,,Remote in South Yarra VIC,2022-08-06,,
Cotton On Group,AUSTRALIA,"  We are always looking to network with innovative and creative individuals with experience in Partnerships &amp; Affiliate Marketing, Customer Acquisition,…",marketing specialist,Ecommerce - Expressions of Interest 2022,full-time,Geelong VIC,2022-07-17,3.6,
Straumann,AUSTRALIA,  Shares best practice and learning with marketing colleagues to build knowledge and competence. A minimum of 5+ years’ experience in product management and/or…,marketing specialist,"Product Manager, Ortho - Australia",full-time,Victoria,2022-07-17,,
Microsoft,AUSTRALIA,"  Check out this Microsoft Business Applications Launch Event 2022 release wave 1 - Bing video, for some highlights.",marketing specialist,Technical Specialist Manager - Dynamics,full-time,Sydney NSW 2000,2022-07-17,4.2,
Checkbox,AUSTRALIA,"  + A strong understanding of SaaS sales, marketing, and customer success processes. + Work with senior management to craft a next-generation sales, marketing &amp;…",marketing specialist,Sales &amp; Marketing Operations Manager (RevOps),full-time,Australia,2022-07-17,,
Medtronic,AUSTRALIA,"  Value proposition, content, and messaging expertise are critical to drive customer engagement and acceptance. Navigate the complex internal stakeholder map (IT,…",marketing specialist,Customer Experience Specialist- NSW,,Macquarie Park NSW,2022-08-04,3.9,
Backstage,AUSTRALIA,"  Experience working with casting directors, producers, directors, creative directors, talent agents, and/or marketing/advertising agencies preferred.",marketing specialist,"Account Manager (Melbourne, Australia)",contract,Sydney NSW,2022-08-16,,
Opteon,AUSTRALIA,  Developing a marketing communications strategy that will enhance Opteon’s brand awareness. Bid &amp; Tender Lead | Remote Working | Full Time.,marketing specialist,Bid &amp; Tender Lead | Work from Home | Full Time,full-time,Remote in Melbourne VIC,2022-07-17,4.0,
Acumentis,AUSTRALIA,"  This will include defining our EVP, working within an ATS and working with our in house marketing team on recruitment and engagement campaigns and content…",marketing specialist,People &amp; Culture Advisor | Brisbane,full-time,Temporarily Remote in Brisbane QLD+1 location,2022-08-02,,
Gartner,AUSTRALIA,"  Must lead cross-functional teams and work with sales associates, consultants, contracts, and many other Gartner specialists (e.g. product, pricing, Legal).",marketing specialist,Proposal Manager,,North Sydney NSW,2022-07-28,3.7,
Marsh,AUSTRALIA,"  Assist with marketing and business development activities to support the growth of practice service offerings. Advise on, review, policies and procedures.",marketing specialist,People Risk Consultant,full-time,Perth WA,2022-07-17,3.7,
PROVINCIAL HOME LIVING,AUSTRALIA,  Understand the importance of brand marketing and achieving sales budgets and KPI's. Have preferred experience in sales of Furniture &amp; Homewares.,marketing specialist,Part Time Sales Assistant East Albury,part-time,East Albury NSW 2640,2022-08-09,4.3,
Morgan Stanley,AUSTRALIA,"  Marketing Review – Assist with the review and approval of marketing collateral including newspaper articles, presentations, advertisements, brochures and new…",marketing specialist,"Compliance Officer, Wealth Management Compliance",full-time,Sydney NSW,2022-07-21,3.8,
UST Global,AUSTRALIA,"  Strong understanding of digital marketing KPIs, such as email marketing, PPC and other marketing conversion metrics,.",marketing specialist,Salesforce Marketing Cloud Developer,full-time,Sydney NSW,2022-07-17,3.7,
Transport Accident Commission,AUSTRALIA,  Bring your purpose and passion for better community outcomes to this strategic marketing and communications role.,marketing specialist,"Senior Manager, Marketing – Customer &amp; Community",undefined,Temporarily Remote in Geelong VIC,2022-08-05,4.2,200000
Body &amp; Brain Centre,AUSTRALIA,"  We’ll pay for Google Adwords and your marketing material, but we need your assistance to share your knowledge. This position is for at least 2 days a week.",marketing specialist,Dietetics,,Moonee Ponds VIC,2022-07-28,,
TEAM LEWIS,AUSTRALIA,"  Overall, acts as a guardian of best marketing practice. Able to provide consultancy on PR requirements as well as broader marketing strategy.",marketing specialist,Associate Director,full-time,Sydney NSW,2022-07-17,,
GenesisCare,AUSTRALIA,"  Tertiary qualifications in scientific, healthcare, marketing/communications or business development fields, highly desirable.",marketing specialist,Referrer Engagement Representative,full-time,Albury NSW+2 locations,2022-07-17,2.7,
Asia Pacific Group,AUSTRALIA,  Asia Pacific Group is seeking an Education Consultant with a natural talent for sales and marketing. Developing new and old clients to grow them into a…,marketing specialist,Education Consultant,full-time,Melbourne VIC+1 location,2022-07-17,,
Cartology,AUSTRALIA,"  Experience as a Sales Team Leader within media sales or advertising OR experience in paid search marketing, account management, digital marketing or agency.",marketing specialist,Team Leader - Promoted Products (Big W),full-time,Hybrid remote in Darlinghurst NSW 2010,2022-07-17,,
Spotless Group,AUSTRALIA,"  Deliver innovation and customer deliverables. 12-month fulltime contract, flexibility with location. Flexible working arrangements &amp; remote working.",marketing specialist,Customer Engagement Specialist,full-time,Melbourne VIC,2022-08-03,3.6,
GLG,AUSTRALIA,"  Assist in implementing marketing plan and promotional activities. This position will focus on the ideation, development, and programming of multiple meetings,…",marketing specialist,Content Manager (Events),,Sydney NSW,2022-07-17,,
Marsh,AUSTRALIA,"  Leverage marketing channels as well as buying groups and association relationships. In this role, you will work with the wider Western Australian team in…",marketing specialist,WA Corporate Sales Executive,full-time,Perth WA 6000,2022-07-27,3.7,
Michael Page,AUSTRALIA,  We are looking for you to hold a marketing qualification with in-depth marketing experience preferably within a retail environment.,marketing specialist,Retail Marketing Specialist,,Perth WA,2022-07-17,3.5,
AESOP Corporate,AUSTRALIA,"  The confidence to sell products requiring specialist knowledge; Working full-time time on a Tuesday to Saturday roster, the Roaming Store Manager will be…",marketing specialist,Roaming Store Manager | Melbourne,full-time,Melbourne VIC,2022-07-17,,
Broadsheet,AUSTRALIA,  Working with the Reader Revenue team to assist in the marketing of brand projects through video. Broadsheet Media is looking for a talented Supervising Producer…,marketing specialist,Supervising Producer - Video,full-time,Melbourne VIC,2022-08-12,,
hipages,AUSTRALIA,"  Assist senior sales specialist with projects and initiatives. Our 18-month rotational Graduate program will focus on our sales area including New Business,…",marketing specialist,Business Graduate (Sales),undefined,Remote in Sydney NSW,2022-07-17,3.8,80000
NSW Government -Department of Education,AUSTRALIA,"  You have digital communication experience with content management systems and online marketing clouds. As part of the Internal and Corporate Communication team,…",marketing specialist,Communication &amp; Engagement Officer,,Hybrid remote in Sydney NSW,2022-08-02,3.9,
Avanade,AUSTRALIA,  Role: Digital Sales and Services Market Unit Architect. You have in-depth knowledge of Dynamics 365 CE Apps including Field Services and/or Project Services…,marketing specialist,D365 CE Solution Architect,,Perth WA,2022-07-17,3.6,
Michael Page,AUSTRALIA,  Strong understanding of media relations and digital marketing channels (paid and organic). Work with the key internal and external stakeholders to develop and…,marketing specialist,Marketing and Communications Manager,full-time,Remote in Melbourne VIC+1 location,2022-08-02,3.5,
Macquarie Group Limited,AUSTRALIA,"  As part of our Banking &amp; Financial Services (BFS) division, our Marketing Technology team play a key role in enabling the acquisition and retention of clients…",marketing specialist,Digital Optimisation Manager,full-time,Sydney NSW,2022-07-17,3.8,
Melbourne Institute of Technology,AUSTRALIA,  Apply specialist knowledge to plan and develop/update online. This document provides an outline of your key areas of accountability and desired outcomes from.,marketing specialist,Learning Skills &amp; Quality Assurance Coordinator,full-time,Sydney NSW,2022-07-22,4.0,
Kady Creative,AUSTRALIA,"  3+ years experience at a creative/marketing agency- as an account manager, content creator or paid ads specialist.",marketing specialist,Marketing Account Manager,,Double Bay NSW,2022-07-17,,
Oracle,AUSTRALIA,  Overlay sales personnel providing specialist product expertise to the sales force. Internal Sales &amp; Marketing Advisory: Act as an internal advisor to Oracle’s…,marketing specialist,"Director, Customer Strategy",,Australia,2022-07-17,3.8,
K&amp;L Gates,AUSTRALIA,"  Assisting with account management including preparing regular reports for clients such as legal spend, value added services, BD activities and marketing…",marketing specialist,Business Development Specialist (Market Development),full-time,Sydney NSW,2022-07-17,,
Bunzl,AUSTRALIA,  Full time position in Avondale working only Monday - Friday. Dynamic position working collaborating with operations and sales teams.,marketing specialist,Customer Service,full-time,Avondale QLD,2022-08-04,3.0,
Rooms with Style,AUSTRALIA,  You will be providing virtual reception services (no face-to-face patient contact) along with a host of other activities to a range of specialists in private…,marketing specialist,859 - Medical Administrator/Receptionist,part-time,Camberwell NSW,2022-07-17,,
Objective,AUSTRALIA,  Working with your peer sales specialists to jointly develop a new go-to-market strategy for the product to exploit certain industry segments and differentiate…,marketing specialist,Business Development Manager,full-time,Sydney NSW,2022-07-17,,
Michael Page,AUSTRALIA,"  Reporting directly to the Head of Sales &amp; Communications, the candidate will be tasked with: Executing Communications plans to support the organisation's vision…",marketing specialist,Communications Specilaist,undefined,Remote in Sydney Olympic Park NSW,2022-07-17,3.5,85000
Talent International,AUSTRALIA,  At least 3 years product marketing experience. Work closely with the Product Marketing Manager to deliver on product marketing strategies.,marketing specialist,APAC Product Marketing Specialist // FinTech,full-time,New South Wales,2022-08-08,4.4,
Citrix,AUSTRALIA,"  You will be teaming with Citrix account managers, presales, product, marketing, and partner ecosystem to meet the business and technology needs of customers.",marketing specialist,Sales Specialist - Application Delivery and Security,full-time,Melbourne VIC 3000,2022-07-17,4.0,
News Corp Australia,AUSTRALIA,"  Delivering new products, improving customer retention and providing hands-on support to sales when they need it to empower them to be successful digital…",marketing specialist,Product Specialist - Paid Media &amp; Online Presence,,Sydney NSW,2022-07-17,3.8,
Rio Tinto,AUSTRALIA,"  Our premium product suite, including our flagship Pilbara blend, drives strong customer relationships and is supported by technical and commercial marketing…",marketing specialist,Superintendent Major Hazards Operational,,Perth WA,2022-08-06,3.9,
AGCO,AUSTRALIA,"  Experience with SAP, Salesforce and marketing automation platforms an advantage. Co-ordination &amp; delivery of APA retail marketing communications between…",marketing specialist,"Commercial Services Product Manager, APA",,Sunshine VIC,2022-08-09,3.8,
Sarah Cockell Consulting,AUSTRALIA,  Build your digital marketing career working within the Fashion Industry. With high attention to detail you’ll be responsible for ensuring accurate product…,marketing specialist,eCommerce Co-ordinator - Fashion!,full-time,Melbourne VIC,2022-08-10,,
Skout Solutions,AUSTRALIA,"  Create marketing strategies including adverting, social media and other medias and implement. Handover any marketing collateral used, advertising copy or…",marketing specialist,Strategic Sourcing Specialist,undefined,Sydney NSW,2022-07-29,,90000-120000
"Skidmore, Owings &amp; Merrill",AUSTRALIA,"  Coordinates and supports business development, public relations, and marketing opportunities. Develops and engages in talent strategy to find specialists,…",marketing specialist,Associate,full-time,Melbourne VIC,2022-07-17,,
Marsh,AUSTRALIA,  Assist with marketing and business development activities to support the growth of practice service offerings. Experience in a WHS role.,marketing specialist,People Risk Consultant (WHS),full-time,Perth WA,2022-07-17,3.7,
News Corp Australia,AUSTRALIA,"  2+ years experience in digital advertising sales, sales support or marketing. The role is responsible for developing commercial ad product strategies that…",marketing specialist,Data and Ad Product Commercial Specialist,,Sydney NSW,2022-07-26,3.8,
History Will Be Kind (HWBK),AUSTRALIA,"  Range of clients, media, social specialists and in house technologists and. Years agency experience, great project management skills and strong media.",marketing specialist,Account Executive / Senior Account Executive,undefined,Surry Hills NSW,2022-07-26,,55000-68000
Puratap Pty Ltd,AUSTRALIA,"  You will receive individual attention and support from Head Office as well as the Management team, in all aspects of running your business including…",marketing specialist,Filter / Service Franchise,,Seaford SA 5169,2022-08-10,4.0,
RecruitAustralia,AUSTRALIA,"  INDUSTRY SPECIALIST - ENGINEERING, CNC &amp; TECHNICAL TRADES. MUST BE AN AUSTRALIAN CITIZEN - You must be an Australia CITIZEN and pass a Baseline Security…",marketing specialist,ELECTRONICS ASSEMBLER,full-time,Canberra ACT,2022-07-17,5.0,
Commonwealth Bank,AUSTRALIA,  The GTS Service Management Practice team supports the deployment of a modern service management platform simultaneously with building an effective service…,marketing specialist,Service Management Practice Specialist,full-time,Sydney Central Business District NSW,2022-08-12,4.0,
OMG Australia,AUSTRALIA,  Working as part of the Ad Operations division and alongside the wider digital team; your role will see you liaise with various parties within the digital…,marketing specialist,Digital Campaign Manager,full-time,Melbourne VIC,2022-07-17,,
Allied World Assurance Company,AUSTRALIA,"  Identifying, recommending and leading or contributing to the implementation of marketing activities, business development initiatives etc.",marketing specialist,Underwriter / Senior Underwriter,,Sydney NSW,2022-07-17,,
Crypto Recruit,AUSTRALIA,  Provide specialised operational support to clients using the company's products. Perform daily funds and position reconciliations. Gather end-of-day reports.,marketing specialist,Operations Specialist (Blockchain),full-time,Sydney NSW,2022-07-17,,
MediaCom,AUSTRALIA,"  As a Marketplace Coordinator you are responsible for ensuring that you a using data, technology and tools to deliver best in class media systems.",marketing specialist,Mediacom | Marketplace Coordinator,full-time,Brisbane QLD,2022-07-17,3.8,
AA Appointments,AUSTRALIA,AA Appointments are here to help you navigate these unique times and support you in finding your next perfect role. About AA Appointments With over 21 years…,marketing specialist,Hospitality and Travel Specialists,,Perth WA+1 location,2022-07-17,,
