company_name,country,job_description,job_field,job_title,job_type,non_remote_location,post_date,rating,salary
Bank of Queensland,AUSTRALIA,"  As a Customer Experience Specialist, you will join a high performing team that is passionate about improving the experience of our customers, further…",marketing specialist,Customer Experience Specialist,full-time,Brisbane QLD,2022-07-17,3.5,
Cashrewards,AUSTRALIA,"  Collaborate with the wider marketing team to develop innovative marketing campaigns, retail events and custom solutions for our merchant partners.",marketing specialist,Growth Marketing Manager ( Growth &amp; Search Focus),full-time,Sydney NSW,2022-07-30,,
EML,AUSTRALIA,"  QLD - Brisbane, VIC - Melbourne CBD, NSW - Sydney CBD Marketing Full Time. This will be a permanent position commencing in either Melbourne, Sydney or Brisbane…",marketing specialist,Bid Specialist,full-time,Temporarily Remote in Sydney NSW,2022-07-17,3.4,
Monash Health,AUSTRALIA,"  Occupation: Administration/Secretarial, Communications, Marketing and Media, Finance, Health and Allied Health, Human Resources, Procurement.",marketing specialist,Specialist Consulting Clerk,part-time,Melbourne VIC,2022-08-13,4.0,
Creative Field Marketing Pty Ltd,AUSTRALIA,  Full training is provided so we are looking for energetic and confident individuals who are happy to learn! Point of Sale displays &amp; promotions.,marketing specialist,Merchandiser - QLD,,Brisbane QLD+2 locations,2022-07-17,3.4,
Southern Cross Austereo,AUSTRALIA,"  Station branding, marketing, advertising and/or PR experience (Desirable). In addition, you will work closely with the local administration team and undertake…",marketing specialist,Brand Experience Specialist/Receptionist,,Hobart TAS,2022-08-13,4.3,
BAXTER,AUSTRALIA,"  Maintain profitability in consultation with sales and marketing. Within theatre, you will establish relationships with key target surgeons in a wide variety of…",marketing specialist,Sales Specialist,full-time,Old Toongabbie NSW,2022-08-03,3.8,
Ethos BeathChapman,AUSTRALIA,  Significant experience across all marketing channels. Proven successful marketing plan development and implementation. Knowledge of the ANZ market.,marketing specialist,ANZ Field Marketing Specialist,undefined,Australia,2022-07-17,,100000-120000
REA Group,AUSTRALIA,"  Conceive, develop and execute engaging stories in the media. Support in managing all data-related media requests into the business.",marketing specialist,Media Relations Specialist,full-time,Melbourne VIC,2022-07-28,4.0,
GWF,AUSTRALIA,  Communicate and execute sales strategies aligned to Tip Top marketing initiatives. North Ryde based with flexible working options.,marketing specialist,Outbound Sales Specialist,full-time,Hybrid remote in Sydney NSW,2022-07-30,5.0,
Mecca Brands Pty Ltd,AUSTRALIA,"  You will work closely with our planning team during campaign ideation and feasibility and collaborate with our automation specialists, to ensure the right data…",marketing specialist,Data Analyst,full-time,Victoria,2022-07-17,4.1,
PwC,AUSTRALIA,"  Strong understanding of best-practice marketing, including technology platforms. Exceptional understanding of marketing channels, and their best-practice usage.",marketing specialist,Traffic Management and Resourcing Specialist,full-time,Adelaide Region SA,2022-08-13,4.0,
Supercheap Auto,AUSTRALIA,  Help build a culture of SEO best practices by educating merchandise and marketing. Experience managing large amounts of data with a quantitative skill set to…,marketing specialist,SEO/Acquisition Specialist,full-time,Hybrid remote in Strathpine QLD,2022-07-17,3.9,
Xero,AUSTRALIA,"  Knowledge of best practices in digital channel development and digital marketing. Access to free, confidential support for you and your family through our EAP…",marketing specialist,CRO Specialist,contract,Brisbane QLD+1 location,2022-08-09,4.4,
Powerfront,AUSTRALIA,"  Experience with eCommerce, marketing, customer support, or call center environments. Experience with e-commerce, marketing, customer support, or call center…",marketing specialist,Implementation Specialist,full-time,Remote,2022-07-17,,
Impressive,AUSTRALIA,  Stay up to date with the latest SEO and digital marketing trends and best practices. Minimum 4 years SEO experience with an excellent track record in planning &amp;…,marketing specialist,SEO Lead,full-time,South Yarra VIC,2022-08-10,,
Ampol,AUSTRALIA,"  5+ years’ experience within a corporate B2B sales, marketing, customer service leadership team function. Our Bid Specialist is a member of the Bid Management…",marketing specialist,BID SPECIALIST,full-time,Alexandria NSW,2022-07-17,3.1,
JAS Worldwide,AUSTRALIA,"  Take marketing operational costs out of their business, thus, driving better marketing ROI. Drive better overall sales and marketing intelligence/insight into…",marketing specialist,Customer Service Specialist,full-time,Sydney NSW,2022-07-17,,
Cook Group,AUSTRALIA,"  Review global marketing materials for compliance to relevant advertising guidelines. Prepare Medical Device Files for submission to regulatory authorities, with…",marketing specialist,Regulatory Affairs Specialist - 24 month contract,contract,Eight Mile Plains QLD 4113,2022-07-17,3.4,
KPMG,AUSTRALIA,"  Revenue Growth Management, including exposure to pricing strategy, promotional mechanics and sales/marketing ROI. Work type: Permanent Full Time.",marketing specialist,Manager - Customer Coporates,full-time,Sydney NSW,2022-08-13,3.9,
WooliesX,AUSTRALIA,  End to end management marketing plan execution across social channels. Experience in how SEM contributes to other elements within the digital marketing suite e…,marketing specialist,Search Media Specialist,full-time,Darlinghurst NSW 2010,2022-08-12,3.6,
Klaviyo,AUSTRALIA,  Klaviyo is a world-leading marketing automation platform dedicated to accelerating revenue and customer connection for online businesses.,marketing specialist,IT Specialist,,Remote in Sydney NSW,2022-08-11,,
AWS Australia Pty Ltd,AUSTRALIA,  The SDGR is the specialist sales engine of CSC and is focused on new customer acquisitions and leveraging current accounts and relationships across APJ at scale…,marketing specialist,"Specialist Demand Gen Rep, Cloud Sales Centre",full-time,Sydney NSW,2022-08-05,3.5,
Michael Page,AUSTRALIA,  As a Communications Specialist you will have demonstrated experienced in showing compassion and professionalism in all that you do.,marketing specialist,Communications Specialist,,Hybrid remote in North Sydney NSW,2022-08-10,3.5,
Backstage,AUSTRALIA,"  Experience working with casting directors, producers, directors, creative directors, talent agents, and/or marketing/advertising agencies preferred.",marketing specialist,"Account Manager (Sydney, Australia)",contract,Sydney NSW,2022-08-16,,
AGL Energy,AUSTRALIA,  The Wholesale Pricing team is a critical part of the Integrated Portfolio Planning business unit and is responsible for the management and delivery of wholesale…,marketing specialist,Product and Pricing Specialist,full-time,Temporarily Remote in Melbourne VIC,2022-08-12,3.7,
OnTalent,AUSTRALIA,"  3-5 years experience in a communications/media/public relations or marketing role. A natural collaborator, you’ll have previous experience in communications,…",marketing specialist,Communications Specialist,full-time,Brisbane QLD,2022-07-28,,
"JPMorgan Chase Bank, N.A.",AUSTRALIA,  You will also be working closely with the local Rates Sales team in Sydney and providing repo and financing specialist market expertise.,marketing specialist,CIB - Sales &amp; Marketing - Fixed Income Financing Sales - Ana...,full-time,Sydney NSW,2022-07-26,3.8,
Mindshare,AUSTRALIA,  Experience in handling marketing campaigns on mainstream media. Engage with specialist partners to drive commercially viable media solutions.,marketing specialist,Mindshare | Digital &amp; Social Executive,,Sydney NSW,2022-07-17,,
IPA Personnel Services,AUSTRALIA,"  Plan and develop paid marketing strategies, implement and maximise performance across search and social. Manage relationships with external stakeholders and…",marketing specialist,Performance Marketing Specialist,full-time,Brisbane QLD,2022-08-06,3.6,
GSK,AUSTRALIA,"  Contributing insights to the development of marketing and medical strategy. Reporting into the Associate Medical Director, General Medicines, the role will…",marketing specialist,Scientific Advisor,contract,Abbotsford VIC,2022-08-13,4.1,
Macquarie Group Limited,AUSTRALIA,"  Collecting and transforming data from a variety of digital marketing &amp; analytics, CRM tools and big data environments. Experience working in analytics teams.",marketing specialist,Digital Marketing Analyst,full-time,Sydney NSW,2022-07-17,3.8,
Accenture,AUSTRALIA,"  Over 300 of your Salesforce specialist peers, including 7 Certified Technical Architects, will aid your career growth whilst working with some of Australia's…",marketing specialist,Salesforce Marketing Cloud Developer,full-time,Remote in Sydney NSW+1 location,2022-07-20,4.0,
Bluhat,AUSTRALIA,"  Formal qualifications in a business, supply chain or marketing related discipline preferred though not essential;",marketing specialist,Sales and Marketing Specialist,full-time,Gold Coast QLD,2022-08-06,,
Arinex Pty Ltd,AUSTRALIA,"  Strong research, marketing and written communication skills. Execution of sponsorship and exhibition marketing campaigns across multiple channels –.",marketing specialist,Marketing Coordinator,full-time,Sydney NSW,2022-07-17,,
Spotless,AUSTRALIA,"  Categories: Communications &amp; Marketing, Administration / Office Support, Customer Service / Contact Centre. Deliver innovation and customer deliverables.",marketing specialist,Customer Engagement Specialist,full-time,Brisbane QLD,2022-07-28,3.5,
Apple,AUSTRALIA,  Use search marketing experience to drive efficiencies and steer advertiser strategy. Extensive background servicing and understanding Performance Advertisers…,marketing specialist,"Search Ads - Platform Specialist, Australia and",,Sydney NSW,2022-07-18,4.1,
Techtronic Industries (TTI),AUSTRALIA,  The Transport Specialist maintains and expands relationships with strategically important end user customers within the transport channel.,marketing specialist,Transport Specialist Milwaukee,,Bayswater WA,2022-07-19,3.5,
Anaconda,AUSTRALIA,"  Work closely with the PR agency to drive the influencer marketing program. A solid understanding of social media best practice, search engine optimisation and…",marketing specialist,Digital Content Specialist,full-time,Victoria,2022-07-17,3.2,
BRP,AUSTRALIA,  Inputs annually into overall marketing brand plan; Adjusts marketing strategy and plans to meet changing markets and competitive conditions.,marketing specialist,Japan Marketing Specialist,,Botany NSW,2022-08-05,,
Havas Group,AUSTRALIA,"  The successful applicant will work with other specialists, executives and coordinators across Havas to ensure successful delivery of organic search and wider…",marketing specialist,Senior SEO Executive,full-time,Sydney NSW,2022-07-28,,
Agribusiness Recruitment,AUSTRALIA,"  On ground development of new markets, initiation and coordination of demonstration programs to support sales and marketing objectives in a defined territory.",marketing specialist,Broadacre Technical Specialist,undefined,Geraldton WA,2022-07-27,,100000
Vanguard,AUSTRALIA,  Partner with Superannuation marketing specialists and other subject matter experts to develop copy for regulatory and compliance communications.,marketing specialist,Superannuation Communications Writer,,Remote in Melbourne VIC,2022-08-16,,
sharonbennie,AUSTRALIA,"  Marketing experience within real estate OR residential project marketing or the property industry. Execute the marketing plan with regards to signage, display…",marketing specialist,Marketing Executive,undefined,Sydney NSW,2022-07-23,,100000-150000
P3 Recruitment,AUSTRALIA,  Bachelor's degree in marketing or related field. Develop and implement marketing campaigns from inception through to execution.,marketing specialist,Marketing Manager- Up to 140K Package,undefined,Sydney NSW,2022-08-05,,130000-140000
Rabobank,AUSTRALIA,About us Rabobank is the world’s leading specialist in food and agribusiness banking. One of our key strengths lies in our people who have a deep…,marketing specialist,"General Manager, Corporate Affairs",full-time,Remote in Sydney NSW 2000,2022-08-14,4.0,
u&amp;u Recruitment Partners,AUSTRALIA,About the Company A global business that has entertainment centres across the APAC region. Australia has the largest footprint of centres and is…,marketing specialist,Digital Specialist,,North Shore NSW,2022-07-23,,
Marathon Health AU,AUSTRALIA,"Marketing and Communications Coordinator - Albury, Bathurst, Dubbo, or Wagga Wagga - Full Time - *Marketing and Communications Coordinator* *Full Time* *75…",marketing specialist,"Marketing and Communications Coordinator - Albury, Bathurst,...",undefined,Albury NSW,2022-07-29,,65000
GenesisCare,AUSTRALIA,At GenesisCare we want to hear from people who are as passionate as we are about innovation and working together to drive better life outcomes for patients…,marketing specialist,Digital Marketing Manager,full-time,Sydney NSW,2022-07-21,2.7,
UniLodge,AUSTRALIA,Looking for a diverse marketing role where you can own your marketing space and help your Ops team succeed through your marketing expertise? Rewarding role +…,marketing specialist,Marketing Manager,full-time,Brisbane QLD 4000,2022-07-21,4.1,
Kerry,AUSTRALIA,Requisition ID 38807 Position Type FT Fixed Term Recruiter #LI-CST1 Posting Type LI About Kerry Kerry is the world's leading taste and nutrition company for…,marketing specialist,HR Change Specialist,full-time,Sydney NSW,2022-07-17,3.3,
Detmold Group,AUSTRALIA,*About Our Opportunity* The Product Sourcing Specialist will work proactively with the Australian/ NZ and broader sales businesses to research customer…,marketing specialist,Product Sourcing Specialist,full-time,Adelaide CBD SA 5000+1 location,2022-08-10,,
Central Queensland University,AUSTRALIA,"About this Opportunity Continuing, Full Time International Directorate CQUniversity - Melbourne Total Remuneration $98,242 to $105,806 pa (including…",marketing specialist,International Recruitment Executive,undefined,Melbourne VIC,2022-08-06,4.0,98242-105806
Ausster,AUSTRALIA,"Responsibilities Ausster: We are specialized in software, web, and mobile application development. Ausster is a reliable service provider of high-quality…",marketing specialist,Sales Specialist,,Remote in Melbourne VIC,2022-08-09,,
Langton's,AUSTRALIA,Langton's has been Australia's leading marketplace for buying and selling fine wine for over 30 years. Whether it’s an occasion for wine or wine is the…,marketing specialist,Partner &amp; Event Specialist,full-time,Darlinghurst NSW 2010,2022-07-17,,
WSP Australia,AUSTRALIA,"Website and Digital Publisher Join our team of intelligent and collaborative Changemakers and make your mark on tomorrow! In this role, you’ll work with the…",marketing specialist,Website &amp; Digital Content Coordinator,undefined,Sydney NSW,2022-07-17,3.8,100000-110000
AWS Australia Pty Ltd,AUSTRALIA,"• 5+ years’ information security management, product management, business development, and/or operations experience in and around information technologies,…",marketing specialist,"Senior Security Specialist, Worldwide Public Sector Security...",full-time,Canberra ACT,2022-07-17,3.5,
Google,AUSTRALIA,"At Google, we have a vision of empowerment and equitable opportunity for all Aboriginal and Torres Strait Islander peoples and commit to building…",marketing specialist,"Agency Lead, Google Customer Solutions",full-time,Sydney NSW,2022-07-17,4.3,
Techtronic Industries (TTI),AUSTRALIA,"Our Global Company Founded in 1985, TTI’s portfolio includes market leading brands such as Ryobi, AEG, Hoover, Vax, Kango and Empire. Our global team has…",marketing specialist,Social Media Specialist - Commercial,,Australia,2022-07-17,3.5,
FREEDOM Furniture,AUSTRALIA,"Who we are Take a seat at Freedom, the home of innovation, empowerment, and opportunity. For more than 40 years, we've continued to deliver on our promise: to…",marketing specialist,Product Support Specialist,full-time,Kings Park NSW,2022-07-17,3.9,
Macquarie Group Limited,AUSTRALIA,  Part of this role will also be to assist with internal marketing campaigns to engage current employees in our employer brand efforts.,marketing specialist,Assistant Campaign Marketing Manager,full-time,Sydney NSW,2022-08-02,3.8,
GN Group,AUSTRALIA,  We are currently looking for an experienced customer marketing specialist to drive the acquisition and growth of customers through targeted customer and channel…,marketing specialist,Customer Marketing Manager,full-time,Sydney NSW,2022-07-17,,
Deloitte,AUSTRALIA,"  You will be a customer experience advocate while seeing the big picture goals to bring together customer, business and technical components into meaningful…",marketing specialist,Strategic Designer,,Canberra ACT 2609,2022-07-17,3.9,
CGL - Retail Services,AUSTRALIA,  You believe in the product being accessible to everybody and you can adapt your style to suit the needs of your customer. Flexible and adaptable to change.,marketing specialist,Trinny London Full-Time Make Up Artist - Bondi,full-time,Sydney NSW,2022-08-03,,
ED - Group Support Functions,AUSTRALIA,  Mentor marketing and campaign automation specialists in their squad. Experience and understanding of B2C marketing communications development and marketing…,marketing specialist,Senior Martech Specialist,full-time,Darlinghurst NSW 2010,2022-08-04,,
Colliers International,AUSTRALIA,"  Working with Agent’s to co-ordinate the collations of reports, submissions and other documentation. Marketing campaigns: Prepare media schedules and budgets for…",marketing specialist,Team Assistant | Investment Services,full-time,Melbourne VIC,2022-08-16,3.8,
St Pauls Anglican Grammar School,AUSTRALIA,"  School’s philosophies, direction and Christian ethos. Demonstrate the highest levels of professionalism. Students outside the classroom setting and, as such,…",marketing specialist,Junior School,part-time,Warragul VIC,2022-08-04,,
Vortala,AUSTRALIA,"  As a Client Support Specialist, you’ll partner with our North American clients in supporting their high performing practice websites by assisting with website…",marketing specialist,Client Support Specialist,,Australia,2022-07-17,,
Hardware &amp; General,AUSTRALIA,"  As a digital specialist you start as a generalist, helping across all facets of the department, with research, digital marketing, EDMs, social media campaigns,…",marketing specialist,Digital Marketing Assistant,full-time,Brookvale NSW,2022-07-17,2.8,
GSK,AUSTRALIA,"  Providing medical input and expertise into the development of marketing strategy, promotional campaigns and collateral.",marketing specialist,Medical Science Liaison- nephrology WA/SA,,Perth WA+1 location,2022-07-17,4.1,
Arventa,AUSTRALIA,  Evaluate marketing strategies to make recommendations for improvements where appropriate and provide reports on marketing activities.,marketing specialist,Digital Marketing Specialist - SaaS Risk Management,full-time,Sydney NSW,2022-07-17,,
Service Stream,AUSTRALIA,"  Produce a range of appropriate communication materials to support business activities and communication goals, working with specialists and suppliers as needed.",marketing specialist,Communications Officer,full-time,Huntingwood NSW,2022-07-26,3.2,
British American Tobacco,AUSTRALIA,  BAT AUSTRALIA IS LOOKING FOR A TRADE ANALYST. SENIORITY LEVEL: Experienced Non-Management Level. This role is part of Trade and Marketing.,marketing specialist,Trade Analyst,undefined,Sydney NSW,2022-07-24,4.4,70000-80000
AWS Australia Pty Ltd,AUSTRALIA,"  Relevant work experience in the Information Technology, Channel sector and/or Training industry. Capability to logically plan and set priorities, identify and…",marketing specialist,"APJC AAI Program Specialist, Global Delivery Readiness",full-time,Sydney NSW,2022-07-17,3.5,
Oliver Wyman Group,AUSTRALIA,"  Work with Australia business leaders on overall marketing plans and strategies, align marketing campaigns with business growth areas.",marketing specialist,"Senior Associate, Marketing",full-time,Sydney NSW 2000,2022-07-17,,
Deloitte,AUSTRALIA,"  You will have broad digital marketing experience across web, email marketing, social media, paid social and search advertising.",marketing specialist,"Senior Digital Specialist - Digital, The Agency (9-month con...",contract,Sydney NSW 2000,2022-07-28,3.9,
Costco,AUSTRALIA,"  Setting up, coordinating and managing marketing promotions in a timely manner in-conjunction with the Buying,. Marketing and e-Commerce teams.",marketing specialist,Inventory Control Specialist (Home Office Buying Team),,Sydney NSW,2022-08-14,4.1,
Bluefin Resources,AUSTRALIA,  Bluefin Resources are working with a leading and prestigious global not for profit enterprise to recruit a Data Integration Specialist.,marketing specialist,Data Integration Specialist,undefined,Temporarily Remote in Sydney NSW,2022-07-30,,140000-150000
Medibank,AUSTRALIA,  This role is accountable for the management of marketing data integration and platform business enablement across Medibank and ahm (platforms include Salesforce…,marketing specialist,Marketing Platforms Manager,,Docklands VIC 3008,2022-08-05,3.4,
Abbott Laboratories,AUSTRALIA,"  Assisting with product marketing and launches. Reporting to the Regional Sales Manager, this position is responsible for providing technical expertise and…",marketing specialist,CRM - Field Technical Specialist - Melbourne,full-time,Port Melbourne VIC,2022-07-17,3.9,
Microsoft,AUSTRALIA,"  Effectively turn digital signals, qualified Account-based marketing leads, and customer insights into opportunities and qualified revenue pipeline for large…",marketing specialist,"Enterprise Digital Specialist, Security and Compliance - ANZ",full-time,Sydney NSW 2000,2022-07-26,4.2,
Ampol,AUSTRALIA,"  Reporting to the Head of Internal Communications, the Communications Specialist is responsible for managing Ampol’s employee communications channels, and the…",marketing specialist,Internal Communications Specialist,full-time,Alexandria NSW,2022-08-11,3.1,
Anglicare Victoria,AUSTRALIA,"  This position will be part of our youth services team which consists of a number of specialist programs, from Homelessness to early intervention and educational…",marketing specialist,Community Connector - Better Futures,part-time,Temporarily Remote in Bendigo VIC,2022-08-16,3.6,
Procreate,AUSTRALIA,"  You have a firm understanding of marketing fundamentals and will have spent time in dynamic, relationship focused environments.",marketing specialist,PR Specialist,full-time,Hobart TAS,2022-07-21,,
NSW Government -Transport For NSW,AUSTRALIA,  Campaign Evaluation manages customer research that informs key decisions and actions relating to Road &amp; Maritime Safety and Public Transport marketing campaigns…,marketing specialist,Campaign Evaluation Officer,undefined,Temporarily Remote in Sydney NSW,2022-08-10,4.0,106086-118816
Rashays Cafes and Restaurants,AUSTRALIA,  Undertake franchise selection and work with the marketing team to develop campaigns that will attract new and potential franchisees and assess their suitability…,marketing specialist,Franchising Sales Specialist,,Chester Hill NSW 2162,2022-08-12,2.8,
MLC Life Insurance,AUSTRALIA,"  Tertiary qualification in a marketing or business-related discipline. Experience across sales, product management, operations, channel management and marketing…",marketing specialist,CX Strategy &amp; Delivery Manager,undefined,Hybrid remote in Docklands VIC,2022-07-29,3.7,727
David Jones,AUSTRALIA,"  Work type: Full-Time, Permanent. Reporting into the Head of VM – Creative &amp; Innovation, you will bring campaigns to life through creative visual storytelling,…",marketing specialist,VM Creative Specialist,full-time,Hybrid remote in Victoria,2022-07-17,3.6,
Deloitte,AUSTRALIA,"  Joining our A&amp;A Analytic Solutions Graduate Program, our top-tier data specialists will help you build on your existing data and analytical skills.",marketing specialist,A&amp;A - Analytic Solutions - 2022/23 Graduate Program (Sydney),part-time,Sydney NSW 2000+2 locations,2022-07-19,3.9,
IBM,AUSTRALIA,"  These country teams have client relationship managers who lead integrated teams of consultants, solution specialists and delivery professionals to enable…",marketing specialist,Brand Partner Specialist - Data and AI,full-time,Canberra ACT,2022-08-13,3.9,
Signature Hospitality Group,AUSTRALIA,  The role of the Customer Service Co-ordinator will focus on the delivery and support of all guest interactions and communications for TGI FRIDAYS and The…,marketing specialist,Customer Service Coordinator,full-time,South Melbourne VIC 3205,2022-08-13,,
Ignite Specialist Recruitment Services,AUSTRALIA,"  Develop marketing and Branding strategies. Organise event marketing through advertising, Promotional materials and conducting ROI analysis.",marketing specialist,Marketing Manager,undefined,Sydney NSW,2022-08-11,3.3,80000-120000
NetApp,AUSTRALIA,  Our Specialist Solutions Engineers lead the technical sales and post-sales support on NetApp's Products and Solutions to existing and new customers.,marketing specialist,Solutions Engineer,,Sydney NSW,2022-08-06,4.1,
