company_name,country,job_description,job_field,job_title,job_type,non_remote_location,post_date,rating,salary
V4 Services Group,AUSTRALIA,"  In our IT division, we provide online and on-site support for home and business users, along with other offerings. Should have flair for sales.",marketing specialist,Technical Sales Specialist,undefined,Remote in Melbourne VIC,2022-08-15,,120000
Open Universities Australia,AUSTRALIA,"  We are looking for someone with experience in developing digital performance marketing strategies and executing tactical campaigns across paid search, social…",marketing specialist,Performance Marketing Specialist,full-time,Docklands VIC 3008,2022-07-17,,
Veritas Recruitment,AUSTRALIA,  Execute on marketing budgets including marketing services profit targets. Support the implementation of the overall marketing strategy and campaign activities.,marketing specialist,Marketing Specialist,undefined,Sydney NSW,2022-08-02,4.3,85000-90000
Halliburton,AUSTRALIA,"  May refer applicants for job openings, administer pre-employment tests, and conduct interviews, and is expected to conduct skills assessment and evaluation of…",marketing specialist,Recruiting Specialist,undefined,Perth WA 6000,2022-08-06,3.9,140
Google,AUSTRALIA,"  You will serve as a liaison between the events team, marketing teams, and our agencies to ensure that the design vision is carried from concept through…",marketing specialist,"Visual Designer, Creative Events and Experiences",full-time,Sydney NSW,2022-07-17,4.3,
Claremont School,AUSTRALIA,"  Degree in marketing related field/marketing qualification preferred. Knowledge of content management systems, customer relationship marketing and working with…",marketing specialist,Marketing and Communications Officer,part-time,Remote in St Leonards NSW,2022-08-07,,
Allianz Australia,AUSTRALIA,  Allianz’s Digital Marketing division currently has an opening for a Digital Analytics Specialist to implement and maintain digital analytics of custumer…,marketing specialist,Digital Analytics Specialist,full-time,Sydney NSW 2000,2022-07-17,3.9,
TEKsystems,AUSTRALIA,  Initial 6-month contract; up to $100k including superannuation. They support millions of Australians and have their customers at the forefront of everything…,marketing specialist,Customer Communications Specialist,undefined,Sydney Central Business District NSW,2022-07-17,,100000
Flight Centre Travel Group,AUSTRALIA,Attending recruitment marketing events and keeping on top of industry trends and developments. Innovative and creative with a strong working knowledge of…,marketing specialist,Recruitment Marketing Specialist,full-time,Queensland,2022-08-06,3.5,
Thomson Reuters,AUSTRALIA,"A passion for data-driven marketing. Develop a data-driven understanding of your audience and the marketing landscape to deliver highly targeted, personalized…",marketing specialist,Marketing Specialist - Contractor,contract,Pyrmont NSW 2009,2022-07-17,3.9,
Saab Inc.,AUSTRALIA,You will learn from colleagues who are specialists in their field and develop your skills and knowledge further.,marketing specialist,Saab Australia – Summer Internship Program – 2022-23 ﻿,internship,Melbourne VIC+1 location,2022-08-09,3.9,
Sportsbet,AUSTRALIA,"Acting as a liaison for the business, translating their needs for a variety of technologies, including back office, customer facing (web and mobile) and…",marketing specialist,Business Analyst - Multiple roles,full-time,Melbourne VIC,2022-08-16,2.8,
On AG,AUSTRALIA,"This role will act as a liaison among our Oceania team (supply and demand planning, customer service, sales and marketing) and our logistic service provider …",marketing specialist,Warehouse Specialist / Supervisor,,Melbourne VIC,2022-07-17,,
Adobe,AUSTRALIA,"Good knowledge of Software as a Service sales models, especially marketing automation, Web Analytics, Targeting or Advertising.",marketing specialist,Renewal Sales Specialist,full-time,Sydney NSW,2022-07-17,4.3,
Scout Talent HQ,AUSTRALIA,"As our newest Specialist, you will have previous experience working in customer service, marketing or recruitment.",marketing specialist,Talent Sourcer,undefined,Remote in Melbourne VIC,2022-08-12,,65000-78000
Olympus Australia,AUSTRALIA,Develop and execute a sales territory plan in line with the marketing strategies in place; Local overnight travel will be required 2-3 days bi-monthly depending…,marketing specialist,Sales Specialist,full-time,Brisbane QLD+1 location,2022-07-17,,
Advisible,AUSTRALIA,Passion for social media marketing. Holistic understanding of digital marketing. Understanding/knowledge of social media marketing best practices and processes.,marketing specialist,Social Media Specialist,,Sydney NSW,2022-07-17,,
Honner,AUSTRALIA,"This is an exciting opportunity for an experienced candidate with a journalism/content background with 2 – 10+ years of writing experience, preferably in the…",marketing specialist,Communications / Content Specialist,,Sydney NSW,2022-07-17,,
6000008,AUSTRALIA,Prior experience within a marketing role (3+ years). Create dedicated marketing plans and actions to support our new and refurbished stores.,marketing specialist,Local Store Marketing Specialist,,North Sydney NSW 2060,2022-08-06,,
SBS,AUSTRALIA,"Build marketing automation that will drive subscriber programs to new heights! Through brainstorming sessions with leadership, and other teams across marketing,…",marketing specialist,Marketing Automation - Adobe Campaign Specialist,full-time,Sydney NSW,2022-08-11,3.7,
Alquemie Group,AUSTRALIA,"Sitting within the Customer Department, you’ll partner with all teams from Marketing, to Brand Experience, to Digital, to our Agency partners bringing consumer…",marketing specialist,CRM Specialist - General Pants &amp; SurfStitch,full-time,Alexandria NSW,2022-08-09,,
Subway Systems Australia Try. Ltd.,AUSTRALIA,The Communications Specialist will partner with Subway leaders and teams throughout the company to effectively provide information from Subway corporate to the…,marketing specialist,Communications Specialist,full-time,Fortitude Valley QLD 4006,2022-07-17,,
KPMG,AUSTRALIA,Develop and communicate marketing briefs. 10 years’ experience in B2B marketing field. Support the development of the annual and quarterly marketing strategy…,marketing specialist,Marketing Manager,full-time,Sydney NSW,2022-08-05,3.9,
Transurban,AUSTRALIA,  You will be joining a high performing and highly supportive team with deep industry knowledge and a keen interest in supporting your overall career development.,marketing specialist,"Procurement Specialist - Corporate, Customer, and Technology",full-time,Docklands VIC,2022-08-16,3.9,
sharonbennie,AUSTRALIA,"  Manage all elements of the sales and marketing functions. Coordinating external suppliers to ensure delivery on display suite, marketing collateral, sales packs…",marketing specialist,Head of Sales &amp; Marketing,undefined,Sydney NSW,2022-08-06,,180000-220000
Illuminance Solutions,AUSTRALIA,"  Utilise Microsoft Go To Market resources and customise them to incorporate into our marketing strategy. Bachelor’s degree in marketing and/or graphic arts,…",marketing specialist,Digital Marketing and Graphic Design Specialist,,Perth WA,2022-07-17,,
Format Digital,AUSTRALIA,  General marketing and social media assistance from time to time. 1+ years experience in a social media or digital marketing role ideally in an agency setting.,marketing specialist,Campaign Assistant (Full-Time),full-time,Adelaide Region SA,2022-07-17,,
Deloitte,AUSTRALIA,  Your role in building and integrating automated tests scripts. Provide comprehensive estimates and status reports of automation testing and scripting progress…,marketing specialist,QA Tester,part-time,Canberra ACT 2609,2022-07-17,3.9,
Bambrick,AUSTRALIA,"  Knows their way around a computer (digital specialist). In a nutshell, the Graduate Digital Marketing Coordinator will spend their days meeting with clients,…",marketing specialist,Graduate Digital Marketing Coordinator,,Remote in Brisbane QLD+1 location,2022-07-17,,
Reckitt,AUSTRALIA,"  Have a minimum of 2+ years of experience within a social or marketing capacity, managing social media communities and marketing campaigns.",marketing specialist,"Consumer Relations Social Specialist, Hygiene",contract,Remote in Sydney NSW 2000,2022-07-17,3.7,
TPG Telecom,AUSTRALIA,  Degree qualified in business or marketing. As a Digital Product Specialist you will help drive and shape the direction of our customer platforms across TPG…,marketing specialist,Digital Product Specialist,full-time,Remote in North Sydney NSW,2022-07-17,3.3,
Zip Co,AUSTRALIA,"  A track record of ideation and execution of marketing initiatives that make significant, positive impacts to the business.",marketing specialist,Digital Design Specialist,full-time,Sydney NSW,2022-08-02,,
Media Mortar,AUSTRALIA,"  2+ years post graduate content marketing experience. You may be required to bounce between running a large destination marketing organisation’s social media,…",marketing specialist,Content Marketing Specialis,,Remote in Brisbane QLD,2022-07-26,,
Google,AUSTRALIA,"  Build, motivate, inspire, and develop a direct team of Industry Managers, Account Managers as well as cross-functional specialist resources: Strategy and…",marketing specialist,"Industry Head, Large Customer Sales (Part-Time/Full-Time)",part-time,Melbourne VIC,2022-07-17,4.3,
TikTok,AUSTRALIA,"  From designing scaled sales and service delivery programs to ensuring our customers have best-in-class tools and products at their fingertips, our SMB team…",marketing specialist,"Strategic Sales Specialist, SMB",,Sydney NSW,2022-07-17,,
CoreLogic,AUSTRALIA,"  Manage the integration of web analytics and marketing automation tools. 3+ years of relevant experience preferably in web data analytics and instrumentation,…",marketing specialist,Digital Analytics and Optimization specialist,full-time,Fortitude Valley QLD,2022-07-17,3.3,
HAYS,AUSTRALIA,"  Knowledge of Email marketing and EDM campaigns. You also will oversee planning and managing email marketing campaigns, as well as providing insights on how to…",marketing specialist,Digital Marketing Specialist,,Sydney Central Business District NSW+2 locations,2022-07-17,3.6,
SBS,AUSTRALIA,"  Disseminate latest updates and regularly present to the National Media Sales Team, ensuring they are well-informed about content changes, sponsorship…",marketing specialist,"Coordinator, SBS CulturalConnect",full-time,Sydney NSW,2022-08-03,3.7,
Google,AUSTRALIA,"  You will serve as a liaison between the events team, marketing teams, and our agencies to ensure that the design vision is carried from concept through…",marketing specialist,"Visual Designer, Creative Events and Experiences",full-time,Sydney NSW,2022-07-17,4.3,
Media Mortar,AUSTRALIA,"  2+ years post graduate content marketing experience. You may be required to bounce between running a large destination marketing organisation’s social media,…",marketing specialist,Content Marketing Specialis,,Remote in Brisbane QLD,2022-07-26,,
Advisible,AUSTRALIA,  Passion for social media marketing. Holistic understanding of digital marketing. Understanding/knowledge of social media marketing best practices and processes.,marketing specialist,Social Media Specialist,,Sydney NSW,2022-07-17,,
Hatch,AUSTRALIA,  Develop regional marketing and communications materials. The Regional Communications Coordinator is responsible for developing and implementing internal…,marketing specialist,"Marketing and Communications Coordinator, Australia-Asia",,Brisbane QLD,2022-07-30,3.9,
Google,AUSTRALIA,"  Build, motivate, inspire, and develop a direct team of Industry Managers, Account Managers as well as cross-functional specialist resources: Strategy and…",marketing specialist,"Industry Head, Large Customer Sales (Part-Time/Full-Time)",part-time,Melbourne VIC,2022-07-17,4.3,
Volkswagen,AUSTRALIA,"  Implement and contribute to the Audi Australia product strategy including new model proposals, product launches and lifecycle measures.",marketing specialist,Product Planning Specialist,,New South Wales,2022-07-30,4.1,
Slalom Consulting,AUSTRALIA,"  Technical skills including SQL, HTML, JavaScript, marketing automation best practices, understanding of tracking implementation.",marketing specialist,Principal - MarTech Specialist,,Melbourne VIC,2022-08-16,,
Adobe,AUSTRALIA,"  Good knowledge of Software as a Service sales models, especially marketing automation, Web Analytics, Targeting or Advertising.",marketing specialist,Renewal Sales Specialist,full-time,Sydney NSW,2022-07-17,4.3,
TikTok,AUSTRALIA,"  Experience in advertising, marketing or technology industry with a strong understanding of digital marketing landscape in AUNZ (especially across mobile, social…",marketing specialist,"Marketing Program Manager, Agencies (12 month fixed term con...",contract,Sydney NSW,2022-08-11,,
Microsoft,AUSTRALIA,"  Collaborates with account teams (e.g., Account Executives) to identify and engage senior business subject matter decision makers at the customer's/partner's…",marketing specialist,Azure Apps&amp;Infra Specialist (Thai Speaking),full-time,Sydney NSW 2000,2022-07-28,4.2,
Sarah Cockell Consulting,AUSTRALIA,"  You’ll implement promotions, ensure brand content and merchandise is displayed correctly and work on specialist project to enhance customer experience and…",marketing specialist,eCommerce Specialist - Fashion Brand,full-time,Melbourne VIC,2022-08-11,,
Coal Services,AUSTRALIA,  *Newly established role for a passionate Communications professional*. *Flexible location with travel required*. To be successful you will have: *.,marketing specialist,Communications Specialist,full-time,Australia,2022-08-06,4.0,
MCG&amp;Co.,AUSTRALIA,"  Proven track record in the development of strategic marketing plans, social strategy, understanding the needs of consumers and target audiences.",marketing specialist,Digital Marketing Specialist,,Remote in Gold Coast QLD,2022-07-17,,
Interactive Pty Ltd,AUSTRALIA,"  Own the design and execution of marketing campaigns to generate leads for our sales teams. Reporting to our GM – Marketing you’ll lead our Field Marketing team,…",marketing specialist,Head of Demand Generation Marketing,,Melbourne VIC,2022-07-27,3.9,
Bluefin Resources,AUSTRALIA,  2+ years hands on paid search marketing experience required. Drive performance and optimisation for paid search channels.,marketing specialist,SEM Specialist,undefined,Sydney NSW,2022-07-22,,75000-90000
Claremont School,AUSTRALIA,"Degree in marketing related field/marketing qualification preferred. Knowledge of content management systems, customer relationship marketing and working with…",marketing specialist,Marketing and Communications Officer,part-time,Remote in St Leonards NSW,2022-08-07,,
Halliburton,AUSTRALIA,"May refer applicants for job openings, administer pre-employment tests, and conduct interviews, and is expected to conduct skills assessment and evaluation of…",marketing specialist,Recruiting Specialist,undefined,Perth WA 6000,2022-08-06,3.9,140
INEOS Automotive,AUSTRALIA,"Collaborating with marketing partners to develop creative, engaging and on-brand content and activations. They will work closely with various internal, external…",marketing specialist,Events Specialist,,Melbourne VIC,2022-07-17,,
Rheem,AUSTRALIA,2 + years’ experience in the creation and execution of digital marketing campaigns across multiple platforms. The execution of local digital marketing campaigns…,marketing specialist,Digital Marketing Specialist,,Sydney NSW 2000,2022-07-17,3.8,
Zip Co,AUSTRALIA,"A track record of ideation and execution of marketing initiatives that make significant, positive impacts to the business.",marketing specialist,Digital Design Specialist,full-time,Sydney NSW,2022-08-02,,
SBS,AUSTRALIA,"Reporting to the Publicity Manager within the Marketing team, the Senior Communications Specialist will be responsible for the planning, development and…",marketing specialist,Senior Communications Specialist,full-time,Sydney NSW,2022-07-19,3.7,
The Wilderness Society,AUSTRALIA,"You are driven to succeed and you have a strong track record in optimising digital systems for growth - for example, CRMs, digital marketing systems and…",marketing specialist,Digital Growth Specialist,,Australia,2022-07-17,4.1,
TPG Telecom,AUSTRALIA,Degree qualified in business or marketing. As a Digital Product Specialist you will help drive and shape the direction of our customer platforms across TPG…,marketing specialist,Digital Product Specialist,full-time,Remote in North Sydney NSW,2022-07-17,3.3,
Alquemie Group,AUSTRALIA,"Sitting within the Customer Department, you’ll partner with all teams from Marketing, to Brand Experience, to Digital, to our Agency partners bringing consumer…",marketing specialist,CRM Specialist - General Pants &amp; SurfStitch,full-time,Alexandria NSW,2022-08-09,,
Carnival,AUSTRALIA,Collaborate with all stakeholders to ensure website is updated and consistent with latest campaigns and marketing activity. 2 days WFH and 3 days in the office.,marketing specialist,Digital Experience Specialist,full-time,Remote in Sydney NSW,2022-08-13,3.9,
CoreLogic,AUSTRALIA,"Manage the integration of web analytics and marketing automation tools. 3+ years of relevant experience preferably in web data analytics and instrumentation,…",marketing specialist,Digital Analytics and Optimization specialist,full-time,Fortitude Valley QLD,2022-07-17,3.3,
Universal Music Group,AUSTRALIA,"Experience in YouTube Channel management, Influencer marketing or Social Creator content production is desirable.",marketing specialist,Social &amp; Content Optimiser,contract,Sydney NSW,2022-07-17,4.1,
Cancer Council SA,AUSTRALIA,"Work with the Partnerships Lead to create partnerships program (standard and bespoke) packages including reporting metrics, marketing tools, templates and…",marketing specialist,Partnerships Specialist,full-time,Temporarily Remote in Woolloomooloo NSW,2022-07-29,4.4,
Vista,AUSTRALIA,Total Cost of Ownership Improvement: Continuously improve TCO and performance to achieve Vista targets. Identify opportunities and prepare RFIs/RFQs.,marketing specialist,Procurement Specialist,,Derrimut VIC 3030,2022-08-08,3.7,
Elekta,AUSTRALIA,"Systems Specialists will support the Clinical Operations Applications Specialists and Physics in Customer cases, customers directly and other functions within…",marketing specialist,Systems Specialist / Unity (RAP),full-time,Remote in Sydney NSW,2022-07-17,,
On AG,AUSTRALIA,"  This role will act as a liaison among our Oceania team (supply and demand planning, customer service, sales and marketing) and our logistic service provider …",marketing specialist,Warehouse Specialist / Supervisor,,Melbourne VIC,2022-07-17,,
Beacon Lighting,AUSTRALIA,"  To coordinate and execute marketing campaign updates across sites. The role will assist and support the implementation of the groups ecommerce strategy, and…",marketing specialist,eCommerce Marketing Coordinator,full-time,Remote in Mulgrave VIC 3170,2022-08-15,3.6,
Nine,AUSTRALIA,  Be a recent university graduate with a marketing or commerce degree. This excellent junior /entry-level/graduate role presents a fantastic opportuniuty to be…,marketing specialist,Junior Data Specialist,full-time,Hybrid remote in North Sydney NSW 2060,2022-07-28,3.8,
AWS Australia Pty Ltd,AUSTRALIA,"  10+ of technology-related enterprise solutions sales, business development, or services delivery experience. BA/BS degree or equivalent work experience required…",marketing specialist,ANZ Capital Markets Specialist,full-time,Sydney NSW,2022-07-17,3.5,
Queensland Health,AUSTRALIA,"  As part of Children's Health Queensland (CHQ), the Communications and Engagement Unit provides a full scope of integrated marketing and communication services…",marketing specialist,Digital and Creative Specialist,,Brisbane QLD,2022-07-17,3.7,
Salt Search,AUSTRALIA,"  You understand the importance of ‘Data’, you’re in digital marketing, let that data decide and dictate the results of campaigns and then form your own analysis.",marketing specialist,Paid Media Specialist,undefined,Remote in Sydney NSW,2022-08-14,,70000-100000
Bega Cheese,AUSTRALIA,"  The new Quality Specialist will maintain, develop, and oversee all the site’s Quality related systems and procedures for our Peanut site at Kingaroy, 4610.",marketing specialist,Quality Specialist - Systems,full-time,Kingaroy QLD,2022-08-06,4.0,
S2M Digital,AUSTRALIA,"  You will execute email marketing programs, virtual events, webinars, and field events and manage marketing budget &amp; report on performance.",marketing specialist,Senior Marketing Specialist,full-time,Sydney NSW,2022-07-26,,
Suncorp Group,AUSTRALIA,"  Understanding of digital marketing, and search engine marketing best practice. As a Content Management Specialist, you will be an integral part of a customer…",marketing specialist,Content Management Specialist,full-time,Brisbane QLD,2022-08-04,3.5,
Reckitt,AUSTRALIA,"  Have a minimum of 2+ years of experience within a social or marketing capacity, managing social media communities and marketing campaigns.",marketing specialist,"Consumer Relations Social Specialist, Hygiene",contract,Remote in Sydney NSW 2000,2022-07-17,3.7,
Allianz Australia,AUSTRALIA,"  Act as an initial point of contact for stakeholders in relation to digital marketing campaigns. Act as a custodian of the Allianz brand, ensuring alignment and…",marketing specialist,Digital Performance Specialist,full-time,Remote in Sydney NSW 2000,2022-08-03,3.9,
Format Digital,AUSTRALIA,  General marketing and social media assistance from time to time. 1+ years experience in a social media or digital marketing role ideally in an agency setting.,marketing specialist,Campaign Assistant (Full-Time),full-time,Adelaide Region SA,2022-07-17,,
JLL,AUSTRALIA,  We’re seeking a talented writer and strategist to create innovative content and deliver effective media relations and public relations activities.,marketing specialist,Media and Communications Specialist,,Melbourne VIC,2022-07-17,3.7,
Michael Page,AUSTRALIA,  Cross referencing with business unit marketing messaging. Work along side experienced communication leaders. Crisis Comms/Risk Management experience.,marketing specialist,Corporate Communications Specialist/Lead,undefined,Hybrid remote in Melbourne VIC,2022-07-17,3.5,120000-130000
Medibank,AUSTRALIA,"  The Digital Marketing SEO Specialist is responsible for the organic digital performance of Medibank portfolios of health insurance, health and wellbeing, and…",marketing specialist,Digital Experience Specialist,,Docklands VIC 3008,2022-08-02,3.4,
Journey Early Learning,AUSTRALIA,  Have a marketing or communications degree. We are seeking a content specialist who will act as the conduit between our Marketing and all other departments…,marketing specialist,Communications Specialist,full-time,Hybrid remote in Brisbane QLD,2022-07-17,3.1,
Techtronic Industries (TTI),AUSTRALIA,  Implement the user focussed channel marketing strategies defined by the Channel Managers. To create user demand for Milwaukee across all categories and…,marketing specialist,"Utility Specialist, Milwaukee - FNQ",,Australia,2022-08-03,3.5,
GPC Asia Pacific,AUSTRALIA,"  As we embark on a digital transformation journey within GPC Asia Pacifc, we’re looking for a Marketing Automation Specialist to assist us achieve our…",marketing specialist,Marketing Automation Specialist - Flexible location Victoria...,full-time,Rowville VIC,2022-07-17,3.4,
Scout Talent HQ,AUSTRALIA,"  As our newest Specialist, you will have previous experience working in customer service, marketing or recruitment.",marketing specialist,Talent Sourcer,undefined,Remote in Melbourne VIC,2022-08-12,,65000-78000
Monash University,AUSTRALIA,  Experience of the Salesforce platform in a B2B sales or marketing environment and the dimensions of data quality that support effective delivery of account…,marketing specialist,Data Quality and Integrity Specialist,undefined,Clayton VIC,2022-08-06,4.1,105204-116128
KPMG,AUSTRALIA,  Develop and communicate marketing briefs. 15 years’ experience in B2B marketing field. Incorporate innovative best practice techniques and continuous…,marketing specialist,Senior Marketing Manager,full-time,Sydney NSW,2022-07-27,3.9,
KPMG,AUSTRALIA,"  Strong interest in customer research and insight, customer and citizen experience (CX), human-centred design (HCD), innovation, marketing &amp; communications, new…",marketing specialist,"Customer, Brand &amp; Marketing Advisory - CX &amp; human",full-time,Melbourne VIC,2022-07-17,3.9,
Australian Marine Conservation Society,AUSTRALIA,"  Tertiary qualification in communications or marketing. With 65% of seafood sold in Australia imported, AMCS is part of an alliance of organisations across all…",marketing specialist,Campaign Communications Specialist,full-time,Sydney NSW,2022-08-13,,
marketingmoves plc,AUSTRALIA,  Previous experience of working in a similar marketing operations role with experience of Marketo is essential.,marketing specialist,Contract: Marketing Operations Specialist (Marketo),contract,Australia,2022-07-17,,
SBS,AUSTRALIA,"  Disseminate latest updates and regularly present to the National Media Sales Team, ensuring they are well-informed about content changes, sponsorship…",marketing specialist,"Coordinator, SBS CulturalConnect",full-time,Sydney NSW,2022-08-03,3.7,
