company_name,country,job_description,job_field,job_title,job_type,non_remote_location,post_date,rating,salary
Superior Propane,Canada,"  This includes understanding current and future business needs, aligning product usage as appropriate, owning the health and stability of the product, and…",product manager,Product Owner,,Ontario,2022-07-17,3.3,
Citi,Canada,"  Oversee day-to-day product management for core products such as product delivery, client experience, and client communication strategies as well as prioritize,…",product manager,TTS Payments &amp; Receivables Product Manager (AVP),full-time,"Toronto, ON",2022-07-17,3.9,
Desjardins,Canada,  You will consistently prepare a range of products and services to ensure a positive member/client experience. Identify and analyze major problems and issues.,product manager,"Product Owner, Marketing",full-time,"Hybrid remote in Montréal, QC",2022-08-09,3.9,
Conair Consumer Products ULC,Canada,  Lead product presentations to internal sales team and external customer base. Provide recommendations on all potential new product additions within the category…,product manager,Product Manager,full-time,"Montréal, QC",2022-07-19,2.8,
amdocs,Canada,"  Manage the competitive landscape /research for his respective product offer, aligning with the competitive intel team as needed.",product manager,Product Marketing Manager,,"Toronto, ON",2022-07-17,3.8,
SPARK Microsystems International,Canada,  Interact with customers and sales to solicit feedback on product specifications and product roadmaps. Define and help develop compelling product demos.,product manager,Product Manager,,"Montréal, QC",2022-07-17,,
Citi,Canada,"  As a lead product manager, analyse and collaborate solutions and strategies with the team and provide the optimum solution for our stakeholders.",product manager,"Product Manager - Banking, Capital Markets and Advisory",full-time,"Mississauga, ON",2022-07-17,3.9,
Planet,Canada,  At least x3 years of product manager experience or similar/equivalent. Manage the product lifecycle roadmap aligned to the Senior Product Director through…,product manager,Acquiring Product Manager,full-time,Remote in Canada,2022-07-17,3.8,
IPG Mediabrands,Canada,  Work with HR and Agency Leads on updating onboarding plans for new employees as it relates to assigned products and solutions.,product manager,"Mediabrands - Product Manager, Media Operations &amp; Transforma...",,"Toronto, ON",2022-07-27,3.7,
Electronic Arts,Canada,"  At least 5 years of experience in product management, analytics or a data-focused role. Create the strategy for measuring player skill and tracking skill…",product manager,Product Manager,full-time,"Remote in Vancouver, BC",2022-07-17,3.8,
Mino Games,Canada,"  Review daily KPIs and identify opportunities, trends, and threats to the product. Act as day-to-day primary point of contact for any product-related questions…",product manager,Producer (Product Ops Manager) (LATAM),,"Remote in Montréal, QC",2022-07-17,,
Tolko Marketing and Sales Ltd.,Canada,"  Strong product and market development background with in-depth knowledge of forest products manufacturing processes, markets and trends, including engineered…",product manager,Product Development and Commercialization Manager,full-time,"Vernon, BC",2022-07-21,,
Moneris Solutions,Canada,  Creating and maintaining presentations for key internal partners and leading product demonstrations for both internal and external customers.,product manager,Product Specialist,full-time,"Toronto, ON",2022-07-20,3.4,
Cineplex,Canada,"  Manage a coherent product backlog in addition to owning the definition of user stories, roadmap/planning and communication with stakeholders.",product manager,"Product Manager, Mobile Applications",full-time,"Toronto, ON",2022-07-17,3.2,
eSentire,Canada,"  Most importantly, you are an outstanding communicator; a writer who enjoys developing messaging that will connect and resonate seamlessly with key stakeholders…",product manager,Product Marketing Manager,full-time,+2 locationsRemote,2022-07-17,4.0,
BC Assessment,Canada,"  Leads and participates in the research, development, implementation and documentation of changes to financial, HR and payroll operations practices and…",product manager,"Manager, Workday Product Solutions",undefined,"Victoria, BC",2022-07-17,3.7,104300-127400
SnapTravel,Canada,"  Experience working in an a strategy, operations, or consulting role; and/or a former engineer. You excel at crafting compelling messaging and positioning for…",product manager,"Senior Manager, Product Marketing (Remote)",full-time,"Remote in Vancouver, BC+1 location",2022-07-17,,
Prophix Software Inc.,Canada,  Can mentor other product managers. Leverage design thinking techniques and strategies to collaborate with stakeholders and cross-functional teams to refine…,product manager,Senior Technical Product Manager (Hybrid),full-time,"Hybrid remote in Mississauga, ON",2022-07-17,4.1,
TandemLaunch,Canada,  Own the development of the product vision and work with key stakeholders to build a successful product strategy.,product manager,Technical Product Manager,,"Montréal, QC",2022-07-17,3.7,
Identity Digital,Canada,"  Work in a collaborative manner with other technical product managers, developers and QA staff to ensure the smooth delivery of long term development initiatives…",product manager,Technical Product Manager (Remote - Canada),full-time,Remote in Ontario,2022-07-29,,
Yelp,Canada,"  Partner with product management, engineering, research and marketing to ensure a smooth product development process.",product manager,Product Design Manager (Remote),full-time,"Remote in Toronto, ON",2022-07-17,3.4,
Scotiabank,Canada,  Coordinates product releases and publishes release notes to partners ensuring all key stakeholders are kept informed of the changes in a release.,product manager,"Digital Product Manager, Scotia Digital",,"Remote in Toronto, ON",2022-08-08,3.9,
International Air Transport Association (IATA),Canada,  Cooperate closely with internal stakeholders and external key accounts for the coordination and accurate reflection of IATA Standards in training products.,product manager,"Product Manager, Passenger Experience, People Skills and Gen...",,"Montréal, QC",2022-08-11,3.7,
BMO Financial Group,Canada,  Supports the execution of strategic initiatives in collaboration with internal and external stakeholders including model development.,product manager,"Manager, Valuation Product Control- Foreign Exchange &amp; Commo...",full-time,"Toronto, ON",2022-07-17,3.8,
Finning International Inc.,Canada,"  Working with our stakeholders and developers you, as the Product Owner, will be responsible for translating vision into software that will take Finning to the…",product manager,Product Owner,full-time,"Edmonton, AB",2022-07-17,3.9,
Deloitte,Canada,  Partners with internal support and operations teams to enhance the customer experience lifecycle through optimization of internal processes and knowledge…,product manager,"Product Mgmt. Team Lead (Sr. Mgr.), Deloitte Global Technolo...",,"Toronto, ON",2022-07-17,3.9,
Klue,Canada,"  Conducting both quantitative and qualitative research to inform product decisions and prioritization. Collaborating with other product managers, engineers, and…",product manager,Product Manager,full-time,Remote,2022-07-17,5.0,
Neurio Technology,Canada,"  Collaborating with product and company leadership to define the product roadmap. Providing product leadership, using data and market knowledge to take…",product manager,Technical Product Manager,full-time,"Vancouver, BC",2022-07-17,,
LifeWorks,Canada,"  Contribute to the wider product roadmap planning and co-ordination effort to ensure a holistic customer experience, and professional operations.",product manager,Software Product Owner- Remote,full-time,"Remote in Markham, ON",2022-07-22,3.1,
LED Sign Supply,Canada,"  Work closely with product development team to determine the most profitable course for each existing and new product. Vice President, Sales and Marketing.",product manager,Product Marketing Manager,,"Calgary, AB",2022-07-17,,
TELUS,Canada,  Collaborate with other product owners and product managers to achieve common goals. Experience in product development (hardware or software) and technical…,product manager,"Product Owner, Home Solutions",full-time,"Vancouver, BC",2022-07-17,3.9,
Scotiabank,Canada,"  5+ years of experience working as a product manager shipping consumer facing software solutions; experience working on digital products, preferably in the…",product manager,"Digital Product Lead, Scotia Digital",,"Remote in Toronto, ON",2022-08-12,3.9,
Finning International Inc.,Canada,"  Work with stakeholders to develop consensus, maintain the product and feature roadmap, from inception to sunset while managing backlog prioritization.",product manager,"Sr. Product Manager, CUBIQ Platform",full-time,"Vancouver, BC",2022-07-30,3.9,
BenchSci,Canada,"  Help define the product strategy. Build and maintain the product roadmap, and help facilitate the relevant sessions with key stakeholders including, but not…",product manager,"VP, Product Management",full-time,"Remote in Toronto, ON",2022-07-17,4.0,
Bison Transport,Canada,"  Develop a deep understanding of the product stack from technical, operations, business and finance perspectives, and use the understanding to bring high-impact…",product manager,Technical Product Owner,full-time,"Winnipeg, MB",2022-07-17,3.4,
BentallGreenOak,Canada,"  Advanced communicator - clearly communicating with internal stakeholders via verbal, written and presentation mediums. University degree in related field.",product manager,"Manager, Corporate Product Management - 1 year contract (Rem...",full-time,"Remote in Toronto, ON",2022-08-05,3.5,
Old Navy,Canada,  Your leadership role is critical in supporting the execution of the store strategy to achieve performance goals and drive profitable sales growth through all…,product manager,"Assistant Manager, Product Operations",full-time,"Edmonton, AB",2022-07-17,3.6,
Manulife,Canada,"  Collaborate with internal and external stakeholders to ensure successful implementation of features. Conduct analysis and incorporate findings, feedback and…",product manager,Senior Product Owner,full-time,"Waterloo, ON",2022-07-28,4.0,
DudaMobile,Canada,"  Extract product/marketing insights from market research, conducting Alpha &amp; Beta user interviews, and gathering customer-facing intelligence from relevant teams…",product manager,Senior Product Marketing Manager,full-time,"Quebec City, QC",2022-07-17,,
Invesco,Canada,  Collaborate with product managers/owners for new capabilities and enhancements to the platform. Excellent competency in product and project management tools.,product manager,Digital Product Marketing Manager,full-time,"Toronto, ON",2022-07-17,3.9,
Hexagon Geosystems,Canada,"  Collaborate with the sales, operations, and technology teams to support an international go-to-market strategy. Manage corporate associations and memberships.",product manager,Product Marketing Manager,,"Hybrid remote in Burnaby, BC",2022-08-09,3.5,
TELUS,Canada,  Demonstrated product management and product owner experience. Experience in building complex digital platform products and services.,product manager,Connected Home Next Wave Services - Product Leader,full-time,"Vancouver, BC",2022-08-11,3.9,
Electronic Arts,Canada,"  5+ years of experience with software development, for example as a programmer or a product manager. Lead ongoing lifecycle product management.",product manager,Senior Technical Product Manager - BioWare,full-time,"Edmonton, AB",2022-07-17,3.8,
Centric Brands,Canada,  Develop and execute product designs that achieve overall product strategy and merchandise objectives. Participate in research and development of seasonal trends…,product manager,"Manager, Product Development",full-time,"Montréal, QC",2022-07-17,,
KPMG,Canada,  The successful candidate will provide services in the field of valuation of over-the -counter (OTC) financial instruments and primarily derivatives in support…,product manager,"Manager, Financial Product Valuation and Financial Risk Mana...",full-time,"Montréal, QC",2022-07-17,3.9,
CIBC,Canada,  You also have in-depth knowledge of [insert LoB specific product names] products. Client Account Management Strategy – You will work with various partners to…,product manager,"Group Product Manager, Portfolio Management Team",full-time,"Hybrid remote in Toronto, ON",2022-08-04,3.8,
ORION Empowering Innovation,Canada,"  You have a simple, clear, and consistent approach to product management, informed by analysis, research, and your wisdom. Flexible work-from-home policy.",product manager,Product Manager,,"Toronto, ON",2022-07-17,,
Lumentum Operations LLC,Canada,  Collaborate with R&amp;D to develop a strong product pipeline and a portfolio of products that are differentiated and provide competitive advantage for the company.,product manager,"VP, Product Line Management",full-time,"Ottawa, ON",2022-07-17,3.6,
Hexagon,Canada,"  Execute product launch activities, product sheets, feature briefs and other relevant collateral related to new products and services.",product manager,Agriculture Product Manager,full-time,"Calgary, AB",2022-07-17,3.5,
"LotLinx, Inc.",Canada,  Develop detailed project requirements and user stories along with stakeholders that can be used to create product specifications and architecture for each…,product manager,Senior Technical Product Manager,,"Remote in Winnipeg, MB",2022-07-20,,
SnapTravel,Canada,"  Our product engineering squads are responsible for building our four core products - hotels, fintech, eCommerce, and our superapp. Lead a domain-based squad.",product manager,Engineering Manager - Product (Remote),full-time,"Remote in Vancouver, BC+1 location",2022-08-06,,
Medavie Blue Cross,Canada,"  Builds strong relationships and collaborates closely with a wide variety of stakeholders, both internal and external, to accomplish goals and drive results;…",product manager,"Manager, Health &amp; Digital Product Solution",full-time,"Moncton, NB",2022-07-17,3.4,
CGI,Canada,"  Leading the definition of the product vision, roadmap, and high-level product backlog for assigned areas of the product.",product manager,"Sr. Product Manager, Financial Wellness Solutions",full-time,"Toronto, ON",2022-07-17,3.6,
Larsen &amp; Toubro Infotech Limited,Canada,"  Work with Enterprise / Solution architects in designing solution. This role requires in-depth knowledge of Duck Creek Platform, agile/scrum, change orientation…",product manager,Senior Specialist - Product Engineering,,"Toronto, ON",2022-08-09,3.7,
Leavitt Machinery Canada Inc.,Canada,"  The product management position includes product marketing, forecasting, and pricing/margin management. Minimum 3 years’ experience in product management.",product manager,Product Manager - Agriculture,full-time,"Calgary, AB",2022-07-17,3.4,
Securability Protection,Canada,  Also experience developing and communicating marketing strategy to various stakeholders. You will collaborate with Vendors and Category Leaders to enhance…,product manager,Product Marketing Manager,full-time,"Victoria, BC+1 location",2022-07-17,,
Harvest Builders,Canada,"  You’ve held roles or responsibilities for product management, marketing and operations. Build upon the initial askBetty vision to define the product strategy,…",product manager,Senior Product Manager,full-time,"Calgary, AB",2022-07-17,4.7,
LTSA,Canada,"  Continuous Compliance - Continuous and early adherence to internal or external financial auditing constraints, industry legal or regulatory guidelines and BI&amp;T…",product manager,Product Portfolio Manager - Platform,,"Hybrid remote in Vancouver, BC",2022-07-21,,
N. Harris Computer Corporation Cad,Canada,"  Demonstrate the product and communicate its value proposition to customers and internal stakeholders. As passionate and inspirational leaders, they will compel…",product manager,(Remote) Technical Product Manager,,"Remote in Ottawa, ON",2022-08-06,,
Aritzia,Canada,  Develop high quality product that fulfills the design vision. Optimize your supplier’s capabilities with the product strategy.,product manager,"Product - Senior Manager, Production",full-time,"Vancouver, BC",2022-07-17,3.4,
Loopio,Canada,"  4+ years of work experience in product management, shipping successful products. Lead and conduct qualitative and quantitative research initiatives to identify…",product manager,Senior Product Manager (Content Trust Team),full-time,"Remote in Vancouver, BC+1 location",2022-07-17,5.0,
Mastercard Foundation,Canada,"  Serve as product manager for multiple, related products. Reporting to the Head of Enterprise Applications, the role will Enterprise Applications Product Manager…",product manager,Product Manager - Finance &amp; Procurement Systems,,"Toronto, ON",2022-07-17,,
Lightspark,Canada,"  Lead and collaborate with internal stakeholders to drive go-to market activities such as internal training, documentation demos etc for your individual product…",product manager,"VP, Product",,"Vancouver, BC",2022-07-17,,
McAfee,Canada,  You will run product management for McAfee’s Small business segment with product delivery and distribution in direct and partner channels.,product manager,"Principal Product Manager, Small Business - Remote",full-time,Remote in Ontario,2022-07-17,3.7,
CONSUMER &amp; SMB/MARCHÉ CONSOMMATEUR &amp; PME,Canada,"  Previous experience in product development or product management, ideally in the fields of telecom or home entertainment. An MBA is a strong asset.",product manager,"Senior Product Manager, Internet VAS",full-time,"Toronto, ON",2022-07-17,,
BRP,Canada,  Ensure supplier capacity is sufficient for product development roadmap and manage supplier relationships through his commodities.,product manager,Product Development Sourcing Manager,,"Valcourt, QC",2022-07-17,3.8,
Genius Project,Canada,"  Cerri.com prides itself on creating a culture of growth and learning for all its employees, with competitive pay, vacation time and benefits.",product manager,Senior Product Marketing Manager,full-time,"Montréal, QC",2022-07-17,,
Wiley,Canada,"  Evaluate competitive products and new technologies from research institutions, aiming to enhance future products.",product manager,Product Manager - Software and Databases - New Techniques,,Remote in Canada,2022-07-30,3.8,
Transit,Canada,"  Comprenant les produits, le marché et les données s’y rattachant. Tenant à jour nos données produits (numéro d’interchanges, spécifications produits, etc.).",product manager,Product Manager,full-time,"Remote in Lévis, QC",2022-07-17,3.9,
Mistplay,Canada,"  Conduct research and develop a good understanding of the customer's needs, new technologies, trends in the market, and competitors.",product manager,Product Manager // Chef de produit (Remote),undefined,"Remote in Montréal, QC",2022-07-17,,65000-110000
Capital One,Canada,"  Proven leader, motivator, and effective decision maker with a detailed understanding of digital product management. 3-5 years of Product Management experience.",product manager,"Principal Associate, Product Management",full-time,"Hybrid remote in Toronto, ON",2022-08-11,3.9,
Levio,Canada,  Experience as product assurance or quality assurance manager on at least one software project that was successfully deployed or sold commercially.,product manager,Product Assurance Manager,,Canada,2022-08-03,4.1,
Rocket Innovation Studio,Canada,  3 years of experience in a product development role. Share insights throughout the company regarding the product(s). Certified Scrum Product Owner Training.,product manager,Product Owner (Hybrid or Remote),full-time,"Remote in Windsor, ON",2022-07-17,,
BCLC,Canada,"  Reports to stakeholders, including the executive sponsor (VP), Directors or other product teams on the progress and status of product team deliverables.",product manager,Product Owner,,Remote in British Columbia,2022-08-04,3.4,
Expedia Group,Canada,  5+ years’ experience in product or data management. Gather detailed business opportunities from internal clients and turn them into the epics and stories that…,product manager,Senior Product Manager,full-time,"Montréal, QC",2022-07-17,3.9,
Sage,Canada,"  Through user research, market insights, competitor analysis, and key-value propositions you'll identify opportunities on how we can maximize penetration of sell…",product manager,Senior Product Marketing Manager,,"Remote in Toronto, ON",2022-07-17,3.5,
Sonova,Canada,"Own the product roadmap, working with internal and external customers to analyze the needs and aligning product roadmap to strategic goals.",product manager,"Product Owner, eCommerce",,"Hybrid remote in Kitchener, ON",2022-07-17,3.6,
BMO Financial Group,Canada,Acts as the prime subject matter expert for internal/external stakeholders. Supports the execution of strategic initiatives in collaboration with internal and…,product manager,Product Owner,full-time,"Toronto, ON",2022-07-17,3.8,
Sun Life,Canada,Be accountable for product-specific OKRs and communicate progress to stakeholders. Integrate usability studies and research into product requirements to enhance…,product manager,Product Owner,undefined,"Remote in Waterloo, ON+1 location",2022-07-17,3.9,74900
Airbus,Canada,"You have good knowledge of the A220 product and ACLP organization. Develop, implement, monitor and challenge product safety plans,.",product manager,Airbus Canada - Responsable sécurité produit / Product Safet...,full-time,"Mirabel, QC",2022-07-21,4.2,
MNP,Canada,Create relationships with internal stakeholders to understand their needs and anticipate what changes in features or functionality will better enable…,product manager,Assurance Product Manager,full-time,"Calgary, AB",2022-07-17,3.0,
Federated Co-operatives Limited,Canada,"You will contribute to the development and maintenance of custom internal digital systems (location and data management tools, web CMS) as well as external…",product manager,Digital Product Specialist,full-time,"Remote in Regina, SK+6 locations",2022-08-09,3.4,
McAfee,Canada,"+5 years of experience in product management and or working with endpoints for B2B digital business model connections. Medical, Dental and Vision Coverage.",product manager,"Technical Product Manager, Partner Platforms - Remote",full-time,Remote in Ontario,2022-07-17,3.7,
Canada Post - Postes Canada,Canada,Coordinates with internal stakeholders (Business Delivery/ Retail/ Operations/ Technology) and external financial services partners to facilitate a high-quality…,product manager,"Manager, Indigenous Product Strategy and Customer Experience",full-time,"Ottawa, ON",2022-08-13,3.6,
Aveva,Canada,"The PM operates as the customer proxy, sharing content authority with Product Managers, and together work with stakeholders [to define and prioritize features…",product manager,Program Manager,full-time,Canada,2022-08-10,,
Central 1 Credit Union,Canada,"As a Product Owner (PO) you'll help manage the product from conception to completion, with both internal and external stakeholders.",product manager,Product Owner (Hybrid/Remote),full-time,"Remote in Vancouver, BC",2022-07-30,2.8,
Amazon Dev Centre Canada ULC,Canada,7+ years of experience building products for web services or cloud products. Perform outbound marketing and product launch activities.,product manager,"Principal Product Manager - Technical, Amazon MQ",full-time,"Vancouver, BC+5 locations",2022-08-03,3.5,
McDonald's Corporate,Canada,"In collaboration with market stakeholders, manage the engineering tasks and processes necessary to release a localized mobile app build into the iOS App Store…",product manager,"Technical Product Manager, Mobile App Deployments",,"Toronto, ON",2022-07-23,3.5,
BMO Financial Group,Canada,"Demonstrated ability to translate business problems into product requirements, launching a new product and defining the product roadmap &amp; strategy.",product manager,Technical UI/UX Product Manager,full-time,"Toronto, ON",2022-07-17,3.8,
Salesforce,Canada,"5+ years of experience as a product manager working on partnerships, developer platforms or low-code platforms, or marketplaces with external stakeholders; go…",product manager,"Senior Product Manager, Platform Ecosystem - Slack",full-time,"Vancouver, BC+1 location",2022-07-17,4.4,
Wenyuan Canada Ltd,Canada,"Plan, organize, direct, control and evaluate daily operations. Hire, supervise and train or oversee training of employees in the use of new equipment or…",product manager,plastic products-manufacturing plant manager,undefined,"Delta, BC",2022-07-17,,38.50-42.50
Zynga,Canada,"  Lastly, the Sr. Product Manager will effectively champion his/her product vision &amp; strategy, monitor product progression through completion of milestones and…",product manager,Senior Product Manager -Merge Dragons,,Temporarily Remote,2022-07-17,3.8,
Genesys,Canada,"  Drive discussions with key stakeholders in product, engineering and field experts to build consensus. A keen eye for design and UX, with product experience that…",product manager,Senior Product Manager,,"Temporarily Remote in Markham, ON",2022-07-26,3.7,
opentext,Canada,  6+ years industry experience and at least 2+ years experience as product manager or product owner. The Technical Product Manager will support product strategy…,product manager,Technical Product Manager,,"Mississauga, ON",2022-08-13,3.5,
