company_name,country,job_description,job_field,job_title,job_type,non_remote_location,post_date,rating,salary
Ritchie Bros.,Canada,Conduct research on hardware and software products to justify recommendations and to support purchasing efforts. Build and maintain a roadmap for the product.,product manager,Senior Technical Product Owner,,"Remote in Burnaby, BC",2022-08-13,3.7,
Fidelity International,Canada,Defining Customer Protection strategy roadmap through collaboration with key stakeholders. The broader organisation incorporates Infrastructure services that…,product manager,Customer Protection Product Owner,full-time,"Kingswood, AB",2022-07-17,3.9,
"ABC Financial Services, Inc.",Canada,"Interest in or knowledge of project and/or product management. The successful candidate will be well-organized, a strong communicator, have customer service…",product manager,Custom App Product Associate,full-time,"Remote in Vancouver, BC",2022-07-17,,
Corvus Energy,Canada,"Define and manage the product-level requirements, ensuring that each proposed product meets the needs of internal and external stakeholders.",product manager,Technical Product Lead,,"Richmond, BC",2022-07-17,2.9,
Coveo,Canada,A passionate product marketer with 7+ years B2B software product marketing experience. You will partner closely with product management to understand the…,product manager,Senior Product Marketing Manager - Financial Services,,"Remote in Toronto, ON",2022-07-17,3.7,
Ciena,Canada,"Assist sales in product presentations, capturing customers, assessing products to meet customer needs and in preparing detailed product specifications and…",product manager,Advisor Product Line Management,full-time,"Ottawa, ON",2022-07-17,3.9,
Nakisa,Canada,  Own core messaging and positioning for Nakisa’s Finance suite of products in alignment with Solution engineering and product team.,product manager,Product Marketing Manager - Finance Solutions,,"Montréal, QC",2022-07-17,2.9,
Western Union,Canada,"  University degree, plus 3+ years related experience. Nous sommes une FinTech à l’écoute des idées de nos clients et de nos collaborateurs à travers le monde…",product manager,"Assistant Manager, Product Marketing",full-time,"Montréal, QC",2022-08-06,3.9,
RELX,Canada,"  Evaluates product hypotheses in a quantitative manner, including AB testing for interactive products. Participates in product discovery, according to defined…",product manager,Bilingual Product Mgr II - Gen,full-time,"Quebec City, QC",2022-07-20,,
Unstoppable Domains,Canada,  2+ years of experience in people management and comfort working with senior product managers to achieve their career goals.,product manager,"Product Lead, Ecommerce",full-time,Remote,2022-07-17,,
Haivision,Canada,"  DEVELOP PRODUCT POSITIONING: Contribute to, and manage, the development of product messaging that differentiates Haivision products and solutions from…",product manager,Product Marketing Manager (Montreal),full-time,"Montréal, QC",2022-07-17,4.0,
Deloitte,Canada,  Recommend product change/enhancements once a product has been deployed. Collaborate with stakeholders and product owner to define processes/guidelines/best…,product manager,"SAP Finance Product Analyst, Deloitte Global Technology (GS-...",,"Toronto, ON",2022-08-11,3.9,
Westport Fuel Systems,Canada,"  Strong understanding of product development process. The EPP will also support program managers by maintaining up to date our detailed project schedules,…",product manager,Engineering Product Planner [12 month contract],,"Vancouver, BC",2022-07-17,3.4,
Highwood Emissions Management,Canada,  Experience in product design or product development. Experience product ownership and management. Confirm and update the product roadmap.,product manager,Product Lead,undefined,"Remote in Calgary, AB",2022-08-09,,57133-169676
BMO Financial Group,Canada,  Acts as the prime subject matter expert for internal/external stakeholders. Supports development and execution of strategic analytics &amp; reporting initiatives in…,product manager,Product Manager - I&amp;CB Client Data,full-time,"Toronto, ON",2022-07-17,3.8,
Gap,Canada,  Your leadership role is critical in supporting the execution of the store strategy to achieve performance goals and drive profitable sales growth through all…,product manager,"Assistant Manager, Product Operations",full-time,"Rocky View, AB+1 location",2022-07-17,3.8,
Fortinet,Canada,"  Well-versed in networking concepts and different aspects of network security (authentication, authorization, access control, etc…).",product manager,Junior Product Management Specialist,full-time,"Burnaby, BC",2022-07-17,3.8,
CONSUMER &amp; SMB/MARCHÉ CONSOMMATEUR &amp; PME,Canada,  Minimum 7 years of experience in product management and business development for consumer products and services. Job Status: Regular - Full Time.,product manager,"Senior Product Manager, Consumer IoT, eSIM and Network-Enhan...",full-time,"Toronto, ON",2022-08-03,,
BlackBerry,Canada,"  Collaborates with external and internal stakeholders (Product Management, Architects and Engineering leads) to research features, develop prototypes, and…",product manager,BlackBerry IVY - Senior Technical Product Owner,full-time,"Ottawa, ON",2022-07-30,4.0,
Basis Technologies,Canada,  Product Strategy: This team provides critical research on product development work and clarifies the many opportunities available for strategic and market…,product manager,Sr Technical Product Manager - SEM (Remote Optional),full-time,Remote in Ontario,2022-07-17,,
"Tyler Technologies, Inc.",Canada,"  As a product/QA analyst, you will work in a flexible, friendly, and collaborative product team consisting of designers and developers.",product manager,Product Business &amp; Quality Analyst,,"Remote in Vancouver, BC",2022-08-08,3.6,
Meta,Canada,"  Build bridges with product and infrastructure teams to discover adoption challenges, champion purpose use development and privacy/security product adoption.",product manager,"Ads and Business Products, Technical Program Manager, Produc...",full-time,Remote,2022-07-17,4.1,
KAR Global,Canada,  Assist business stakeholders in the development of a strategic roadmap for the Salesforce platform to deliver best in class service to our customers and achieve…,product manager,Salesforce Associate Product Manager (Remote),full-time,Remote in Ontario,2022-07-17,3.1,
GSK,Canada,"  In addition, all customer-facing employees who, as part of their job, attend healthcare settings such as hospitals, pharmacies, doctors’ offices and dentists’…",product manager,"Marketing Manager, New Products Specialty Care - 12 month co...",,"Mississauga, ON",2022-07-17,4.1,
Fidelity International,Canada,  Ensure that product specifications and internal product materials are kept up-to-date. As a senior pension product manager you will be responsible for the…,product manager,Senior Manager - Pension Product,full-time,"Kingswood, AB",2022-07-17,3.9,
SkyHive Technologies Inc.,Canada,"  Your ability to lead both strategically and tactically will drive the success of these teams, and impact the overall business momentum of our client This role…",product manager,Technical Product Manager - Data Platform,full-time,"Vancouver, BC",2022-07-17,4.8,
Brother Canada,Canada,"  Drive product launches by collaborating closely with the Sales, Marketing and Supply Chain teams to ensure a timely launch with all required deliverables…",product manager,Product Manager / Gestionnaire de produits,full-time,"Hybrid remote in Dollard-Des Ormeaux, QC",2022-07-17,3.8,
Bally's Interactive,Canada,"  Create and drive the vision and strategy for the product and product features in collaboration with project managers, business sponsors and key stakeholders.",product manager,Product Owner – Enterprise Solutions,,"Toronto, ON",2022-08-14,,
IQM Corporation,Canada,"  2-4 years of previous product management experience. Experience in digital product design tools such as Figma, Sketch, or InVision.",product manager,Senior Product Manager - Front End,full-time,"Toronto, ON",2022-07-17,,
Wayfair,Canada,"  Order System team owns design, development and operations of Wayfair’s Global Order Management system, which is the central component between Wayfair’s…",product manager,"Associate Director of Product Management, Order Experience",,"Toronto, ON",2022-07-17,3.0,
Pratt &amp; Whitney,Canada,  Develop and refine a compelling Customer Service narrative with messages and proof points for external and internal stakeholders.,product manager,"Gestionnaire principale, communication des produits des serv...",full-time,"Longueuil, QC",2022-07-17,3.9,
Digicast,Canada,  3+ années d’expérience dans un rôle de produit leadership. Forte capacité à communiquer efficacement avec les publics techniques et non techniques.,product manager,Product Owner,,"Montréal, QC",2022-07-17,,
Open Text Corporation,Canada,"  Skilled in leading presentations and discussions with business, technical, and sales stakeholders. Working with internal and external team members to create…",product manager,Sr. Product Marketing Manager,,"Waterloo, ON",2022-07-30,3.5,
Island Health,Canada,  Demonstrated ability to establish and manage relationships with internal and external strategic partners and solution providers.,product manager,SCRUM Master,undefined,"Victoria, BC",2022-07-17,3.4,39.91-57.37
Bombardier,Canada,"  Analyze, identify and propose improvements to engineering processes adapted to internal customer needs. You have experience in CAD and PLM and with product…",product manager,Process and tools - Engineering processes project management...,full-time,"Hybrid remote in Toronto, ON",2022-07-17,3.8,
MDA,Canada,"  These products include web and AR/VR based ground control software, simulators, flight software, and test tools for control of robotic arms, rovers, and other…",product manager,Software Product Owner - Software Development,full-time,"Brampton, ON",2022-07-27,3.4,
Restaurant Brands International Campus...,Canada,"  Perform well during your internship, and we'll invite you to join our full-time Leadership Development Program after you graduate.",product manager,"Leadership Development Program - Summer Internship (Toronto,...",full-time,"Toronto, ON",2022-07-23,3.0,
TD Bank,Canada,"  Understand the internal business and technical environment, proactively defining, aligning or integrating with relevant stakeholders, shared services control…",product manager,Product Owner I - Branch Servicing,full-time,"London, ON",2022-07-21,3.8,
Sanofi US,Canada,"  An individual and well-structured introduction and training of new employees. You will liaise with stakeholders and cross functional teams to create, own, and…",product manager,Product Owner - Talent Acquisition &amp; Talent Management,full-time,"Toronto, ON",2022-07-17,4.1,
TELUS,Canada,"  Knowledge of telecommunications and mobility products. Experience in sales, channel, marketing or project management role for a consumer-facing retail brand.",product manager,Marketing Manager - Channel Marketing Products and Services...,full-time,"Remote in Toronto, ON",2022-08-06,3.9,
opentext,Canada,"  Skilled in leading presentations and discussions with business, technical, and sales stakeholders. Working with internal and external team members to create…",product manager,Sr. Product Marketing Manager,,"Waterloo, ON",2022-07-30,3.5,
Sonatype,Canada,"  Support product launches with product messaging for analysts and press, product collateral, and sales tools. Product demonstrations: Working in conjunction with…",product manager,Product Marketing Manager - Remote,full-time,Remote,2022-08-04,,
Restaurant Brands International Campus...,Canada,  You'll also receive a mentor during this period to help guide you throughout your journey with RBI! Corporate Communications – Internal and Brand Communications…,product manager,"Leadership Development Program - Full Time (Toronto, ON) - F...",full-time,"Toronto, ON",2022-07-23,3.0,
Labatt Breweries Canada,Canada,"  The Jr. Product Owner at Labatt requires a technical expertise to create, deliver and support a product roadmap for our custom internal Ordering tool built on…",product manager,Bilingual Jr. Product Owner,full-time,"Montréal, QC",2022-07-17,3.1,
Broadridge,Canada,  Communicate and evangelize product vision and roadmap to internal stakeholders. The Senior Director of Product Management will play a key role in defining our…,product manager,"Sr. Director, Product Management (Hybrid)",full-time,"Remote in Markham, ON",2022-07-17,3.6,
BlackBerry,Canada,  Develop product marketing proposals with key messages around unique selling points which set our products apart from the rest of the market.,product manager,Senior Product Marketing Manager - BlackBerry QNX (Industria...,full-time,"Ottawa, ON",2022-07-17,4.0,
Unity Technologies,Canada,"  Seek thorough product feedback through the deployment of alpha, beta, generally available products. Define the interactions between the Unity Editor and our…",product manager,Gestionnaire de produits techniques / Technical Product Mana...,,"Montréal, QC",2022-07-22,,
O.E.M. Remanufacturing Company Inc.,Canada,"  Fully participate in efforts by Caterpillar, Finning and OEM to address product issues, improve Customer Experience, and lower TCO (Total Cost of Ownership).",product manager,Technical Supervisor Product Support - Engines,full-time,"Edmonton, AB",2022-07-28,3.6,
GSK,Canada,"  Lead operationalization of commercial projects/programs in collaboration with Marketing Manager &amp; internal cross-functional and external partners (sales, agency…",product manager,"Product Manager, Specialty Care - Nephrology",,"Mississauga, ON",2022-07-17,4.1,
Nakisa,Canada,  Own core messaging and positioning for Nakisa’s HR suite of products in alignment with Solution engineering and product team.,product manager,Product Marketing Manager – HR Solutions,,"Montréal, QC",2022-08-02,2.9,
Sanofi US,Canada,  This role will also provide hands-on experience on collaborating with diverse vendors and major internal &amp; external stakeholders.,product manager,Product Owner - R&amp;D Portfolio,full-time,"Toronto, ON",2022-07-17,4.1,
National Bank of Canada,Canada,"  Manage stakeholders (regulatory, compliance, fraud, products, information technology, etc.). Align the product vision with the Bank's vision and needs;",product manager,Product Owner financing Unisson,full-time,"Montréal, QC",2022-08-02,3.9,
Investment Planning Counsel,Canada,"  Contribute to the process of new product development and enhancements for existing products &amp; services by conducting market research, competitive intelligence…",product manager,Project Manager,,"Hybrid remote in Mississauga, ON",2022-07-17,3.6,
CMiC,Canada,"  Work closely with product management to support product roadmap, new feature and product rollouts, and product positioning. Paid vacation and personal days.",product manager,Product Marketing Manager,full-time,"Toronto, ON",2022-07-17,3.2,
BMO Financial Group,Canada,"  Strong experience working with retail and business product fundamentals, including product design, functionality, and related policies and procedures.",product manager,"Product Manager - Home Financing, Strategy &amp; Communication -...",full-time,"Toronto, ON",2022-07-23,3.8,
SITA,Canada,"  Working closely with a global team of internal stakeholders, you will strive to gain a clear understanding of the business to deliver customer facing analytical…",product manager,Data Analytics Product Owner,full-time,"Montréal, QC",2022-07-17,3.8,
Bloom,Canada,  You like building positive client and peer relationships by understanding customers' business and project scope and can translate business requirements into…,product manager,"Deloitte Digital | Product Engineering Manager, Consulting (...",full-time,"Remote in Toronto, ON",2022-07-27,3.5,
Peoples Group,Canada,"  Navigate the team through the uncertainty, risk, and complexity and communicate the risks to required stakeholders. Knowledge of CI/CD pipelines.",product manager,Scrum Master (Financial Products),full-time,"Toronto, ON",2022-07-17,3.0,
Deloitte,Canada,  Engage with vendor on product support and strategy. Ensures that product vision is aligned with business strategy and outcomes.,product manager,"Deloitte.com Workfront Product Lead, Deloitte Global Technol...",,"Remote in Toronto, ON",2022-07-17,3.9,
Airbus,Canada,"  Nous visons un monde mieux connecté, plus sûr et plus prospère. Hiérarchise le travail et assure le meilleur alignement possible entre les besoins des clients…",product manager,"AIRBUS CANADA - Chef financier, Coûts des produits/ Finance...",full-time,"Mirabel, QC",2022-07-17,4.2,
Teck Resources Limited,Canada,  Engage with internal and external stakeholders to consult and inform product direction and ensuredevelopment is aligned with product vision.,product manager,Technical Product Owner,,"Vancouver, BC",2022-07-17,3.9,
Deloitte,Canada,  You like building positive client and peer relationships by developing an understanding of customer's business and project scope and can translate business…,product manager,"Senior Manager, Product Engineering, Consulting",,Canada,2022-07-17,3.9,
Utilismart Corporation,Canada,"  Develop and deliver product road map,. We offer dental, prescription drugs, and other benefit programs to enhance employees’ quality of life.",product manager,Project Manager,,"London, ON",2022-07-17,3.5,
Faire,Canada,  Our product security team works alongside product and engineering to design secure software solutions for Faire's web and mobile applications.,product manager,Senior Engineering Manager - Product Security,,"Remote in Kitchener, ON",2022-07-17,4.2,
opentext,Canada,  As Product Marketing Manager for cloud API services you will be working with our stakeholders to define and action the GTM for cloud API services (AKA…,product manager,Sr. Product Marketing Manager - Cloud API Services (Canada -...,,"Remote in Waterloo, ON",2022-08-09,3.5,
ServiceNow,Canada,"  Your technical acumen, customer empathy and leadership skills will help you thrive as a product leader as you work closely with data scientists, engineering…",product manager,"Senior Principal Product Manager, AIOps (Staff Inbound)",full-time,"Montréal, QC",2022-07-17,3.6,
O2 Web,Canada,"_3 années d’expérience en tant que chef de produit (product owner) dans le cadre de projet de transformation numérique, dont minimum 1 an dans un rôle conseil_.",product manager,Chef.fe de Produit - Product Owner,full-time,"Remote in Montréal, QC",2022-07-17,,
BMO Financial Group,Canada,Acts as a subject matter expert on relevant regulations and policies for internal/external stakeholders. Oversees the development of business analytics and…,product manager,"Manager, Digital Products Data &amp; Analytics (Contributor)",full-time,"Toronto, ON",2022-07-17,3.8,
Deloitte,Canada,"Experience in product and program management. Maintain and enhance our key communication channels, such as Deloitte Resources, to ensure our stakeholders have…",product manager,"Global Performance Experience Product Owner, Senior Analyst,...",,"Toronto, ON",2022-07-17,3.9,
Newmode,Canada,"As our Design and UX Champion, you will lead the work to shape and implement design and user research best practices, and be actively engaged in design research…",product manager,Product Designer,,"Remote in Vancouver, BC",2022-08-04,,
Parsons,Canada,"We value our employees and want our employees to take care of their overall wellbeing, which is why we offer best-in-class benefits such as health, vision,…",product manager,Product Owner / Business Analyst,full-time,"Markham, ON",2022-07-17,3.9,
NCR,Canada,"Work with the product management team, customers and fellow product owners to build up and prioritize the feature backlog.",product manager,Senior Product Owner,full-time,"Waterloo, ON",2022-07-17,3.5,
EATON,Canada,"Work with FPC marketing and manufacturing staff to: improve products technically, monitor competitor organizations, and assist with new product designs.",product manager,"Product Specialist, Fire Pump Controllers",full-time,"Airdrie, AB",2022-07-27,3.7,
Square Enix Montreal,Canada,"The successful candidate will closely collaborate with developers, designers, and other stakeholders to ensure that the delivered product meets the needs of…",product manager,Spécialiste de Produit / Product Owner,full-time,"Montréal, QC",2022-07-17,3.9,
Intellifi Corporation,Canada,"Effectively communicate your designs to developers and other key stakeholders. Understand business, technology, and process context in which the product…",product manager,"Business Analyst, Commercial Software",full-time,"Vancouver, BC",2022-07-17,,
Bell Canada,Canada,"Collaborate with other Network Strategy, Network Development &amp; Product teams to research and establish emerging business use cases and associated benefits that…",product manager,Senior Solution Architect and Product Owner,part-time,"Toronto, ON",2022-07-17,3.7,
BMO Financial Group,Canada,"Success will require your product sense, experience building products, and ability to work with a global team of stakeholders and engineers.",product manager,"Director, Technology Product Management",full-time,Ontario,2022-07-17,3.8,
GlobalVision,Canada,Manage the validation of problems and solutions with internal and external stakeholders. Own the intake and acceptance of new Rvision products into the existing…,product manager,Hardware Product Manager / Responsable des produits hardware,full-time,"Remote in Montréal, QC",2022-07-26,3.6,
"WorkJam, Inc.",Canada,Provide insight to stakeholders on the product and market for their product areas. Own and maintain the product roadmap for their product areas.,product manager,Senior Product Owner / Propriétaire de Produit Sénior,full-time,"Hybrid remote in Montréal, QC",2022-08-13,4.7,
Ivanhoe Cambridge,Canada,You will be accountable for the quality of your product and the management of stakeholders operating at your level. Plan and assist with product upgrades;,product manager,Product Owner (ERP systems),,"Montréal, QC",2022-07-17,3.9,
Triton Digital Canada Inc.,Canada,"Make use of available data, research and market analysis to define clear and concise product requirements, including user stories, mock-ups and comprehensive…",product manager,Gestionnaire de produits // Product Owner,full-time,"Montréal, QC",2022-07-17,,
Desjardins,Canada,"  Experience as a product owner (PO) or business manager. Analyze impacts with stakeholders, and identify prerequisites and internal dependencies Ensure a cross…",product manager,Credit Risk Product Owner,full-time,"Hybrid remote in Montréal, QC",2022-08-06,3.9,
CMC Électronique,Canada,"  Pilot, flight operations or maintenance operations are key asset; Collaborates with program managers and engineers on customer-funded product development and on…",product manager,Product Manager,,"Saint-Laurent, QC",2022-07-29,3.0,
Autodesk,Canada,  Help prepare and perform XR demos for internal and external stakeholders and inspire them in communicating our vision and direction.,product manager,"Responsable de produit, XR | Technical Product Manager, XR (...",full-time,"Remote in Montréal, QC",2022-08-03,4.1,
Thomson Reuters,Canada,  5+ years of experience working as a product manager of a B2B or B2C digital platform shipping multiple products and features.,product manager,"Product Manager, API Platform",,"Temporarily Remote in Toronto, ON",2022-07-17,3.9,
LANTRONIX INC.,Canada,"  Tracking product performance to expectations, dissecting inputs and outcomes, and adjusting plans to drive product success.",product manager,"SW &amp; HW Technical Product Manager, Embedded (1132)",full-time,"Vancouver, BC",2022-08-05,,
EY,Canada,  Ability to challenge stakeholders against SAP industry best practices and propose creative solutions to address business requirements.,product manager,"SAP Functional Lead/ Manager- SAP Project Systems, Portfolio...",,"Remote in Calgary, AB",2022-07-17,4.0,
Scotiabank,Canada,  You will manage engagement with stakeholders and effectively communicate product release contents and expected product capabilities/customer journeys.,product manager,"Senior Product Owner - Business Solutions, Third Party Sales...",,"Hybrid remote in Toronto, ON",2022-07-18,3.9,
"Alexion Pharmaceuticals,Inc.",Canada,  Providing advice on regulatory issues for marketed products; attends regulatory sub team meetings for assigned products; actively collaborates with management…,product manager,Senior Manager Established Products RA Manager,,"Mississauga, ON",2022-07-17,,
Dapper Platform,Canada,  Deep experience developing and mentoring product managers. A deep prior history of experience as a product manager that demonstrates a career progression of…,product manager,Director Product (Dapper Platform),full-time,Remote,2022-07-17,,
Merck,Canada,  The National Product Strategist also establishes and maintains close liaison with the Global Brand Teams as well as scientific leaders and stakeholders in…,product manager,"Responsable national de la stratégie de produit, Oncologie (...",full-time,"Hybrid remote in Kirkland, QC",2022-07-17,4.1,
Cerence,Canada,  You’ll work on products in various stages of the product lifecycle. Previous internship experience in a product role. Study market reports and trends.,product manager,Stagiaire en gestion de produit / Product Management Intern,full-time,"Montréal, QC",2022-08-02,3.8,
