company_name,country,job_description,job_field,job_title,job_type,non_remote_location,post_date,rating,salary
Avocado Consulting,AUSTRALIA,"  Excellent software, technical and testing knowledge. $115k-$130k package + bonus. Contribute to the design of automation frameworks, ensuring usability,…",software engineer,Test Automation Engineer,undefined,Remote in Sydney NSW,2022-07-22,,115000-130000
Macquarie Group Limited,AUSTRALIA,  Our Cloud and Platform Engineers build new automation tooling as well as maintain our distributed systems and platforms using industry best practices.,software engineer,Cloud and Platform Engineers - Early Career Opportunities,permanent,Sydney NSW,2022-08-04,3.8,
Exclaim IT Pty Ltd,AUSTRALIA,"  These clients range from fintech companies, to leading insurance organizations based in Brisbane, Sydney, and Melbourne.",software engineer,Software Engineer,,Remote in Australia,2022-08-13,,
National Library of Australia,AUSTRALIA,My Forms My Emails My Tests My Interviews My Details APS6 - Applications Developer Open a new chapter in your career Work in a dynamic and collaborative…,software engineer,APS6 - Applications Developer,,Canberra ACT,2022-08-16,4.8,
Amadeus,AUSTRALIA,"  Troubleshoot issues across the entire stack: Hardware, software, application, and network. Ensure stability, availability, performance, health and maintenance…",software engineer,Application Support Engineer / Software Support Engineer,full-time,Sydney NSW,2022-08-11,4.0,
Torrens University Australia,AUSTRALIA,"  Write well designed, testable, efficient code by using best software development practices. The Web Developer is responsible for assisting in developing,…",software engineer,Web Developer,permanent,Remote in Sydney NSW,2022-07-17,3.3,
Deloitte,AUSTRALIA,"Depending on your experience, you could be assessing the current state integration landscape for our clients, preparing a roadmap to uplift their integration…",software engineer,"Integration Developer (Boomi, Mulesoft) - Melbourne",,Melbourne VIC 3000,2022-07-17,3.9,
Thryv,AUSTRALIA,"This role, based anywhere across Australia, and will be responsible for the whole lifecycle of Cloud infrastructure and services.",software engineer,Cloud Engineer,permanent,Remote,2022-07-17,3.3,
Clarivate,AUSTRALIA,Provide third-level technical support for our customers on complex issues that require the skills of a software engineer.,software engineer,Software Engineer,full-time,Sydney NSW,2022-07-22,,
Whitecoat,AUSTRALIA,Provide 2nd and 3rd level support as well as maintenance and enhancement of our applications and services. Triage incoming support requests to ensure that the…,software engineer,.NET Application support developer,,Sydney NSW,2022-07-17,,
Ftp Solutions,AUSTRALIA,You will need to be proficient at generating and validating design collaterals and implementing them through to production as well as maintaining and updating…,software engineer,Front End Developer,undefined,Remote in Perth WA,2022-08-06,,90000-110000
ResMed,AUSTRALIA,"Propose, define and implement processes and solutions for improved software development and testing. Enhance tools/applications for the current test automation…",software engineer,Graduate Software Engineer - Test Automation,graduate,Sydney NSW,2022-07-17,3.8,
Mindcloud Consultants,AUSTRALIA,"Experience with large data sets, including statistical analyses, data visualization, data mining and data cleansing/transformation and machine learning…",software engineer,JAVA Developers,full-time,Canberra ACT,2022-07-17,,
Actualise Design,AUSTRALIA,Actualise Design is looking for freelance/contract web developers experienced in Perch Runway to assist with overflow and project work.,software engineer,Back-End Web Developer,contract,Remote,2022-07-28,,
Pluralsight,AUSTRALIA,"2+ years in commercial software development. Consistently write well tested, readable, secure and accessible code.",software engineer,Software Engineer - Engagement,undefined,Remote,2022-07-21,,130
Tech mahindra,AUSTRALIA,"¿ Minimum 4+ years of experience in Telecom Domain with BSS and OSS. Experience with Amdocs Solution(CRM,OMS,AMC) is preferred.",software engineer,Software Engineer,,Sydney NSW+1 location,2022-08-09,3.7,
XPT Software Australia PTY Ltd,AUSTRALIA,"XPT works with top clients across Australia in Banking, Insurance, Telecom, Retail, Energy, Mining and Manufacturing domains.",software engineer,NodeJS developer,contract,Sydney NSW,2022-08-13,,
Cognizant,AUSTRALIA,Join Cognizant as an Informatica Developer; collaborate with our experienced Engineering teams on exciting client projects where you will be able to lead and…,software engineer,Informatica PowerCenter Developer,full-time,Sydney NSW,2022-08-10,3.9,
Balance Internet,AUSTRALIA,Requirements analysis and technical design of the software solutions in collaboration with the development team. 3+ years of experience in PHP development.,software engineer,Magento Developer,,Melbourne VIC,2022-07-17,,
Morningstar,AUSTRALIA,"Work within a cross-functional team using Agile methodology to build beautiful and functional web and back office applications, helping achieve our goal of …",software engineer,Software Engineer,full-time,Sydney NSW,2022-07-17,,
Nine,AUSTRALIA,"Providing mentorship to other back end developers, particularly in Golang space. Who is testing and quality focused.",software engineer,Backend Software Engineer (Golang/AWS/k8s) (Hybrid - Remote),full-time,Remote in North Sydney NSW 2060,2022-08-06,3.8,
Accenture,AUSTRALIA,"  This is a great role – where your work will have a meaningful impact on the client’s business and technology. Development Technologies: Spring/Spring Boot, Java…",software engineer,Junior Java Developer,permanent,Sydney NSW,2022-07-17,4.0,
Deloitte,AUSTRALIA,"  Working with backend engineers to integrate the front end with APS, CMS layouts, etc – the integration will vary based on the project.",software engineer,Front End Developer - Sydney,,Sydney NSW 2000,2022-07-17,3.9,
"Orygen, The National Centre of Excellence in Youth...",AUSTRALIA,  Strategy and Policy Melbourne Part-time. Part time (0.6 FTE) 12-month contract. Develop high quality training material to support young people.,software engineer,Learning &amp; Training Developer,undefined,Remote in Melbourne VIC,2022-08-12,,90000
Levart Distribution Systems,AUSTRALIA,"  Works together with senior software developers to plan and execute projects; Ability to pick up new software, frameworks, and APIs quickly.",software engineer,Software Engineer,graduate,Perth WA,2022-07-17,,
Patcoom,AUSTRALIA,"  Should have experience Custom PHP,(PHP/MySQL),Wordpress,joomla. 1 Year 6 Month - 3 Year 6 Month.",software engineer,PHP Developer,,Glenwood NSW 2768,2022-07-17,,
Splunk,AUSTRALIA,  Experience with sustaining and maintenance of enterprise software is highly desired. We work in Australia and around the world to deliver fixes to customer with…,software engineer,Software Engineer,full-time,Remote in Sydney NSW+4 locations,2022-07-17,,
Quorum Business Solutions,AUSTRALIA,"  Monitor, detect, and resolve software issues using bug tracking software. 3+ years’ experience in a software development and/or software engineering role.",software engineer,Software Developer,full-time,Perth WA,2022-08-09,,
The Trade Desk,AUSTRALIA,"  Our Research and Development teams work on different areas of our platform and product. Some work on ways to improve performance using low level C++, breaking…",software engineer,Senior Software Engineer ( REMOTE),full-time,Remote in Sydney NSW,2022-07-17,,
Financial Advisers Australia Group,AUSTRALIA,"  Able to understand the requirements of the development and translate into the software. The role will only suit a person with the knowledge, initiative and…",software engineer,SOFTWARE DEVELOPER,,Maroochydore QLD,2022-07-28,,
Atlassian,AUSTRALIA,"  Assuming you have eligible working rights and a sufficient time zone overlap with your team, you can choose to work remotely or return to an office as they…",software engineer,Java Software Engineer,full-time,Sydney NSW,2022-07-17,4.4,
Atlassian,AUSTRALIA,"  Assuming you have eligible working rights and a sufficient time zone overlap with your team, you can choose to work remotely or return to an office as they…",software engineer,Senior Backend Software Engineer,full-time,Sydney NSW,2022-07-17,4.4,
Capgemini,AUSTRALIA,  SAP HCM Payroll &amp; SuccessFactors Consultant Supporting the ERP solution of the client. Providing Payroll support to the business team while Adhering to Business…,software engineer,Software Engineer,,Adelaide Region SA,2022-08-05,3.8,
Unleash live,AUSTRALIA,  Github page with contributions to open source software. Github page with contributions to open source software. 2+ years experience in frontend development.,software engineer,Frontend Engineer,full-time,Remote in Sydney NSW,2022-07-21,,
Oracle,AUSTRALIA,"  Develop software prototypes as required, to test novel approaches and derive theoretical and practical insights. Job Type: Temporary Employee Hire.",software engineer,Research Intern,contract,Brisbane QLD,2022-07-29,3.8,
Accenture,AUSTRALIA,"  Experience in Cloud technologies - Azure/ AWS/ GCP. Container Technologies such as EKS, Docker, Kubernetes. Infrastructure as a code using either Terraform or…",software engineer,DevOps Engineer,full-time,Brisbane QLD+4 locations,2022-07-17,4.0,
Airwallex,AUSTRALIA,"  Day to day you will collaborate with your team mates on full stack development (including testing). Experience using Java, Kotlin, Spring / Spring Boot.",software engineer,Software Engineer,full-time,Victoria+1 location,2022-07-17,,
Opus Recruitment Solutions,AUSTRALIA,  Excellent experience in software development practices. They have recently secured their banking license and are motoring towards a release in March 2023.,software engineer,Senior Software Engineer,undefined,Hybrid remote in Sydney NSW,2022-08-11,,170000-200000
Commonwealth Bank,AUSTRALIA,"  Solid understanding of the software engineering fundamentals and best practices. As a Software Engineer, you'll be doing hands-on coding and designing and…",software engineer,Software Engineer - .NET Core,full-time,Sydney Central Business District NSW,2022-07-17,4.0,
Deloitte,AUSTRALIA,"  Working with backend engineers to integrate the front end with APS, CMS layouts, etc – the integration will vary based on the project.",software engineer,Front End Developer - Sydney,,Sydney NSW 2000,2022-07-17,3.9,
ELMO Talent Management Software,AUSTRALIA,"  As a Lead PHP Software Engineer at ELMO, you will be part of a creative, cross-functional team that plays a key role in the development process.",software engineer,Tech Lead Software Engineer,permanent,Sydney NSW,2022-08-10,,
Aristocrat Technologies Australia P/L,AUSTRALIA,"  Performing software testing, verification and validation. Troubleshooting and debugging code to identify software issues. 5+ years of experience in C++.",software engineer,Senior Software Engineer C++,full-time,Hybrid remote in North Ryde NSW 2113,2022-07-17,3.4,
Nine,AUSTRALIA,"  Providing mentorship to other back end developers, particularly in Golang space. Who is testing and quality focused.",software engineer,Backend Software Engineer (Golang/AWS/k8s) (Hybrid - Remote),full-time,Remote in North Sydney NSW 2060,2022-08-06,3.8,
Nine,AUSTRALIA,"  Nine’s assets include the 9Network, major mastheads such as The Sydney Morning Herald, The Age and The Australian Financial Review, radio stations 2GB, 3AW, 4BC…",software engineer,Mid-Level Software Engineer (hybrid working within Australia...,permanent,Hybrid remote in North Sydney NSW 2060,2022-08-12,3.8,
AWS Australia Pty Ltd,AUSTRALIA,  Create and review software design documentation and mentor junior engineers. 1+ years relevant experience in software development. A day in the life.,software engineer,"Software Engineer, Compute Platforms",full-time,Australia,2022-07-17,3.5,
Nine,AUSTRALIA,"  Collaborate with other engineers and cross-functional teams to plan, design, develop and test CTV solutions. Work across our predominantly web-based tech stack …",software engineer,Software Engineer - React JS / React Native,full-time,Hybrid remote in North Sydney NSW 2060,2022-07-30,3.8,
DXC Technology,AUSTRALIA,  Take accountability for the quality of the software they produce. The DXC Oracle practice provides dynamic technology leadership in delivering Oracle Cloud…,software engineer,PL/SQL Developer,full-time,Macquarie Park NSW,2022-07-17,3.2,
Target Australia Pty Ltd,AUSTRALIA,"  Work Type: Permanent Full Time. You will be someone who gets excited about modern engineering practices, automation, and writing clean code.",software engineer,Software Engineer,permanent,Williams Landing VIC,2022-07-17,3.8,
Deloitte,AUSTRALIA,  Integrating a new computer-aided dispatch solution to help emergency services. Producing the strategy for a new business ecosystem.,software engineer,Senior Software Engineer - Boomi - Sydney,,Sydney NSW 2000,2022-07-17,3.9,
Cognizant,AUSTRALIA,  Join Cognizant as an Informatica Developer; collaborate with our experienced Engineering teams on exciting client projects where you will be able to lead and…,software engineer,Informatica PowerCenter Developer,full-time,Sydney NSW,2022-08-10,3.9,
Capgemini,AUSTRALIA,  SAP HCM Payroll &amp; SuccessFactors Consultant Supporting the ERP solution of the client. Providing Payroll support to the business team while Adhering to Business…,software engineer,Software Engineer,,Adelaide Region SA,2022-08-05,3.8,
Culture Amp,AUSTRALIA,"  Collaborate with other engineers in your team through pair programming, writing solution designs, or giving feedback on pull requests, to build shared…",software engineer,Software Engineer (Front End),,Melbourne VIC,2022-07-30,,
Oracle,AUSTRALIA,"  Develop software prototypes as required, to test novel approaches and derive theoretical and practical insights. Job Type: Temporary Employee Hire.",software engineer,Research Intern,contract,Brisbane QLD,2022-07-29,3.8,
Binance,AUSTRALIA,"  As a member of the DevOps team, this engineer will work closely with stakeholders to cover these needs. They also will have to work closely with vendors for…",software engineer,DevOps Engineer,full-time,Remote in Sydney NSW,2022-07-17,,
Financial Advisers Australia Group,AUSTRALIA,"  Able to understand the requirements of the development and translate into the software. The role will only suit a person with the knowledge, initiative and…",software engineer,SOFTWARE DEVELOPER,,Maroochydore QLD,2022-07-28,,
NSW Government -Transport For NSW,AUSTRALIA,  Assume technical responsibility for all stages of the software development process to ensure compliance with application development standards and achievement…,software engineer,Full Stack Developer,undefined,Temporarily Remote in Macquarie Park NSW 2113,2022-08-13,4.0,120423-134872
Morningstar,AUSTRALIA,"  Work within a cross-functional team using Agile methodology to build beautiful and functional web and back office applications, helping achieve our goal of …",software engineer,Software Engineer,full-time,Sydney NSW,2022-07-17,,
Oracle,AUSTRALIA,"  You will be responsible for defining and developing software for tasks associated with the developing, designing and debugging of software applications or…",software engineer,Principal Software Engineer - Big Data,,Australia,2022-08-10,3.8,
WiseTech Global,AUSTRALIA,  Our engineers are experts in a specific product or technical area responsible for writing code and reviewing peers’ work.,software engineer,Software Engineer,full-time,Remote in Sydney NSW,2022-07-17,,
Torrens University Australia,AUSTRALIA,"  Write well designed, testable, efficient code by using best software development practices. The Web Developer is responsible for assisting in developing,…",software engineer,Web Developer,permanent,Remote in Sydney NSW,2022-07-17,3.3,
Tibra,AUSTRALIA,  Maintain and troubleshoot existing software and systems. Development teams consist of engineers dedicated to ensuring the best possible systems and responses…,software engineer,Python Developer,full-time,Remote in Sydney NSW+1 location,2022-07-17,,
Balance Internet,AUSTRALIA,  Requirements analysis and technical design of the software solutions in collaboration with the development team. 3+ years of experience in PHP development.,software engineer,Magento Developer,,Melbourne VIC,2022-07-17,,
Quorum Business Solutions,AUSTRALIA,"  Monitor, detect, and resolve software issues using bug tracking software. 3+ years’ experience in a software development and/or software engineering role.",software engineer,Software Developer,full-time,Perth WA,2022-08-09,,
XPT Software Australia PTY Ltd,AUSTRALIA,"  XPT works with top clients across Australia in Banking, Insurance, Telecom, Retail, Energy, Mining and Manufacturing domains.",software engineer,NodeJS developer,contract,Sydney NSW,2022-08-13,,
Tech mahindra,AUSTRALIA,"  ¿ Minimum 4+ years of experience in Telecom Domain with BSS and OSS. Experience with Amdocs Solution(CRM,OMS,AMC) is preferred.",software engineer,Software Engineer,,Sydney NSW+1 location,2022-08-09,3.7,
Canva,AUSTRALIA,"  Work collaboratively and consult with leads, product managers, and engineers across teams at Canva to unblock back-end works that help your group deliver…",software engineer,Backend Engineer - Teams &amp; Education,full-time,Remote in Sydney NSW,2022-07-27,3.8,
Culture Amp,AUSTRALIA,"  You have experience in building web-based software applications. Collaborate with other engineers in your team through pair programming, writing solution…",software engineer,Software Engineer,,Remote in Melbourne VIC,2022-07-28,,
Cover Genius,AUSTRALIA,  Your role as a PHP Software Engineer will be to work on the development of our XDashboard product using the latest versions of PHP (Laravel) and modern frontend…,software engineer,PHP Software Engineer,full-time,Sydney NSW,2022-07-17,,
Macquarie Group Limited,AUSTRALIA,  You will have an agile mindset and a background in software engineering across a range of technologies. Join our Digital Platforms team and be part of a full…,software engineer,Cloud Engineer,permanent,Remote in Sydney NSW,2022-07-17,3.8,
Levart Distribution Systems,AUSTRALIA,"  Works together with senior software developers to plan and execute projects; Ability to pick up new software, frameworks, and APIs quickly.",software engineer,Software Engineer,graduate,Perth WA,2022-07-17,,
Queensland Health,AUSTRALIA,"  Undertake complex systems analysis, design, programming and testing in relation to the detailed development, maintenance and enhancement of in-house developed…",software engineer,Senior Software Developer,,Sunshine Coast QLD,2022-08-11,3.7,
Defence Services,AUSTRALIA,  Engineering investigations relating to software and network systems. Minimum 5 years of Defence software and network engineering experience.,software engineer,Software/Network Engineer - Brisbane,permanent,Remote in Newstead QLD,2022-07-17,4.0,
Verse Group,AUSTRALIA,  This role will suit a soon to be graduated developer to initially work part-time to then progress into a full-time role. Net would be highly desirable.,software engineer,GRADUATE/JUNIOR DEVELOPER,part-time,Perth WA+1 location,2022-07-17,,
Kmart,AUSTRALIA,"  This team looks after the public facing Kmart Website and new Mobile App, which millions of customers engage with. Experience in API Testing using POSTMAN.",software engineer,Software Engineer,,Mulgrave VIC,2022-07-17,3.8,
Bold Business,AUSTRALIA,"  For web back-end engineers - experience in Python, relational databases, cloud platforms. For web front-end engineers - experience in React JavaScript…",software engineer,Senior Software Engineer (100% Remote),full-time,Remote in Melbourne VIC,2022-07-17,,
AuntBetty,AUSTRALIA,"  Designing solution architecture and software. Strong understanding of common data structures, software design patterns and their application.",software engineer,Senior Full Stack Software Engineer,full-time,Remote in Canberra ACT,2022-07-17,3.5,
Fair Work Ombudsman,AUSTRALIA,  Assist in activities to manage risks associated with systems and software life cycle working practices. Undertake software development and assist in solution…,software engineer,.Net Developer (multiple roles),,Australia,2022-08-02,,
DNA Client,AUSTRALIA,"  Our innovative systems include highly efficient and large-scale platforms built on Java/Spring Boot/Hibernate, running on Docker containers and deployed in…",software engineer,Software Engineer,full-time,Melbourne City Centre VIC,2022-07-17,,
Accenture,AUSTRALIA,  People who want to fast-track their future and work on amazing projects with global impact. Conceptualizing and formulating apps that are suitable for use on…,software engineer,Android Developer,full-time,Brisbane QLD+4 locations,2022-07-17,4.0,
Australia Post,AUSTRALIA,  Work type: Permanent Full Time. The purpose of Product &amp; Innovation is to create products that customers love and trust whilst delivering a sustainable future…,software engineer,Senior Software Engineer,permanent,Melbourne VIC,2022-07-17,3.8,
Cognizant,AUSTRALIA,  Provide thought leadership in programming and software development. A Front-End Engineer in the Digital Experience Platforms Community will work closely with…,software engineer,Front End Engineer,undefined,Melbourne VIC+1 location,2022-07-22,3.9,86000-96000
MK Infotech,AUSTRALIA,"Job Title : Pega Developer (CSSA) Job Location : Australia (sydney,melbourne) Job Description : Pega CSSA roles in Sydney or Melbourne. • Ability to identify…",software engineer,Pega Developer (CSSA),,Sydney NSW,2022-07-17,,
Aristocrat Technologies Australia P/L,AUSTRALIA,Job Posting Title Senior Software Engineer C++ Summary The GDK team is responsible for devising innovative solutions to support the imaginations of the…,software engineer,Senior Software Engineer C++,full-time,Hybrid remote in North Ryde NSW 2113,2022-07-17,3.4,
Amazon Support Services PtyLtd,AUSTRALIA,"A bachelor's degree or equivalent in computer science, computer engineering or related technical discipline. 5+ years of industry experience. Current…",software engineer,Senior Software Development Engineer,full-time,Brisbane QLD,2022-07-17,3.5,
Corin Group,AUSTRALIA,Corin is seeking talented Software Engineering Team Lead to join our Technology Innovation team and work on software that help improve patients’ quality of…,software engineer,Software Development Lead,full-time,Remote in Pymble NSW 2073,2022-08-16,,
Cognizant,AUSTRALIA,"About Cognizant Cognizant (NASDAQ: CTSH) is a leading provider of information technology, consulting, and business process services, dedicated to helping the…",software engineer,Front End Engineer,undefined,Melbourne VIC+1 location,2022-07-22,3.9,86000-96000
Michael Page,AUSTRALIA,Hybrid work model (home and office based) Globally recognised retail and manufacturing organisation About Our Client This leading international innovator and…,software engineer,"Software Engineer - C#, SQL Server",undefined,Remote in Brisbane QLD,2022-07-17,3.5,110000-120000
Opus Recruitment Solutions,AUSTRALIA,"Fully Remote Start Up Artificial Intelligence An innovative software platform that combines psychology and technology for people who have suffered injuries,…",software engineer,Mid Level Full Stack JavaScript Developer,undefined,Remote in Sydney NSW,2022-08-01,,90000-120000
Blockstars Technology,AUSTRALIA,Responsibilities: Seeing through a project from conception to finished product Developing frontend/backend architecture with security in mind Designing and…,software engineer,Full Stack Developers,undefined,Robina QLD,2022-07-17,,120000
Bankwest,AUSTRALIA,Software Engineer - .NET B ased in Perth CBD but open to remote work from anywhere in Australia! Opportunity to work on projects that matter to our…,software engineer,Software Engineer - .NET,full-time,Remote in Perth WA,2022-07-17,3.5,
Amazon Corporate Services Pty,AUSTRALIA,"Passionate about learning new programming languages, frameworks, and technologies. Job summary Are you passionate about test driven development (TDD)? Join…",software engineer,"Software Development Engineer, Rollcage",full-time,Sydney NSW,2022-07-28,3.5,
NSW Government -Transport For NSW,AUSTRALIA,"Organisation/Entity: Transport For NSW Job Category: Manufacturing, Transport &amp; Logistics Job Location: Macquarie Park, NSW, AU, 2113 Job Ref No: 74114…",software engineer,Full Stack Developer,undefined,Temporarily Remote in Macquarie Park NSW 2113,2022-08-13,4.0,120423-134872
Procreate,AUSTRALIA,"The hidden gem of Tasmania Nestled in picturesque Hobart, Procreate is an industry-leading creative product company competing on the World stage. We are the…",software engineer,Frontend Developer,full-time,Hobart TAS,2022-07-21,,
"WorkJam, Inc.",AUSTRALIA,*WorkJam*’s mission? To provide the best Digital Workplace for frontline and hourly workers. Through our industry-leading Digital Frontline Workplace platform…,software engineer,Software Architect,full-time,Remote in Melbourne VIC,2022-08-13,,
Amazon Support Services PtyLtd,AUSTRALIA,"3+ years of professional experience in a software environment, developing high quality code. Proficient in at least one or more object-oriented programming…",software engineer,Software Development Engineer - Incident Manager,full-time,Sydney NSW,2022-07-17,3.5,
Cover Genius,AUSTRALIA,The Company Cover Genius is a Series C global Insurtech with a vision to protect all the customers of the world’s largest digital companies. Partners such as…,software engineer,PHP Software Engineer,full-time,Sydney NSW,2022-07-17,,
