company_name,country,job_description,job_field,job_title,job_type,non_remote_location,post_date,rating,salary
Telstra,AUSTRALIA,End to end software integration. Highly regarded: Java certifications in software development or database development. Proven experience on HTML 5 and CSS/SCSS.,software engineer,Software Engineer,undefined,Australia+1 location,2022-08-16,4.0,87600-131400
Google,AUSTRALIA,"1 year of software development experience. Google's software engineers develop the next-generation technologies that change how billions of users connect,…",software engineer,"Software Engineer, Early Career",full-time,Sydney NSW,2022-07-17,4.3,
Macquarie Group Limited,AUSTRALIA,Learn from the best engineers in Australia and work on market leading products. You will have an Agile mindset and keen interest in software engineering across…,software engineer,Software Engineer,,Remote in Sydney NSW,2022-08-10,3.8,
Slater and Gordon,AUSTRALIA,"Delivery of software solutions, including pipelines, testing and deployments. What are we looking for? Permanent opportunity | Hybrid | Full-time | Part-time |…",software engineer,Software Engineer,permanent,Remote in Melbourne VIC,2022-08-05,2.9,
Service Victoria,AUSTRALIA,"Job type: Full time / 12 Months. Salary: $114,830 - $125,735. An exciting opportunity is available for a Software Engineer with Service Victoria.",software engineer,Software Engineer - REACT (VPSG5.2),undefined,Temporarily Remote in Victoria,2022-08-06,,114830-125735
Australia Post,AUSTRALIA,"An understanding of modern software development and design best practices. Exposure to Java software development, including Spring/MVC.",software engineer,Associate Software Engineer - Lodgment,undefined,Hybrid remote in Melbourne VIC,2022-08-10,3.8,99000-103000
Deakin University,AUSTRALIA,"Producing design specifications and test plans for software components. Experience working in a structured, collaborative development environment using…",software engineer,Software Engineer,undefined,Melbourne VIC,2022-08-16,4.2,82494-89087
ResMed,AUSTRALIA,"Software design and architecture are captured in specifications which are created in consultation with internal stakeholders, that enables the future software…",software engineer,"Graduate Software Engineer (C#, .NET)",graduate,Sydney NSW,2022-07-17,3.8,
AroFlo Innovations,AUSTRALIA,Contribute to ongoing software improvement by problem-solving issues and adding new features using best practice. Why YOU should join Team AroFlo?,software engineer,Junior/Graduate Software Developer,undefined,Ringwood VIC,2022-07-27,,60000-65000
Selligent Marketing Cloud,AUSTRALIA,This role is perfect for someone looking to help build software that hundreds of thousands of people genuinely love to use. So what is in it for you?,software engineer,Software Engineer - Graduate,graduate,Sydney NSW,2022-07-17,,
FinXL,AUSTRALIA,Open to any Tech stack experience - Just need someone with applied skills in software development! Salary: AU$125000 - AU$160000 per annum + Super.,software engineer,Software Engineer - Permanent - Fully remote,undefined,Melbourne City Centre VIC,2022-07-19,,125000-160000
Honeywell,AUSTRALIA,Perform software engineering tasks as part of a team to develop innovations for Honeywell’s market leading mission critical software solutions.,software engineer,Graduate Software Engineer,graduate,North Ryde NSW 2113,2022-07-17,3.7,
ResMed,AUSTRALIA,"Embedded software development including application, device interface, real-time control and graphical user interface functionality. Let's talk about you:",software engineer,Graduate Software Engineer,permanent,Sydney NSW,2022-07-17,3.8,
M Three Corporate Consulting,AUSTRALIA,"You’ve worked hard, put the hours in at Uni, so now’s the time to kick-start your tech career with mthree. We recruit year round and have start dates throughout…",software engineer,2022 Graduate Program: Software Development,graduate,Remote in Sydney NSW,2022-07-28,,
Apple,AUSTRALIA,Apple’s Partner Solution &amp; Technology group is looking for a driven software development professional based in Sydney to champion innovation and leverage deep…,software engineer,Software Engineer,,Sydney NSW,2022-08-07,4.1,
TPG Telecom,AUSTRALIA,"  Essentially, you will be working as part of a team of developers that focuses on supporting customer portals, ordering platforms and as well as back-end systems…",software engineer,Junior Developer,permanent,Remote in North Sydney NSW,2022-07-30,3.3,
Retriever Communications,AUSTRALIA,"  Server, mobile, integration and front-end development. Australian citizen or PR currently residing in Sydney. Degree in Computer Science or Engineering.",software engineer,Graduate Junior Software Engineer Java Developer,graduate,Chatswood NSW 2067,2022-07-26,,
Australian National University,AUSTRALIA,"  The Software Developer is part of a small software development team based in Canberra which is responsible for the development, delivery and maintenance of web…",software engineer,Software Developer,undefined,Canberra ACT,2022-08-13,4.2,103636-110821
FinXL,AUSTRALIA,"  Seeking React Developers - multiple positions (full-stack, front-end &amp; back-end). Six Month Contracts and Permanent Positions available - YOUR CHOICE.",software engineer,Junior React Developer (M17),contract,Remote in Melbourne VIC,2022-08-09,,
Rome2rio,AUSTRALIA,"  As a Front End Engineer, you’ll work within a cross-functional team to give users the best experience while planning and booking their travel.",software engineer,Junior Front End Engineer,full-time,Melbourne VIC,2022-07-26,,
Aristocrat Technologies Australia P/L,AUSTRALIA,  Deliver software components to enable gaming products. Build and design software following standard design patterns. Math’s and 3D graphics.,software engineer,Graduate Software Engineer,graduate,Hybrid remote in North Ryde NSW 2113,2022-07-23,3.4,
CSG,AUSTRALIA,  4+ years software development experience with modern Java SE. We are looking for talented java developers to join our product engineering team building our next…,software engineer,Graduate Software Engineer,graduate,Melbourne VIC,2022-07-17,,
Airwallex,AUSTRALIA,"  You will be responsible for partnering with Airwallex’s engineering teams to drive a high performance, data driven culture.",software engineer,Graduate Software Engineer,graduate,Victoria,2022-07-17,,
AWS Australia Pty Ltd,AUSTRALIA,  Experience developing software on Amazon Web Services (AWS) platforms. Experience developing in a Linux environment.,software engineer,2022 Software Development Graduate - ASAP Start,graduate,Sydney NSW,2022-07-17,3.5,
IGT Australia Pty Ltd,AUSTRALIA,"  Adheres to software engineering standards. A passion for developing high-quality software. In this role, the successful candidate will be responsible for…",software engineer,Junior Software Engineer,full-time,Remote in Notting Hill VIC,2022-07-17,,
ResMed,AUSTRALIA,  1+ year of software engineering experience mostly working with front-end technologies. Expanding on the existing frameworks and services to implement new…,software engineer,"Graduate,Software (App) Engineering",graduate,Remote in Sydney NSW,2022-08-12,3.8,
ResMed,AUSTRALIA,"  Software design and architecture are captured in specifications which are created in consultation with internal stakeholders, that enables the future software…",software engineer,"Junior Software Engineer (C#, .NET)",full-time,Sydney NSW,2022-07-17,3.8,
Luxury Escapes,AUSTRALIA,"  Our cross-functional teams include Product Managers, Designers, and Engineers focused on delivering solutions and solving problems rather than simply completing…",software engineer,Software Engineer,permanent,Sydney NSW,2022-08-02,4.7,
The Trade Desk,AUSTRALIA,"  We develop our client facing products utilising .Net/. Net Core, Javascript (React), gRPC, REST API’s, Docker containers and Kubernetes.",software engineer,Junior/Mid - Software engineer,full-time,Sydney NSW,2022-07-17,,
Macquarie Group Limited,AUSTRALIA,  Our Tech Select Program puts you in the driver’s seat of your career and gives you the opportunity to explore new areas of technology while building on your…,software engineer,Software Engineers - Early Career Opportunities,permanent,Sydney NSW,2022-08-04,3.8,
Telstra,AUSTRALIA,"  Ability to support and monitor APIs / software that is deployed to production. You will be responsible for the design, development, configuration, customization…",software engineer,Backend Engineer,permanent,Remote in Australia,2022-08-12,4.0,
Helecom System,AUSTRALIA,  Enhance / maintain existing application software; Develop new application software according to requirements specified; Provide technical support to clients.,software engineer,Software Developers,part-time,Sydney NSW,2022-07-17,,
Axiom Technologies,AUSTRALIA,  Integrating software components into functional software systems and developing software verification plans and quality assurance procedures.,software engineer,Software Engineer,undefined,Sydney NSW,2022-07-17,4.0,90000-130000
ELMO Talent Management Software,AUSTRALIA,"  As part of a Scrum team, you will contribute to all the phases of the development lifecycle, by troubleshooting, testing and maintaining our software solutions.",software engineer,Software Engineer,permanent,Hybrid remote in Sydney NSW,2022-08-10,,
Amadeus,AUSTRALIA,  Write operational and software documentation necessary for the application from a technical standpoint. Conduct unit and package tests of the software to ensure…,software engineer,Software Engineer,full-time,Sydney NSW,2022-08-16,4.0,
Piptle Wealth Management,AUSTRALIA,"  Helpdevelop software according to the plans/tasks allocated. Assistin the handover/launch of software to clients. In-house, full-time position.",software engineer,Web Application Developer,undefined,Beenleigh QLD 4207,2022-07-17,,65000
Schneider Electric,AUSTRALIA,  Tertiary qualification in engineering or computer science complemented by basic understating of software and automation hardware communications / setup.,software engineer,Software Support Engineer,full-time,Sydney NSW,2022-08-16,3.9,
Robert Half,AUSTRALIA,  Participate in retrospectives and software guild meetings. Building software that's maintainable for the long term. Write maintainable and clean code.,software engineer,Software Engineer | Renewables | Remote,undefined,Remote in Melbourne VIC,2022-07-17,3.9,140000
Deloitte,AUSTRALIA,  Flexible work arrangements - work in a way that suits you best. Support and coaching to progress your career. Solid engineering experience using Python v3.7+ .,software engineer,Software Engineer - Python - Sydney,,Sydney NSW 2000,2022-07-29,3.9,
XPT Software Australia PTY Ltd,AUSTRALIA,"  XPT works with top clients across Australia in Banking, Insurance, Telecom, Retail, Energy, Mining and Manufacturing domains.",software engineer,Back End Developer,contract,Melbourne VIC,2022-08-13,,
Amazon Support Services PtyLtd,AUSTRALIA,"  Experience in at least one professional software language. Bachelor's degree/diploma in computer science, computer engineering, related technical discipline or…",software engineer,Software Developer Engineer,full-time,Brisbane QLD,2022-08-12,3.5,
Apple,AUSTRALIA,"  Help define, build and improve critical and fundamental system features on which all Apple media apps rely upon for features like networking, server…",software engineer,Software Engineer - Media Services Infrastructure,,Sydney NSW,2022-08-07,4.1,
Atlassian,AUSTRALIA,"  Using your programming expertise and deep understanding of modern web architectures and distributed systems, you will help future-proof our established products…",software engineer,Frontend Software Engineer,full-time,Sydney NSW,2022-07-17,4.4,
Honeywell,AUSTRALIA,  0-2 years software engineering experience. Provide responsive customer support for software solutions developed.,software engineer,Software Engineer,,North Ryde NSW 2113,2022-07-17,3.7,
Daronet Australia,AUSTRALIA,  You will be working in the most innovative and expert stage with people that understand the internet know how business and have over 11 years of experience.,software engineer,Web Developer,,Port Melbourne VIC 3207,2022-08-16,,
Kent Removals and Storage,AUSTRALIA,"  Graduate-level proficiency in software development and scripting platforms and languages including, but not limited to, Microsoft . What we hope you have:",software engineer,Graduate Developer,graduate,Australia,2022-08-05,4.0,
EY,AUSTRALIA,"  At EY, you’ll have the chance to build a career as unique as you are, with the global scale, support, inclusive culture and technology to become the best…",software engineer,Front-End Developer,undefined,Sydney NSW 2000,2022-07-29,4.0,80000
Kogan,AUSTRALIA,"  Assisting our team of engineers and developers with QA on initiatives. We are pragmatic, intelligent, fast paced and driven by seeing our software shipped to…",software engineer,Software Engineer - Operations,full-time,South Melbourne VIC,2022-08-16,,
Penten,AUSTRALIA,"  You will be regularly working with systems engineers, network engineers, hardware engineers, security assessors, and document writers.",software engineer,Software Engineer iOS,,Canberra ACT,2022-08-16,,
Valiant,AUSTRALIA,"  Valiant is an innovative, award-winning platform connecting Australian business owners with the finance they need to kick goals. You’ll love working here if….",software engineer,Java Developer,undefined,Sydney NSW 2000,2022-08-10,,90000-120000
Smart Guide,AUSTRALIA,"  Applicants must be comfortable with learning and adapting to new technical environments, software tools and architectures. Want to work with us?",software engineer,Software Developer / Engineer,,Port Melbourne VIC,2022-08-09,,
FinXL,AUSTRALIA,  Salary: AU$130000 - AU$170001 per annum. This client is building apps that are utilised across the hospitality sector they are a small team making a large…,software engineer,Javascript Developer,undefined,Melbourne VIC,2022-08-06,,130000-170001
Tibra,AUSTRALIA,"  Tibra is a successful, global proprietary trading firm deploying a diverse range of strategies across multiple asset classes on the world’s most competitive…",software engineer,C++ Software Developer,full-time,Remote in Austinmer NSW,2022-07-26,,
Panthera Finance,AUSTRALIA,  One of the most exciting aspects of our growth is the ongoing development of our internally built collections software and online portals to allow customers to…,software engineer,Junior React Developer,undefined,Remote in Brisbane QLD,2022-07-30,2.8,60000-80000
Verifone,AUSTRALIA,  Verifone is a global organisation and our internship program will get you working with some of the brightest minds in the payments industry and smart engineers…,software engineer,Graduate Software Engineer,graduate,Australia,2022-07-17,3.4,
FinXL,AUSTRALIA,"  Seeking React Developers - multiple positions (full-stack, front-end &amp; back-end). Seven Month Contracts and Permanent Positions available - YOUR CHOICE.",software engineer,React Developers,contract,Remote in Melbourne City Centre VIC+1 location,2022-08-05,,
Extag Pty Ltd,AUSTRALIA,  We are looking for a full-time software engineer with around 2-5 years experience working professionally. We are a software company building industry specific…,software engineer,Software Engineer,undefined,Remote in Perth WA,2022-08-13,,80000
Macquarie University,AUSTRALIA,  You will possess substantial knowledge and expertise in all aspects of the software development lifecycle and have delivered a range of software projects as a…,software engineer,Research Software Engineer,undefined,North Ryde NSW,2022-08-09,4.3,97783-106018
Fitbit,AUSTRALIA,"  Google's software engineers develop the next-generation technologies that change how billions of users connect, explore, and interact with information and one…",software engineer,"Software Engineer, Fitbit",full-time,Sydney NSW,2022-07-17,,
Bankwest,AUSTRALIA,  Your team is accountable for delivering business value via one or more software applications or platforms throughout their life cycle.,software engineer,Software Engineer . Net - Fixed Term,full-time,Perth WA,2022-08-03,3.5,
Southern Cross Austereo,AUSTRALIA,"  Hands-on software troubleshooting experience. Flexible working environment (we offer a range of flexible working options, not just working from home).",software engineer,Junior Developer,permanent,Remote in Townsville QLD,2022-08-13,4.3,
Sandstone Technology,AUSTRALIA,"  Understanding of software development lifecycle. From digital banking and digital onboarding to origination and AI-based data analysis, with cloud-based or on…",software engineer,Junior DevOps Engineer,,Remote in North Sydney NSW,2022-07-30,3.6,
Elida,AUSTRALIA,"  You will have a strong focus on delivering quality through effective design, and experience using modern software practices such as, BDD, TDD, process…",software engineer,Front End React Developer-Sydney HQ Digital Analytics Compan...,undefined,Remote in Sydney Central Business District NSW,2022-07-17,,110000-130000
Pearson,AUSTRALIA,  Our highlight is our national assessment services is Pearson’s delivery of services for the NAPLAN program in various states and territories.,software engineer,Software Developer,full-time,Hybrid remote in Australia,2022-07-27,3.7,
Orion Health,AUSTRALIA,"  Experience: You will have a minimum of 3 years experience as a software developer, proven experience in front end development using React, Typescript, ES6.",software engineer,Intermediate Software Engineer,,Canberra ACT,2022-07-29,,
TabCorp Holdings,AUSTRALIA,  18 Aug 2022 E. Australia Standard Time. The Engineering &amp; Automation team connects as a crucial interface across Technology teams to deliver technology…,software engineer,Junior DevOps Engineer,permanent,Sydney NSW,2022-08-12,3.8,
Hudson Australia,AUSTRALIA,"  Develop innovative and forward-thinking software solutions using . Investigate and problem-solve production incidents, assess and manage associated risks, and…",software engineer,.Net Software Developer,undefined,Canberra ACT,2022-07-17,,100-125
PLEXCO,AUSTRALIA,"We have varied roles available suitable for freelance or contract work. ​There are many diverse development roles we require at any point in time, and we…",software engineer,Web Developers,contract,Adelaide Region SA,2022-07-17,,
University of South Australia,AUSTRALIA,"  Two (2) full-time 3 year fixed term contracts. Commencement Salary: $101,784 per annum (plus 17% superannuation). Employee assistance and development programs.",software engineer,Academic Developer (Level B),undefined,South Australia,2022-08-11,4.3,101784
Hudson Australia,AUSTRALIA,"  Experience developing and iterating software in agile multi-disciplinary teams. Design and improve software that meets the users' needs, prioritised by the team…",software engineer,JavaScript Software Developer,undefined,Canberra ACT,2022-07-17,,100-130
Procreate,AUSTRALIA,"  This role will have a strong focus on identifying and fixing bugs, working closely with the Product Development and Product Care team.",software engineer,Software Engineer (Bug Fixing),full-time,Hobart TAS,2022-07-21,,
Accenture,AUSTRALIA,  Experience across software engineering disciplines and Microsoft. People who want to fast-track their future and work on amazing projects with global impact.,software engineer,Net Developer,full-time,Brisbane QLD+4 locations,2022-07-17,4.0,
Heritage Bank,AUSTRALIA,"  Undertake complex, high-risk software development in accordance with Software Development Lifecycle and Application Security expectations, using appropriate…",software engineer,Expression of Interest - Software Developers,,Remote in Brisbane QLD,2022-08-06,3.5,
Mission Solutions,AUSTRALIA,"  Working within a talented and motivated multidisciplinary team, with a focus on building high quality software solutions and products.",software engineer,Front end Developer - Sydney,permanent,Sydney NSW,2022-08-11,4.0,
Planit Testing,AUSTRALIA,  Planit will be hosting a weeklong in-depth SDET Coding Bootcamp program that will equip and elevate you with all the skills that you need to kick of your career…,software engineer,Entry Level Software Development Engineer in Test Opportunit...,full-time,Brisbane QLD,2022-07-17,,
Capgemini Australia,AUSTRALIA,  Due to continued growth within Capgemini's Insights &amp; Data practice we intend to recruit a Analyst Programmer with relevant consulting and communication skills.,software engineer,Software Engineer (Data Engineer),full-time,Canberra ACT,2022-07-27,3.8,
Amazon Corporate Services Pty,AUSTRALIA,  Experience in building scalable production software. 4+ years of non-internship professional software development experience.,software engineer,Software Development Engineer,full-time,Sydney NSW+1 location,2022-08-09,3.5,
Leidos,AUSTRALIA,"  Willingness to document and improve software development processes. A baseline understanding of a broad range of skills including software, systems and…",software engineer,Software Engineer – Entry Level,full-time,Remote in Scoresby VIC 3179,2022-08-05,,
CoreLogic,AUSTRALIA,"  Develop high-quality software design and architecture. Identify, prioritize and execute tasks in the software development life cycle.",software engineer,Software Engineer,full-time,Fortitude Valley QLD,2022-07-17,3.3,
Pearson,AUSTRALIA,  Our highlight is our national assessment services is Pearson’s delivery of services for the NAPLAN program in various states and territories.,software engineer,SQL Developer - Data Management,full-time,Hybrid remote in Australia,2022-08-16,3.7,
EY,AUSTRALIA,"  At least 3-5 years of experience as a Front-End Developer. Expertise with HTML, CSS, and JavaScript. JS, Angular, and/or Vue.JS.",software engineer,Frontend Developer - Digital &amp; Emerging Tech,undefined,Sydney NSW 2000,2022-08-05,4.0,80000
Thought Studio,AUSTRALIA,"  Design and develop software with a high degree of quality, in a timely manner. Develop user solutions that are intuitive, easy-to-use, and not cluttered.",software engineer,C# .NET Developer,,Peakhurst NSW 2210,2022-07-17,,
"JPMorgan Chase Bank, N.A.",AUSTRALIA,"  This role requires a wide variety of strengths and capabilities, including: Proficiency in programming languages like Java.",software engineer,Software Engineer - Associate,full-time,Sydney NSW,2022-07-31,3.8,
BOEING,AUSTRALIA,  Assisting in the specification and maintenance of software requirements. As a graduate engineer on the BDA graduate program you will have:,software engineer,Graduate Software Engineer,permanent,Williamtown NSW,2022-08-03,3.9,
Actualise Design,AUSTRALIA,  Actualise Design is looking for freelance/contract front-end web developers specialised in custom coding web pages from scratch for overflow and project work.,software engineer,Front-End Web Developer,contract,Remote,2022-07-28,,
Bpd Zenith,AUSTRALIA,  Installing and supporting Maximo and its add-on components. Identifying technology limitations and upgrading Maximo to the latest versions.,software engineer,Software Engineer,undefined,Remote in Melbourne VIC+1 location,2022-08-13,,85000-95000
Epoch Capital,AUSTRALIA,  2+ years in Python software development on Linux &amp; Windows in a trading environment. It runs on both Linux and Windows systems.,software engineer,Software Engineer (Python),,Sydney NSW,2022-07-17,,
Shippit,AUSTRALIA,"  As part of the engineering team, you will have a direct impact on our customers. Our cross-functional teams own new features, maintenance and monitoring in…",software engineer,Frontend Software Engineer - (Hybrid Role - Office/WFH),full-time,Remote in Sydney NSW,2022-07-17,,
Deloitte,AUSTRALIA,"  Minimum 1-2 years’ experience across software engineering disciplines and Microsoft. Working within a team including Deloitte technical leaders, architects and…",software engineer,.NET Developer - Melbourne,,Melbourne VIC 3000,2022-07-28,3.9,
Noggin,AUSTRALIA,  You have at least three to five years' experience in commercial software development focusing on front-end engineering.,software engineer,Software Engineer (Frontend),full-time,Remote in Sydney NSW,2022-07-17,,
Oracle,AUSTRALIA,"Software Mobile Engineer - Android/iOS-22000AQD Applicants are required to read, write, and speak the following languages: English Preferred Qualifications…",software engineer,Software Mobile Engineer - Android/iOS,,Australia,2022-08-15,3.8,
Minutes To Seconds,AUSTRALIA,"Job Description This is a remote position. At minutes to Seconds, we match people having great skills with tailor fitted jobs to achieve well-deserved…",software engineer,.NET Developer (Remote-Australia),full-time,Remote,2022-07-17,,
Trellian,AUSTRALIA,Melbourne | Australia Trellian.com has an exciting full-time role for an experienced PHP web developer. The role will involve working on various custom…,software engineer,PHP Web Developer,full-time,Melbourne VIC,2022-07-22,,
Thales,AUSTRALIA,"We’re inventing the future, right here, right now, at Thales. We design the critical security solutions of tomorrow by combining the curiosity to explore, the…",software engineer,Graduate Systems &amp; Software Engineer,part-time,Rydalmere NSW,2022-07-29,3.9,
Volvo Group,AUSTRALIA,"Australia Position Description With shared innovations and proven technology from the entire Volvo Group, we move towards an electric powered future by…",software engineer,Software Engineer - Dealer Support,undefined,Hybrid remote in Coomera QLD,2022-08-05,4.2,70000-100000
