company_name,country,job_description,job_field,job_title,job_type,non_remote_location,post_date,rating,salary
DWS,AUSTRALIA,  Australian Citizenship ESSENTIAL - current baseline or NV1 a bonus. DWS is seeking an experienced and capable Microsoft BI Developer to join our Canberra office…,software engineer,Microsoft BI Developer,undefined,Remote in Canberra ACT,2022-08-10,3.7,150000
ResMed,AUSTRALIA,"  Propose, define and implement processes and solutions for improved software development and testing. Enhance tools/applications for the current test automation…",software engineer,Software Engineer - Test Automation,full-time,Sydney NSW,2022-07-17,3.8,
ResMed,AUSTRALIA,"  2+ years of professional software development experience. You’ll be immersed in a dynamic high-growth environment and empowered to excel, take informed risks,…",software engineer,Software Developer Engineer,full-time,Sydney NSW,2022-07-30,3.8,
FIS Global,AUSTRALIA,"  Participating in software design meetings to determine technical requirements. Designing, programming, debugging and modifying software enhancements.",software engineer,Software Engineer (Java),full-time,Melbourne VIC 3000,2022-07-17,3.4,
AKQA,AUSTRALIA,"  Implement high quality software solutions. Working closely with Experience Designers and Back End Engineering, Front End Engineers transform visual design into…",software engineer,Front End Developer - Expressions of Interest,contract,Sydney NSW+1 location,2022-07-17,3.4,
Cognizant,AUSTRALIA,"  As a Java Developer in the Enterprise Engineering Platforms Community, you will work closely with our client and other engineers to develop intuitive digital…",software engineer,Java Developer,full-time,Sydney NSW,2022-07-29,3.9,
DNA Client,AUSTRALIA,"  As a Web Developer you will be developing and assisting in the implementation of Web based applications (WordPress) primarily with PHP, MYSQL, JS and AJAX.",software engineer,Mid Level PHP Web Developer,full-time,Brisbane QLD,2022-07-17,,
Selligent Marketing Cloud,AUSTRALIA,"  5+ years experience as a software developer. Software Engineers are an integral part of our autonomous, multi-disciplinary product teams, working closely with…",software engineer,Fullstack Software Engineer,full-time,Sydney NSW,2022-07-17,,
EVOS Technology,AUSTRALIA,  Experience with agile software development processes and best practice. The Salesforce Developer’s role is to work with division heads and product SME to…,software engineer,Salesforce Developer,,Brisbane QLD,2022-07-17,,
Macquarie Group Limited,AUSTRALIA,"  As a CounterParty DevOps Engineer, you will be part of the Client Lifecycle Management (CLM) agile team, helping to build the CLM of tomorrow, through…",software engineer,Counterparty DevOps Engineer - Sydney,permanent,Sydney NSW,2022-08-09,3.8,
Susquehanna Pacific Pty Ltd,AUSTRALIA,  Strong interpersonal and communication skills for interacting with traders and other software development teams.,software engineer,C# Developer,permanent,Sydney NSW,2022-08-04,,
Accenture,AUSTRALIA,  Investigate problems in software as a result of testing and. Work with QA analysts and software developers to find solutions.,software engineer,Senior Automation Engineer,full-time,Sydney NSW+1 location,2022-07-17,4.0,
Canva,AUSTRALIA,  This role will be an exciting opportunity for an experienced engineer who knows how to both communicate well and design good components.,software engineer,Staff Frontend Software Engineer - Design Systems,full-time,Remote in Sydney NSW,2022-07-17,3.8,
Mecca Brands Pty Ltd,AUSTRALIA,  NET developers to work with the latest technologies and strategies on highly varied and interesting projects in areas of the business from supply chain through…,software engineer,.NET Developer,full-time,Victoria,2022-07-17,4.1,
Civica,AUSTRALIA,  Experience with Informix 4GL and SQL server. Develop and maintain code to a high standard. Write high performing code and database queries.,software engineer,Software Engineer - 4GL,contract,Sydney NSW+2 locations,2022-07-17,3.6,
DNA Client,AUSTRALIA,"  You will be responsible for implementing high quality interfaces for our client’s customers, businesses, and organisations across Australia.",software engineer,Front-End Software Engineer,full-time,Melbourne City Centre VIC,2022-07-17,,
Opus Recruitment Solutions,AUSTRALIA,  My client is one of the Big 4 Banks and is looking for a Mid-Level Software Engineer with Java Microservices experience to join their team.,software engineer,Software Engineer - Java Mid-Level,contract,Melbourne VIC,2022-07-29,,
Firesoft People,AUSTRALIA,  Collaborate with software delivery and support activities. Liaise with our software engineering team and collaborate with Product Management to ensure business…,software engineer,C# Developer,undefined,Pymble NSW,2022-08-10,,100000-120000
VMware,AUSTRALIA,"  Built and maintained production code as a software engineer using automated testing, Continuous Integration &amp; Delivery for at least 3 years.",software engineer,"Senior Software Engineer Brisbane, Queensland",part-time,Brisbane QLD+2 locations,2022-07-17,4.1,
Bega Cheese,AUSTRALIA,"  The Data Warehouse Developer is a crucial role within the Bega Dairy and Drinks function,. And is responsible for supporting the broader BDD team with reporting…",software engineer,Data Warehouse Developer,full-time,Docklands VIC,2022-08-12,4.0,
Cognizant,AUSTRALIA,"  Tableau Developers are build secure data layers using extracts or live connections, visualizations, and interfaces for Tableau dashboards.",software engineer,Tableau Developer,full-time,Sydney NSW,2022-08-07,3.9,
ELMO Talent Management Software,AUSTRALIA,"  You will be collaborating with product managers, product designers, and other high level software engineers. As part of a Scrum team, you will contribute to all…",software engineer,Senior Software Engineer,permanent,Sydney NSW,2022-08-10,,
TabCorp Holdings,AUSTRALIA,"  You are a software engineering expert delivering API technical capability and will and plan, design, coordinate and execute high quality technology solutions.",software engineer,Software Engineer - API,permanent,Sydney NSW,2022-07-17,3.8,
Iress Limited,AUSTRALIA,"  Strong software engineering fundamentals - OO programming and Domain Driven Design,. We are focusing on improving the supportability and developer practices of…",software engineer,Engineer,part-time,Remote in Melbourne VIC+1 location,2022-07-17,3.4,
NotesEdu,AUSTRALIA,"  High-level ownership of products you engineer, and seeing through a project from conception to launching and gathering feedback.",software engineer,Senior Software Engineer (Full Stack) – Remote,part-time,Remote,2022-07-17,,
Macquarie Group Limited,AUSTRALIA,"  In this role, you will design and develop HTML email communications for Macquarie Banking and Financial Services (BFS), within the Salesforce Marketing Cloud…",software engineer,Front End EDM Developer,permanent,Sydney NSW,2022-07-17,3.8,
Q-CTRL,AUSTRALIA,"  The back-end engineering team works closely with our Quantum Control Engineering, Front-end Engineering, DevOps Engineering, Product, Marketing and Design teams…",software engineer,Senior Software Engineer (Back-end),permanent,Remote in Sydney NSW,2022-07-17,,
dcode Group,AUSTRALIA,"  As a front-end developer, we're keen to see that you have an eye for detail and design; but at the same time are aware of integrating with API-driven solutions.",software engineer,Vue Developer,,Australia,2022-07-28,,
Macquarie Group Limited,AUSTRALIA,"  You will have experience in risk management and applying a risk mindset in day-to-day activities. 2+ years’ experience with Microsoft 365, Teams, SharePoint…",software engineer,Cloud Migration Engineer,permanent,Sydney NSW,2022-07-17,3.8,
Ambire,AUSTRALIA,"  Our skills span across the management of Paid Media campaigns on Google, Facebook, Instagram and. YouTube, SEO, Display, Data and Analytics, and Programmatic…",software engineer,Front End Developer.,,Neutral Bay NSW,2022-07-17,,
Sniip,AUSTRALIA,"  Our office is an open plan, warehouse style space above the bustling Fish Lane in the trendiest part of South Brisbane.",software engineer,Graduate Mobile Developer,graduate,South Brisbane QLD,2022-07-22,,
Deloitte,AUSTRALIA,"  This is not a client-facing role, but a position of a full-time developer for a software platform/product. Senior Microsoft SQL Server Developer (T-SQL).",software engineer,Senior SQL Server Developer (T-SQL),full-time,Remote in Melbourne VIC 3000,2022-07-21,3.9,
Camilla,AUSTRALIA,"  You will need to have experience using Shopify, a solid understanding of OOP and Vanilla JS in the DOM in order to hit the ground running.",software engineer,Web Developer,permanent,Alexandria NSW,2022-07-17,4.2,
Humanology,AUSTRALIA,"  You will have strong experience writing production-quality software, and champion modern software engineering best practices in the areas of Agile, DevSecOps…",software engineer,Senior Software Engineer,permanent,Adelaide CBD SA 5000,2022-08-15,,
WebZeb Solutions,AUSTRALIA,"  Design and built advanced applications for platforms. Collaborate with cross-functional teams to define, design and ship new features.",software engineer,iOS Developer,,Melbourne VIC 3000,2022-07-17,,
FIS Global,AUSTRALIA,"  You will be involved in the full software development life cycle including designing, coding, testing, implementing, and maintaining software that is delivered…",software engineer,.Net Software Engineer,full-time,Sydney NSW 2000,2022-07-17,3.4,
WEX Inc.,AUSTRALIA,  Strong demonstrated experience in commercial software development experience; A track record in identifying and executing upon improvements in building software…,software engineer,Senior Software Development Engineer,full-time,Melbourne VIC,2022-07-17,,
Caterpillar,AUSTRALIA,  Aware of Functional Safety and its impact on software development. Experienced in developing and deploying software to a Linux-based environment (Debian/OpenWRT…,software engineer,Sr. Software Engineer,full-time,Tullamarine VIC,2022-08-05,3.8,
Bravura Solutions,AUSTRALIA,"  As a Cloud Engineer in the Managed Cloud team, you will focus on building and supporting AWS infrastructure and Kubernetes clusters using Infrastructure as Code…",software engineer,Cloud Engineer,permanent,Remote in Sydney NSW+2 locations,2022-07-26,,
Dialog Information Technology,AUSTRALIA,"  Demonstrated expertise in scientific software development, particularly in the Python language, including development, maintenance and documentation.",software engineer,Python Developers,,Canberra ACT,2022-07-17,4.0,
FinXL,AUSTRALIA,"  Assist with software development, unit testing and integration activities, including creation of software code, database, other scripts and documentation.",software engineer,Junior .Net Developer,undefined,Adelaide Region SA,2022-08-04,,350-550
Accenture,AUSTRALIA,  Troubleshoot interface software and debug application codes. Experience with browser-based debugging and performance testing software.,software engineer,Front End Developer,full-time,Brisbane QLD+4 locations,2022-07-17,4.0,
Amazon Corporate Services Pty,AUSTRALIA,  Create and review software design documentation and mentor junior engineers. Operate the software you’re putting into production.,software engineer,"Software Development Engineer, Internet Capacity",full-time,New South Wales,2022-07-17,3.5,
Australian National University,AUSTRALIA,"  Develop software and workflows to assist staff and students from CLEX to efficiently build, validate, run and analyse computational models.",software engineer,Scientific Programmer,undefined,Canberra ACT,2022-08-02,4.2,92100-96713
Objective,AUSTRALIA,  Helping guide the team members on best practice Java software development. Helping design and develop our core software offerings across our product suite of…,software engineer,Senior Software Engineer,full-time,Wollongong NSW,2022-07-17,,
Rome2rio,AUSTRALIA,"  We have data scientists, software engineers, designers and product managers all working together. Users engage with Rome2rio to find the option they want to…",software engineer,Front End Developer,undefined,Melbourne VIC,2022-07-17,,30
Marlo,AUSTRALIA,  Marlo is seeking Microservices and API Developers to join our team and work on exciting projects with our clients. Java development experience – 2+ years.,software engineer,Developer / Software Engineer,full-time,Melbourne VIC,2022-08-04,,
S&amp;P Global,AUSTRALIA,  You will work with tools and technologies including (you don’t need experience of all of these !). BSc in Computer Science or equivalent degree.,software engineer,Associate II Software Engineer,full-time,Sydney NSW,2022-07-17,3.9,
Canva,AUSTRALIA,"  We need them to be comfortable with the fundamentals of database internals (data structures, threading, etc). Design and implement processes, tools, automation,…",software engineer,Software Engineer - Core Data (Open to Remote across ANZ),full-time,Remote in Sydney NSW,2022-07-17,3.8,
Telstra Purple,AUSTRALIA,"  Confidence in applying Agile software delivery principles and Continuous Delivery practices. As a Consultant, you will help to deliver innovative solutions for…",software engineer,Software Development Consultant,permanent,Brisbane QLD+2 locations,2022-07-17,3.0,
Bitpool,AUSTRALIA,"  Appropriate understanding of CI/CD, and best practices and software guidelines. Ability to collaborate with key stakeholders in the business, UI/UX, BA, product…",software engineer,Front End Developer,full-time,Darra QLD,2022-07-28,,
Amazon Support Services PtyLtd,AUSTRALIA,"  Experience developing cloud software services for scalability, performance and reliability. Knowledge of professional software engineering practices &amp; best…",software engineer,"Software Development Engineer, Alexa AI",full-time,Melbourne VIC,2022-07-17,3.5,
Service Victoria,AUSTRALIA,"  Full time, fixed-term position (12months). Work from home and either our Ballarat or Footscray Offices or our various Hubs.",software engineer,Senior Software Engineer,full-time,Temporarily Remote in Victoria,2022-08-13,,
Canva,AUSTRALIA,  Work to improve/maintain internal developer experience platforms that empower engineers to work efficiently. Work with product engineering teams to ensure build…,software engineer,Senior Software Engineer (Bazel),full-time,Remote in Sydney NSW,2022-07-17,3.8,
Ocean Software,AUSTRALIA,"  Proven knowledge and successful execution of software development methodologies. Develop, test, and support our software-based products.",software engineer,Software Engineer (Front end),,Hybrid remote in Melbourne VIC,2022-07-17,,
ANZ Banking Group,AUSTRALIA,"  Experience testing software in an automated fashion; eg experience with Java, Java Script, JUnit, SQLs, Jira; comfortable working in Operating systems: Unix,…",software engineer,QA Automation Engineer,undefined,Melbourne VIC,2022-07-29,4.1,500
NSW Government -Service NSW,AUSTRALIA,"  Expertise. You have a strong software engineering background, including experience in full stack web development with exposure to a broad range of technologies.",software engineer,Principal Software Engineer,,Sydney NSW,2022-07-17,4.0,
"WorkJam, Inc.",AUSTRALIA,  Collaborate with a team of experienced engineers and support professionals. 5+ years of Java development experience within a professional software environment.,software engineer,Backend Application Support Developer,full-time,Hybrid remote in Melbourne VIC,2022-08-13,,
OFX,AUSTRALIA,"  Experience in coaching and mentoring engineers across multiple disciplines. Work with the engineers and security analysts, to help improve our coding practices…",software engineer,Principal Software Engineer- Frontend (Open to remote locati...,full-time,Sydney NSW 2000,2022-07-22,,
Careerlink People Solutions,AUSTRALIA,"  Experience across full software development lifecycle including Analysis, Development, Testing, Configuration Management, Deployment and Release.",software engineer,Software Engineer South Australia (SA),,Australia,2022-07-17,,
Electronic Arts,AUSTRALIA,"  As a software engineer in test, you will contribute to our automation efforts by collaboratively identifying areas suitable for testing, designing scripts and…",software engineer,Software Engineer in Test,full-time,Melbourne VIC,2022-07-17,,
NTT Ltd,AUSTRALIA,"  Develops, integrates and implements applications components including front-end development, server-side development and database integration.",software engineer,Front End Developer,full-time,Remote in Melbourne VIC,2022-07-17,3.6,
FIS Global,AUSTRALIA,  Understanding of Agile software development model. This will also include interacting with engineering groups to assist in designing changes to the software.,software engineer,Software Engineer II,full-time,Hybrid remote in Sydney NSW 2000+1 location,2022-07-17,3.4,
Deloitte,AUSTRALIA,"  Deloitte Digital is committed to helping clients unlock the business value of emerging technologies. Through nineteen studios spread across the globe, we…",software engineer,Android Developer,,Melbourne VIC 3000,2022-07-17,3.9,
Oracle,AUSTRALIA,  Firm grasp of cloud software concepts. Good familiarity and understanding of software design patterns. You will be responsible for defining and developing…,software engineer,Principal Software Engineer - Java,,Australia,2022-07-21,3.8,
NSW Government -Service NSW,AUSTRALIA,"  Expertise. You will have previous experience in software development. You may not be a full-stack engineer yet, but you can design and implement system…",software engineer,Regional Software Engineer,,Temporarily Remote in New South Wales,2022-07-17,4.0,
Assemblyai Remote,AUSTRALIA,"  Hundreds of companies, and thousands of developers, use our APIs to both transcribe and understand millions of videos, podcasts, phone calls, and zoom meetings…",software engineer,"Staff Software Engineer, Python",,Remote in Sydney NSW,2022-08-04,,
It Hub Canberra Pty Ltd,AUSTRALIA,"  Reporting to the Applications Development Manager / Team Lead, you will be responsible for analysing, assessing, designing, developing, testing, implementing…",software engineer,Analyst Programmer / Software Engineer,undefined,Sydney NSW,2022-08-09,,75000-85000
UBS,AUSTRALIA,"  We are seeking a talented software engineer with a background in software architecture, integration, development and testing to become part of our software team…",software engineer,Senior Software Engineer,part-time,Sydney NSW,2022-07-17,3.8,
Accenture,AUSTRALIA,  You will be working with solution architects and integration engineers to define and build optimum integration solutions.,software engineer,Java Developer,full-time,Brisbane QLD+5 locations,2022-07-17,4.0,
Abyss Solutions,AUSTRALIA,"  The team comprises highly competent software engineers with skills in robotics, computer vision, sensor technology and civil engineering.",software engineer,Software / Data Operations Engineer - Level 5,,Remote in Homebush NSW,2022-08-14,,
Titan Recruitment,AUSTRALIA,"  You will be responsible for delivering top-notch software solutions, testing and coding across a range of technologies such as C#, ASP.",software engineer,Software Developer,permanent,Perth WA+1 location,2022-07-23,,
Growild Technology Pty Ltd,AUSTRALIA,"  This role reports to the IT Head of Department (HoD). Maintain existing mobile application code, investigate and fix issues from customer feedback, analyse…",software engineer,Software Engineer Team Lead,undefined,Remote in Chatswood NSW,2022-08-10,,80000-100000
Goldman Sachs,AUSTRALIA,  Proactively engages with stakeholders through the software development lifecycle (SDLC) of the projects. Goldman Sachs Engineers are innovators and problem…,software engineer,Software Engineer – FICC Boltweb Technology,full-time,Sydney NSW 2000,2022-07-17,4.0,
RunTime,AUSTRALIA,  Join an excellent team of highly experienced embedded engineers working together to create unique products used throughout the world.,software engineer,Fully REMOTE - Embedded Linux Software Engineer,,Remote in Melbourne VIC,2022-07-17,,
Macquarie Group Limited,AUSTRALIA,"  Strong knowledge of UNIX (Redhat). In-depth knowledge of troubleshooting, capacity planning and performance tuning. Work type: Permanent - Full time.",software engineer,Linux DevOps Engineer,permanent,Sydney NSW,2022-07-17,3.8,
Queensland Police Service,AUSTRALIA,"  Contribute to all stages of the software development process including designing, coding, reviewing, testing, correcting and documenting complex system…",software engineer,Software Developer,contract,Brisbane QLD,2022-07-17,3.9,
Mission Solutions,AUSTRALIA,  The Geospatial team leads the development of software and geospatial solutions and the provision of geospatial products at Nova Systems.,software engineer,Cloud DevOps Engineer,full-time,Majura ACT,2022-07-17,4.0,
Sitback Solutions,AUSTRALIA,"  Taking ownership of projects to ensure quality and on-time delivery led by our Tech Leads. Web solution development, specialising in PHP.",software engineer,Senior PHP Developer,,Remote,2022-07-17,,
Tyro,AUSTRALIA,"  Passion for creating quality software and up to date on new technologies. You will work closely with our awesome teams and individuals in engineering, product…",software engineer,Software Engineer - Banking,full-time,Sydney NSW,2022-07-17,,
Appian,AUSTRALIA,"  Bachelor's degree in Computer Science, Computer Engineering, or similar. Fluent in any modern programming language and comfortable working in Java.",software engineer,Software Engineer,,Sydney NSW,2022-07-17,,
Tyro,AUSTRALIA,"  Experience with agile software development methodologies. A collaborative approach to working together with other engineers, product managers and UX designers.",software engineer,Software Engineer/Developer Programmer,full-time,Remote in Sydney NSW,2022-07-17,,
Nine,AUSTRALIA,"  The Nine Publishing Technology team build and maintain some of the most highly respected and visited websites and mobile apps in Australia, including The Sydney…",software engineer,Senior Software Engineer,full-time,Hybrid remote in North Sydney NSW 2060,2022-08-05,3.8,
Mission Solutions,AUSTRALIA,  Contributing to the preparation of technical documentation and software architecture documents. Strong software development and coding skills using modern…,software engineer,Software Engineer - Adelaide,full-time,Mile End SA,2022-07-17,4.0,
NSW Government -Transport For NSW,AUSTRALIA,"  Employment Type: Permanent Full-Time. We are a trusted partner to our clients, within Customer Strategy and Technology, developing and delivering smart,…",software engineer,Systems Engineer (Cloud),undefined,Temporarily Remote in Sydney NSW,2022-08-12,4.0,120423-134872
Macquarie Group Limited,AUSTRALIA,"  Software development skills in one of the following languages: Java, Spring Boot, ReactJS. You will help us to realise our vision to become a fully automated,…",software engineer,DevOps Engineer,permanent,Sydney NSW,2022-07-17,3.8,
Macquarie Group Limited,AUSTRALIA,  In-depth knowledge and practical experience as a software engineer using cloud technologies (aws preferred). You will have an Agile mindset and keen interest in…,software engineer,Senior Full Stack Engineer,permanent,Remote in Sydney NSW,2022-07-17,3.8,
Deloitte,AUSTRALIA,"  Minimum 1-2 years’ experience across software engineering disciplines and Microsoft. Working within a team including Deloitte technical leaders, architects and…",software engineer,.NET Software Developer - Brisbane,,Brisbane QLD 4000+1 location,2022-07-17,3.9,
DXC Technology,AUSTRALIA,  You have a good attention to detail and know how to keep on top of things in a dynamic and exciting environment. You will also be able to obtain ITAR Clearance.,software engineer,Software Engineers,graduate,Macquarie Park NSW+1 location,2022-07-17,3.2,
DXC Technology,AUSTRALIA,  You have a good attention to detail and know how to keep on top of things in a dynamic and exciting environment. Object oriented design and programming.,software engineer,Software Engineers- Ada,graduate,Remote in Mawson Lakes SA,2022-07-17,3.2,
Infosys,AUSTRALIA,"  Ensuring software developed meets quality standards through code and design reviews. As a Full stack developer, you will be responsible for solutioning and…",software engineer,Python Developer,,Melbourne VIC,2022-07-17,3.9,
Panthera Finance,AUSTRALIA,"  A degree in software development. At least 1-2 years’ experience in software development with .NET/. Job Type: Permanent - Full Time. NET, Angular and MS-SQL.",software engineer,Full Stack .Net Developer (Junior/Mid-level),permanent,Remote in Brisbane QLD,2022-08-07,2.8,
Bupa,AUSTRALIA,"  Good understanding of software design principles and patterns. NET, Sitecore, JavaScript, HTML, CSS and Azure cloud platforms utilizing industry standard…",software engineer,.Net Developer,permanent,Remote in Victoria,2022-08-06,3.3,
Capgemini Australia,AUSTRALIA,"  Digital Engineering combine design and technology with modern delivery mythologies to deliver experience oriented, scalable, sustainable and secure enterprise…",software engineer,.NET Developer,full-time,Hobart TAS,2022-07-17,3.8,
Officeworks,AUSTRALIA,"  The role will be responsible for planning, designing, coordinating and executing solutions to existing and new systems. A key focus on wellbeing and safety.",software engineer,Software Developer,,North Rocks NSW,2022-08-04,3.7,
Plutora,AUSTRALIA,  Develop new user-facing features. Build reusable code and libraries for future use. Ensure the technical feasibility of UI/UX designs or integrations…,software engineer,Front-End Developer,,Melbourne VIC,2022-08-02,3.5,
